Vuln ID|Summary|Published Date|CVSS Severity|Link
CVE-1999-0001|ip_input.c in BSD-derived TCP/IP implementations allows remote attackers to cause a denial of service (crash or hang) via crafted packets.|December 30, 1999; 12:00:00 AM -0500|V3.x:(not available)       V2.0: 5.0 MEDIUM (https://nvd.nist.gov/vuln-metrics/cvss/v2-calculator?name=CVE-1999-0001&vector=(AV:N/AC:L/Au:N/C:N/I:N/A:P)&version=2.0&source=NIST)|https://nvd.nist.gov/vuln/detail/CVE-1999-0001
CVE-1999-0002|Buffer overflow in NFS mountd gives root access to remote attackers, mostly in Linux systems.|October 12, 1998; 12:00:00 AM -0400|V3.x:(not available)       V2.0: 10.0 HIGH (https://nvd.nist.gov/vuln-metrics/cvss/v2-calculator?name=CVE-1999-0002&vector=(AV:N/AC:L/Au:N/C:C/I:C/A:C)&version=2.0&source=NIST)|https://nvd.nist.gov/vuln/detail/CVE-1999-0002
CVE-1999-0003|Execute commands as root via buffer overflow in Tooltalk database server (rpc.ttdbserverd).|April 01, 1998; 12:00:00 AM -0500|V3.x:(not available)       V2.0: 10.0 HIGH (https://nvd.nist.gov/vuln-metrics/cvss/v2-calculator?name=CVE-1999-0003&vector=(AV:N/AC:L/Au:N/C:C/I:C/A:C)&version=2.0&source=NIST)|https://nvd.nist.gov/vuln/detail/CVE-1999-0003
CVE-1999-0004|MIME buffer overflow in email clients, e.g. Solaris mailtool and Outlook.|December 16, 1997; 12:00:00 AM -0500|V3.x:(not available)       V2.0: 5.0 MEDIUM (https://nvd.nist.gov/vuln-metrics/cvss/v2-calculator?name=CVE-1999-0004&vector=(AV:N/AC:L/Au:N/C:N/I:N/A:P)&version=2.0&source=NIST)|https://nvd.nist.gov/vuln/detail/CVE-1999-0004
CVE-1999-0005|Arbitrary command execution via IMAP buffer overflow in authenticate command.|July 20, 1998; 12:00:00 AM -0400|V3.x:(not available)       V2.0: 10.0 HIGH (https://nvd.nist.gov/vuln-metrics/cvss/v2-calculator?name=CVE-1999-0005&vector=(AV:N/AC:L/Au:N/C:C/I:C/A:C)&version=2.0&source=NIST)|https://nvd.nist.gov/vuln/detail/CVE-1999-0005
CVE-1999-0006|Buffer overflow in POP servers based on BSD/Qualcomm's qpopper allows remote attackers to gain root access using a long PASS command.|July 14, 1998; 12:00:00 AM -0400|V3.x:(not available)       V2.0: 10.0 HIGH (https://nvd.nist.gov/vuln-metrics/cvss/v2-calculator?name=CVE-1999-0006&vector=(AV:N/AC:L/Au:N/C:C/I:C/A:C)&version=2.0&source=NIST)|https://nvd.nist.gov/vuln/detail/CVE-1999-0006
CVE-1999-0007|Information from SSL-encrypted sessions via PKCS #1.|June 26, 1998; 12:00:00 AM -0400|V3.x:(not available)       V2.0: 5.0 MEDIUM (https://nvd.nist.gov/vuln-metrics/cvss/v2-calculator?name=CVE-1999-0007&vector=(AV:N/AC:L/Au:N/C:P/I:N/A:N)&version=2.0&source=NIST)|https://nvd.nist.gov/vuln/detail/CVE-1999-0007
CVE-1999-0008|Buffer overflow in NIS+, in Sun's rpc.nisd program.|June 08, 1998; 12:00:00 AM -0400|V3.x:(not available)       V2.0: 10.0 HIGH (https://nvd.nist.gov/vuln-metrics/cvss/v2-calculator?name=CVE-1999-0008&vector=(AV:N/AC:L/Au:N/C:C/I:C/A:C)&version=2.0&source=NIST)|https://nvd.nist.gov/vuln/detail/CVE-1999-0008
CVE-1999-0009|Inverse query buffer overflow in BIND 4.9 and BIND 8 Releases.|April 08, 1998; 12:00:00 AM -0400|V3.x:(not available)       V2.0: 10.0 HIGH (https://nvd.nist.gov/vuln-metrics/cvss/v2-calculator?name=CVE-1999-0009&vector=(AV:N/AC:L/Au:N/C:C/I:C/A:C)&version=2.0&source=NIST)|https://nvd.nist.gov/vuln/detail/CVE-1999-0009
CVE-1999-0010|Denial of Service vulnerability in BIND 8 Releases via maliciously formatted DNS messages.|April 08, 1998; 12:00:00 AM -0400|V3.x:(not available)       V2.0: 5.0 MEDIUM (https://nvd.nist.gov/vuln-metrics/cvss/v2-calculator?name=CVE-1999-0010&vector=(AV:N/AC:L/Au:N/C:N/I:N/A:P)&version=2.0&source=NIST)|https://nvd.nist.gov/vuln/detail/CVE-1999-0010
CVE-1999-0011|Denial of Service vulnerabilities in BIND 4.9 and BIND 8 Releases via CNAME record and zone transfer.|April 08, 1998; 12:00:00 AM -0400|V3.x:(not available)       V2.0: 10.0 HIGH (https://nvd.nist.gov/vuln-metrics/cvss/v2-calculator?name=CVE-1999-0011&vector=(AV:N/AC:L/Au:N/C:C/I:C/A:C)&version=2.0&source=NIST)|https://nvd.nist.gov/vuln/detail/CVE-1999-0011
CVE-1999-0012|Some web servers under Microsoft Windows allow remote attackers to bypass access restrictions for files with long file names.|February 06, 1998; 12:00:00 AM -0500|V3.x:(not available)       V2.0: 5.0 MEDIUM (https://nvd.nist.gov/vuln-metrics/cvss/v2-calculator?name=CVE-1999-0012&vector=(AV:N/AC:L/Au:N/C:P/I:N/A:N)&version=2.0&source=NIST)|https://nvd.nist.gov/vuln/detail/CVE-1999-0012
CVE-1999-0013|Stolen credentials from SSH clients via ssh-agent program, allowing other local users to access remote accounts belonging to the ssh-agent user.|January 22, 1998; 12:00:00 AM -0500|V3.x:(not available)       V2.0: 7.5 HIGH (https://nvd.nist.gov/vuln-metrics/cvss/v2-calculator?name=CVE-1999-0013&vector=(AV:N/AC:L/Au:N/C:P/I:P/A:P)&version=2.0&source=NIST)|https://nvd.nist.gov/vuln/detail/CVE-1999-0013
CVE-1999-0014|Unauthorized privileged access or denial of service via dtappgather program in CDE.|January 21, 1998; 12:00:00 AM -0500|V3.x:(not available)       V2.0: 7.2 HIGH (https://nvd.nist.gov/vuln-metrics/cvss/v2-calculator?name=CVE-1999-0014&vector=(AV:L/AC:L/Au:N/C:C/I:C/A:C)&version=2.0&source=NIST)|https://nvd.nist.gov/vuln/detail/CVE-1999-0014
CVE-1999-0015|Teardrop IP denial of service.|December 16, 1997; 12:00:00 AM -0500|V3.x:(not available)       V2.0: 5.0 MEDIUM (https://nvd.nist.gov/vuln-metrics/cvss/v2-calculator?name=CVE-1999-0015&vector=(AV:N/AC:L/Au:N/C:N/I:N/A:P)&version=2.0&source=NIST)|https://nvd.nist.gov/vuln/detail/CVE-1999-0015
CVE-1999-0016|Land IP denial of service.|December 01, 1997; 12:00:00 AM -0500|V3.x:(not available)       V2.0: 5.0 MEDIUM (https://nvd.nist.gov/vuln-metrics/cvss/v2-calculator?name=CVE-1999-0016&vector=(AV:N/AC:L/Au:N/C:N/I:N/A:P)&version=2.0&source=NIST)|https://nvd.nist.gov/vuln/detail/CVE-1999-0016
CVE-1999-0017|FTP servers can allow an attacker to connect to arbitrary ports on machines other than the FTP client, aka FTP bounce.|December 10, 1997; 12:00:00 AM -0500|V3.x:(not available)       V2.0: 7.5 HIGH (https://nvd.nist.gov/vuln-metrics/cvss/v2-calculator?name=CVE-1999-0017&vector=(AV:N/AC:L/Au:N/C:P/I:P/A:P)&version=2.0&source=NIST)|https://nvd.nist.gov/vuln/detail/CVE-1999-0017
CVE-1999-0018|Buffer overflow in statd allows root privileges.|December 05, 1997; 12:00:00 AM -0500|V3.x:(not available)       V2.0: 10.0 HIGH (https://nvd.nist.gov/vuln-metrics/cvss/v2-calculator?name=CVE-1999-0018&vector=(AV:N/AC:L/Au:N/C:C/I:C/A:C)&version=2.0&source=NIST)|https://nvd.nist.gov/vuln/detail/CVE-1999-0018
CVE-1999-0019|Delete or create a file via rpc.statd, due to invalid information.|April 24, 1996; 12:00:00 AM -0400|V3.x:(not available)       V2.0: 5.0 MEDIUM (https://nvd.nist.gov/vuln-metrics/cvss/v2-calculator?name=CVE-1999-0019&vector=(AV:N/AC:L/Au:N/C:N/I:P/A:N)&version=2.0&source=NIST)|https://nvd.nist.gov/vuln/detail/CVE-1999-0019
CVE-1999-0021|Arbitrary command execution via buffer overflow in Count.cgi (wwwcount) cgi-bin program.|November 05, 1997; 12:00:00 AM -0500|V3.x:(not available)       V2.0: 7.5 HIGH (https://nvd.nist.gov/vuln-metrics/cvss/v2-calculator?name=CVE-1999-0021&vector=(AV:N/AC:L/Au:N/C:P/I:P/A:P)&version=2.0&source=NIST)|https://nvd.nist.gov/vuln/detail/CVE-1999-0021
CVE-1999-0022|Local user gains root privileges via buffer overflow in rdist, via expstr() function.|July 03, 1996; 12:00:00 AM -0400|V3.x:(not available)       V2.0: 7.2 HIGH (https://nvd.nist.gov/vuln-metrics/cvss/v2-calculator?name=CVE-1999-0022&vector=(AV:L/AC:L/Au:N/C:C/I:C/A:C)&version=2.0&source=NIST)|https://nvd.nist.gov/vuln/detail/CVE-1999-0022
CVE-1999-0023|Local user gains root privileges via buffer overflow in rdist, via lookup() function.|July 24, 1996; 12:00:00 AM -0400|V3.x:(not available)       V2.0: 7.2 HIGH (https://nvd.nist.gov/vuln-metrics/cvss/v2-calculator?name=CVE-1999-0023&vector=(AV:L/AC:L/Au:N/C:C/I:C/A:C)&version=2.0&source=NIST)|https://nvd.nist.gov/vuln/detail/CVE-1999-0023
CVE-1999-0024|DNS cache poisoning via BIND, by predictable query IDs.|August 13, 1997; 12:00:00 AM -0400|V3.x:(not available)       V2.0: 5.0 MEDIUM (https://nvd.nist.gov/vuln-metrics/cvss/v2-calculator?name=CVE-1999-0024&vector=(AV:N/AC:L/Au:N/C:N/I:P/A:N)&version=2.0&source=NIST)|https://nvd.nist.gov/vuln/detail/CVE-1999-0024
CVE-1999-0025|root privileges via buffer overflow in df command on SGI IRIX systems.|July 16, 1997; 12:00:00 AM -0400|V3.x:(not available)       V2.0: 7.2 HIGH (https://nvd.nist.gov/vuln-metrics/cvss/v2-calculator?name=CVE-1999-0025&vector=(AV:L/AC:L/Au:N/C:C/I:C/A:C)&version=2.0&source=NIST)|https://nvd.nist.gov/vuln/detail/CVE-1999-0025
CVE-1999-0026|root privileges via buffer overflow in pset command on SGI IRIX systems.|July 16, 1997; 12:00:00 AM -0400|V3.x:(not available)       V2.0: 4.6 MEDIUM (https://nvd.nist.gov/vuln-metrics/cvss/v2-calculator?name=CVE-1999-0026&vector=(AV:L/AC:L/Au:N/C:P/I:P/A:P)&version=2.0&source=NIST)|https://nvd.nist.gov/vuln/detail/CVE-1999-0026
CVE-1999-0027|root privileges via buffer overflow in eject command on SGI IRIX systems.|July 16, 1997; 12:00:00 AM -0400|V3.x:(not available)       V2.0: 7.2 HIGH (https://nvd.nist.gov/vuln-metrics/cvss/v2-calculator?name=CVE-1999-0027&vector=(AV:L/AC:L/Au:N/C:C/I:C/A:C)&version=2.0&source=NIST)|https://nvd.nist.gov/vuln/detail/CVE-1999-0027
CVE-1999-0028|root privileges via buffer overflow in login/scheme command on SGI IRIX systems.|July 16, 1997; 12:00:00 AM -0400|V3.x:(not available)       V2.0: 7.2 HIGH (https://nvd.nist.gov/vuln-metrics/cvss/v2-calculator?name=CVE-1999-0028&vector=(AV:L/AC:L/Au:N/C:C/I:C/A:C)&version=2.0&source=NIST)|https://nvd.nist.gov/vuln/detail/CVE-1999-0028
CVE-1999-0029|root privileges via buffer overflow in ordist command on SGI IRIX systems.|July 16, 1997; 12:00:00 AM -0400|V3.x:(not available)       V2.0: 7.2 HIGH (https://nvd.nist.gov/vuln-metrics/cvss/v2-calculator?name=CVE-1999-0029&vector=(AV:L/AC:L/Au:N/C:C/I:C/A:C)&version=2.0&source=NIST)|https://nvd.nist.gov/vuln/detail/CVE-1999-0029
CVE-1999-0030|root privileges via buffer overflow in xlock command on SGI IRIX systems.|July 16, 1997; 12:00:00 AM -0400|V3.x:(not available)       V2.0: 7.2 HIGH (https://nvd.nist.gov/vuln-metrics/cvss/v2-calculator?name=CVE-1999-0030&vector=(AV:L/AC:L/Au:N/C:C/I:C/A:C)&version=2.0&source=NIST)|https://nvd.nist.gov/vuln/detail/CVE-1999-0030
CVE-1999-0031|JavaScript in Internet Explorer 3.x and 4.x, and Netscape 2.x, 3.x and 4.x, allows remote attackers to monitor a user's web activities, aka the Bell Labs vulnerability.|July 08, 1997; 12:00:00 AM -0400|V3.x:(not available)       V2.0: 2.6 LOW (https://nvd.nist.gov/vuln-metrics/cvss/v2-calculator?name=CVE-1999-0031&vector=(AV:N/AC:H/Au:N/C:P/I:N/A:N)&version=2.0&source=NIST)|https://nvd.nist.gov/vuln/detail/CVE-1999-0031
CVE-1999-0032|Buffer overflow in lpr, as used in BSD-based systems including Linux, allows local users to execute arbitrary code as root via a long -C (classification) command line option.|October 25, 1996; 12:00:00 AM -0400|V3.x:(not available)       V2.0: 7.2 HIGH (https://nvd.nist.gov/vuln-metrics/cvss/v2-calculator?name=CVE-1999-0032&vector=(AV:L/AC:L/Au:N/C:C/I:C/A:C)&version=2.0&source=NIST)|https://nvd.nist.gov/vuln/detail/CVE-1999-0032
CVE-1999-0033|Command execution in Sun systems via buffer overflow in the at program.|June 12, 1997; 12:00:00 AM -0400|V3.x:(not available)       V2.0: 7.2 HIGH (https://nvd.nist.gov/vuln-metrics/cvss/v2-calculator?name=CVE-1999-0033&vector=(AV:L/AC:L/Au:N/C:C/I:C/A:C)&version=2.0&source=NIST)|https://nvd.nist.gov/vuln/detail/CVE-1999-0033
CVE-1999-0034|Buffer overflow in suidperl (sperl), Perl 4.x and 5.x.|May 29, 1997; 12:00:00 AM -0400|V3.x:(not available)       V2.0: 7.2 HIGH (https://nvd.nist.gov/vuln-metrics/cvss/v2-calculator?name=CVE-1999-0034&vector=(AV:L/AC:L/Au:N/C:C/I:C/A:C)&version=2.0&source=NIST)|https://nvd.nist.gov/vuln/detail/CVE-1999-0034
CVE-1999-0035|Race condition in signal handling routine in ftpd, allowing read/write arbitrary files.|May 29, 1997; 12:00:00 AM -0400|V3.x:(not available)       V2.0: 5.1 MEDIUM (https://nvd.nist.gov/vuln-metrics/cvss/v2-calculator?name=CVE-1999-0035&vector=(AV:N/AC:H/Au:N/C:P/I:P/A:P)&version=2.0&source=NIST)|https://nvd.nist.gov/vuln/detail/CVE-1999-0035
CVE-1999-0036|IRIX login program with a nonzero LOCKOUT parameter allows creation or damage to files.|May 26, 1997; 12:00:00 AM -0400|V3.x:(not available)       V2.0: 7.2 HIGH (https://nvd.nist.gov/vuln-metrics/cvss/v2-calculator?name=CVE-1999-0036&vector=(AV:L/AC:L/Au:N/C:C/I:C/A:C)&version=2.0&source=NIST)|https://nvd.nist.gov/vuln/detail/CVE-1999-0036
CVE-1999-0037|Arbitrary command execution via metamail package using message headers, when user processes attacker's message using metamail.|May 21, 1997; 12:00:00 AM -0400|V3.x:(not available)       V2.0: 7.5 HIGH (https://nvd.nist.gov/vuln-metrics/cvss/v2-calculator?name=CVE-1999-0037&vector=(AV:N/AC:L/Au:N/C:P/I:P/A:P)&version=2.0&source=NIST)|https://nvd.nist.gov/vuln/detail/CVE-1999-0037
CVE-1999-0038|Buffer overflow in xlock program allows local users to execute commands as root.|April 26, 1997; 12:00:00 AM -0400|V3.x:(not available)       V2.0: 7.2 HIGH (https://nvd.nist.gov/vuln-metrics/cvss/v2-calculator?name=CVE-1999-0038&vector=(AV:L/AC:L/Au:N/C:C/I:C/A:C)&version=2.0&source=NIST)|https://nvd.nist.gov/vuln/detail/CVE-1999-0038
CVE-1999-0039|webdist CGI program (webdist.cgi) in SGI IRIX allows remote attackers to execute arbitrary commands via shell metacharacters in the distloc parameter.|May 06, 1997; 12:00:00 AM -0400|V3.x:(not available)       V2.0: 7.5 HIGH (https://nvd.nist.gov/vuln-metrics/cvss/v2-calculator?name=CVE-1999-0039&vector=(AV:N/AC:L/Au:N/C:P/I:P/A:P)&version=2.0&source=NIST)|https://nvd.nist.gov/vuln/detail/CVE-1999-0039
CVE-1999-0040|Buffer overflow in Xt library of X Windowing System allows local users to execute commands with root privileges.|May 01, 1997; 12:00:00 AM -0400|V3.x:(not available)       V2.0: 7.2 HIGH (https://nvd.nist.gov/vuln-metrics/cvss/v2-calculator?name=CVE-1999-0040&vector=(AV:L/AC:L/Au:N/C:C/I:C/A:C)&version=2.0&source=NIST)|https://nvd.nist.gov/vuln/detail/CVE-1999-0040
CVE-1999-0041|Buffer overflow in NLS (Natural Language Service).|February 13, 1997; 12:00:00 AM -0500|V3.x:(not available)       V2.0: 7.5 HIGH (https://nvd.nist.gov/vuln-metrics/cvss/v2-calculator?name=CVE-1999-0041&vector=(AV:N/AC:L/Au:N/C:P/I:P/A:P)&version=2.0&source=NIST)|https://nvd.nist.gov/vuln/detail/CVE-1999-0041
CVE-1999-0042|Buffer overflow in University of Washington's implementation of IMAP and POP servers.|April 07, 1997; 12:00:00 AM -0400|V3.x:(not available)       V2.0: 10.0 HIGH (https://nvd.nist.gov/vuln-metrics/cvss/v2-calculator?name=CVE-1999-0042&vector=(AV:N/AC:L/Au:N/C:C/I:C/A:C)&version=2.0&source=NIST)|https://nvd.nist.gov/vuln/detail/CVE-1999-0042
CVE-1999-0043|"Command execution via shell metachars in INN daemon (innd) 1.5 using ""newgroup"" and ""rmgroup"" control messages, and others."|December 04, 1996; 12:00:00 AM -0500|V3.x:(not available)       V2.0: 10.0 HIGH (https://nvd.nist.gov/vuln-metrics/cvss/v2-calculator?name=CVE-1999-0043&vector=(AV:N/AC:L/Au:N/C:C/I:C/A:C)&version=2.0&source=NIST)|https://nvd.nist.gov/vuln/detail/CVE-1999-0043
CVE-1999-0044|fsdump command in IRIX allows local users to obtain root access by modifying sensitive files.|December 03, 1996; 12:00:00 AM -0500|V3.x:(not available)       V2.0: 7.2 HIGH (https://nvd.nist.gov/vuln-metrics/cvss/v2-calculator?name=CVE-1999-0044&vector=(AV:L/AC:L/Au:N/C:C/I:C/A:C)&version=2.0&source=NIST)|https://nvd.nist.gov/vuln/detail/CVE-1999-0044
CVE-1999-0045|List of arbitrary files on Web host via nph-test-cgi script.|December 10, 1996; 12:00:00 AM -0500|V3.x:(not available)       V2.0: 7.5 HIGH (https://nvd.nist.gov/vuln-metrics/cvss/v2-calculator?name=CVE-1999-0045&vector=(AV:N/AC:L/Au:N/C:P/I:P/A:P)&version=2.0&source=NIST)|https://nvd.nist.gov/vuln/detail/CVE-1999-0045
CVE-1999-0046|Buffer overflow of rlogin program using TERM environmental variable.|February 06, 1997; 12:00:00 AM -0500|V3.x:(not available)       V2.0: 10.0 HIGH (https://nvd.nist.gov/vuln-metrics/cvss/v2-calculator?name=CVE-1999-0046&vector=(AV:N/AC:L/Au:N/C:C/I:C/A:C)&version=2.0&source=NIST)|https://nvd.nist.gov/vuln/detail/CVE-1999-0046
CVE-1999-0047|MIME conversion buffer overflow in sendmail versions 8.8.3 and 8.8.4.|January 28, 1997; 12:00:00 AM -0500|V3.x:(not available)       V2.0: 10.0 HIGH (https://nvd.nist.gov/vuln-metrics/cvss/v2-calculator?name=CVE-1999-0047&vector=(AV:N/AC:L/Au:N/C:C/I:C/A:C)&version=2.0&source=NIST)|https://nvd.nist.gov/vuln/detail/CVE-1999-0047
CVE-1999-0048|Talkd, when given corrupt DNS information, can be used to execute arbitrary commands with root privileges.|January 27, 1997; 12:00:00 AM -0500|V3.x:(not available)       V2.0: 10.0 HIGH (https://nvd.nist.gov/vuln-metrics/cvss/v2-calculator?name=CVE-1999-0048&vector=(AV:N/AC:L/Au:N/C:C/I:C/A:C)&version=2.0&source=NIST)|https://nvd.nist.gov/vuln/detail/CVE-1999-0048
CVE-1999-0049|Csetup under IRIX allows arbitrary file creation or overwriting.|January 08, 1997; 12:00:00 AM -0500|V3.x:(not available)       V2.0: 7.2 HIGH (https://nvd.nist.gov/vuln-metrics/cvss/v2-calculator?name=CVE-1999-0049&vector=(AV:L/AC:L/Au:N/C:C/I:C/A:C)&version=2.0&source=NIST)|https://nvd.nist.gov/vuln/detail/CVE-1999-0049
CVE-1999-0050|Buffer overflow in HP-UX newgrp program.|December 01, 1996; 12:00:00 AM -0500|V3.x:(not available)       V2.0: 7.2 HIGH (https://nvd.nist.gov/vuln-metrics/cvss/v2-calculator?name=CVE-1999-0050&vector=(AV:L/AC:L/Au:N/C:C/I:C/A:C)&version=2.0&source=NIST)|https://nvd.nist.gov/vuln/detail/CVE-1999-0050
CVE-1999-0051|Arbitrary file creation and program execution using FLEXlm LicenseManager, from versions 4.0 to 5.0, in IRIX.|January 06, 1997; 12:00:00 AM -0500|V3.x:(not available)       V2.0: 7.2 HIGH (https://nvd.nist.gov/vuln-metrics/cvss/v2-calculator?name=CVE-1999-0051&vector=(AV:L/AC:L/Au:N/C:C/I:C/A:C)&version=2.0&source=NIST)|https://nvd.nist.gov/vuln/detail/CVE-1999-0051
CVE-1999-0052|IP fragmentation denial of service in FreeBSD allows a remote attacker to cause a crash.|November 04, 1998; 12:00:00 AM -0500|V3.x:(not available)       V2.0: 5.0 MEDIUM (https://nvd.nist.gov/vuln-metrics/cvss/v2-calculator?name=CVE-1999-0052&vector=(AV:N/AC:L/Au:N/C:N/I:N/A:P)&version=2.0&source=NIST)|https://nvd.nist.gov/vuln/detail/CVE-1999-0052
CVE-1999-0053|TCP RST denial of service in FreeBSD.|October 13, 1998; 12:00:00 AM -0400|V3.x:(not available)       V2.0: 5.0 MEDIUM (https://nvd.nist.gov/vuln-metrics/cvss/v2-calculator?name=CVE-1999-0053&vector=(AV:N/AC:L/Au:N/C:N/I:N/A:P)&version=2.0&source=NIST)|https://nvd.nist.gov/vuln/detail/CVE-1999-0053
CVE-1999-0054|Sun's ftpd daemon can be subjected to a denial of service.|June 10, 1998; 12:00:00 AM -0400|V3.x:(not available)       V2.0: 5.0 MEDIUM (https://nvd.nist.gov/vuln-metrics/cvss/v2-calculator?name=CVE-1999-0054&vector=(AV:N/AC:L/Au:N/C:N/I:N/A:P)&version=2.0&source=NIST)|https://nvd.nist.gov/vuln/detail/CVE-1999-0054
CVE-1999-0055|Buffer overflows in Sun libnsl allow root access.|May 14, 1998; 12:00:00 AM -0400|V3.x:(not available)       V2.0: 7.2 HIGH (https://nvd.nist.gov/vuln-metrics/cvss/v2-calculator?name=CVE-1999-0055&vector=(AV:L/AC:L/Au:N/C:C/I:C/A:C)&version=2.0&source=NIST)|https://nvd.nist.gov/vuln/detail/CVE-1999-0055
CVE-1999-0056|Buffer overflow in Sun's ping program can give root access to local users.|September 09, 1998; 12:00:00 AM -0400|V3.x:(not available)       V2.0: 7.2 HIGH (https://nvd.nist.gov/vuln-metrics/cvss/v2-calculator?name=CVE-1999-0056&vector=(AV:L/AC:L/Au:N/C:C/I:C/A:C)&version=2.0&source=NIST)|https://nvd.nist.gov/vuln/detail/CVE-1999-0056
CVE-1999-0057|Vacation program allows command execution by remote users through a sendmail command.|November 16, 1998; 12:00:00 AM -0500|V3.x:(not available)       V2.0: 7.5 HIGH (https://nvd.nist.gov/vuln-metrics/cvss/v2-calculator?name=CVE-1999-0057&vector=(AV:N/AC:L/Au:N/C:P/I:P/A:P)&version=2.0&source=NIST)|https://nvd.nist.gov/vuln/detail/CVE-1999-0057
CVE-1999-0058|Buffer overflow in PHP cgi program, php.cgi allows shell access.|April 17, 1997; 12:00:00 AM -0400|V3.x:(not available)       V2.0: 7.5 HIGH (https://nvd.nist.gov/vuln-metrics/cvss/v2-calculator?name=CVE-1999-0058&vector=(AV:N/AC:L/Au:N/C:P/I:P/A:P)&version=2.0&source=NIST)|https://nvd.nist.gov/vuln/detail/CVE-1999-0058
CVE-1999-0059|IRIX fam service allows an attacker to obtain a list of all files on the server.|July 14, 1997; 12:00:00 AM -0400|V3.x:(not available)       V2.0: 7.1 HIGH (https://nvd.nist.gov/vuln-metrics/cvss/v2-calculator?name=CVE-1999-0059&vector=(AV:N/AC:M/Au:N/C:C/I:N/A:N)&version=2.0&source=NIST)|https://nvd.nist.gov/vuln/detail/CVE-1999-0059
CVE-1999-0060|Attackers can cause a denial of service in Ascend MAX and Pipeline routers with a malformed packet to the discard port, which is used by the Java Configurator tool.|March 16, 1998; 12:00:00 AM -0500|V3.x:(not available)       V2.0: 5.0 MEDIUM (https://nvd.nist.gov/vuln-metrics/cvss/v2-calculator?name=CVE-1999-0060&vector=(AV:N/AC:L/Au:N/C:N/I:N/A:P)&version=2.0&source=NIST)|https://nvd.nist.gov/vuln/detail/CVE-1999-0060
CVE-1999-0061|File creation and deletion, and remote execution, in the BSD line printer daemon (lpd).|October 02, 1997; 12:00:00 AM -0400|V3.x:(not available)       V2.0: 5.1 MEDIUM (https://nvd.nist.gov/vuln-metrics/cvss/v2-calculator?name=CVE-1999-0061&vector=(AV:N/AC:H/Au:N/C:P/I:P/A:P)&version=2.0&source=NIST)|https://nvd.nist.gov/vuln/detail/CVE-1999-0061
CVE-1999-0062|The chpass command in OpenBSD allows a local user to gain root access through file descriptor leakage.|August 03, 1998; 12:00:00 AM -0400|V3.x:(not available)       V2.0: 7.2 HIGH (https://nvd.nist.gov/vuln-metrics/cvss/v2-calculator?name=CVE-1999-0062&vector=(AV:L/AC:L/Au:N/C:C/I:C/A:C)&version=2.0&source=NIST)|https://nvd.nist.gov/vuln/detail/CVE-1999-0062
CVE-1999-0063|Cisco IOS 12.0 and other versions can be crashed by malicious UDP packets to the syslog port.|January 11, 1999; 12:00:00 AM -0500|V3.x:(not available)       V2.0: 5.0 MEDIUM (https://nvd.nist.gov/vuln-metrics/cvss/v2-calculator?name=CVE-1999-0063&vector=(AV:N/AC:L/Au:N/C:N/I:N/A:P)&version=2.0&source=NIST)|https://nvd.nist.gov/vuln/detail/CVE-1999-0063
CVE-1999-0064|Buffer overflow in AIX lquerylv program gives root access to local users.|May 26, 1997; 12:00:00 AM -0400|V3.x:(not available)       V2.0: 7.2 HIGH (https://nvd.nist.gov/vuln-metrics/cvss/v2-calculator?name=CVE-1999-0064&vector=(AV:L/AC:L/Au:N/C:C/I:C/A:C)&version=2.0&source=NIST)|https://nvd.nist.gov/vuln/detail/CVE-1999-0064
CVE-1999-0065|Multiple buffer overflows in how dtmail handles attachments allows a remote attacker to execute commands.|August 31, 1998; 12:00:00 AM -0400|V3.x:(not available)       V2.0: 7.5 HIGH (https://nvd.nist.gov/vuln-metrics/cvss/v2-calculator?name=CVE-1999-0065&vector=(AV:N/AC:L/Au:N/C:P/I:P/A:P)&version=2.0&source=NIST)|https://nvd.nist.gov/vuln/detail/CVE-1999-0065
CVE-1999-0066|AnyForm CGI remote execution.|July 31, 1995; 12:00:00 AM -0400|V3.x:(not available)       V2.0: 7.5 HIGH (https://nvd.nist.gov/vuln-metrics/cvss/v2-calculator?name=CVE-1999-0066&vector=(AV:N/AC:L/Au:N/C:P/I:P/A:P)&version=2.0&source=NIST)|https://nvd.nist.gov/vuln/detail/CVE-1999-0066
CVE-1999-0067|phf CGI program allows remote command execution through shell metacharacters.|March 20, 1996; 12:00:00 AM -0500|V3.x:(not available)       V2.0: 10.0 HIGH (https://nvd.nist.gov/vuln-metrics/cvss/v2-calculator?name=CVE-1999-0067&vector=(AV:N/AC:L/Au:N/C:C/I:C/A:C)&version=2.0&source=NIST)|https://nvd.nist.gov/vuln/detail/CVE-1999-0067
CVE-1999-0068|CGI PHP mylog script allows an attacker to read any file on the target server.|October 19, 1997; 12:00:00 AM -0400|V3.x:(not available)       V2.0: 7.5 HIGH (https://nvd.nist.gov/vuln-metrics/cvss/v2-calculator?name=CVE-1999-0068&vector=(AV:N/AC:L/Au:N/C:P/I:P/A:P)&version=2.0&source=NIST)|https://nvd.nist.gov/vuln/detail/CVE-1999-0068
CVE-1999-0069|Solaris ufsrestore buffer overflow.|April 29, 1998; 12:00:00 AM -0400|V3.x:(not available)       V2.0: 7.2 HIGH (https://nvd.nist.gov/vuln-metrics/cvss/v2-calculator?name=CVE-1999-0069&vector=(AV:L/AC:L/Au:N/C:C/I:C/A:C)&version=2.0&source=NIST)|https://nvd.nist.gov/vuln/detail/CVE-1999-0069
CVE-1999-0070|test-cgi program allows an attacker to list files on the server.|April 01, 1996; 12:00:00 AM -0500|V3.x:(not available)       V2.0: 5.0 MEDIUM (https://nvd.nist.gov/vuln-metrics/cvss/v2-calculator?name=CVE-1999-0070&vector=(AV:N/AC:L/Au:N/C:N/I:P/A:N)&version=2.0&source=NIST)|https://nvd.nist.gov/vuln/detail/CVE-1999-0070
CVE-1999-0071|Apache httpd cookie buffer overflow for versions 1.1.1 and earlier.|September 01, 1997; 12:00:00 AM -0400|V3.x:(not available)       V2.0: 7.5 HIGH (https://nvd.nist.gov/vuln-metrics/cvss/v2-calculator?name=CVE-1999-0071&vector=(AV:N/AC:L/Au:N/C:P/I:P/A:P)&version=2.0&source=NIST)|https://nvd.nist.gov/vuln/detail/CVE-1999-0071
CVE-1999-0072|Buffer overflow in AIX xdat gives root access to local users.|October 22, 1997; 12:00:00 AM -0400|V3.x:(not available)       V2.0: 7.2 HIGH (https://nvd.nist.gov/vuln-metrics/cvss/v2-calculator?name=CVE-1999-0072&vector=(AV:L/AC:L/Au:N/C:C/I:C/A:C)&version=2.0&source=NIST)|https://nvd.nist.gov/vuln/detail/CVE-1999-0072
CVE-1999-0073|Telnet allows a remote client to specify environment variables including LD_LIBRARY_PATH, allowing an attacker to bypass the normal system libraries and gain root access.|October 13, 1995; 12:00:00 AM -0400|V3.x:(not available)       V2.0: 10.0 HIGH (https://nvd.nist.gov/vuln-metrics/cvss/v2-calculator?name=CVE-1999-0073&vector=(AV:N/AC:L/Au:N/C:C/I:C/A:C)&version=2.0&source=NIST)|https://nvd.nist.gov/vuln/detail/CVE-1999-0073
