Vuln ID|Summary|Published Date|CVSS Severity|Link
CVE-2013-1598|A Command Injection vulnerability exists in Vivotek PT7135 IP Cameras 0300a and 0400a via the system.ntp parameter to the farseer.out binary file, which cold let a malicious user execute arbitrary code.|January 24, 2020; 2:15:11 PM -0500|V3.1: 8.8 HIGH      V2.0: 9.0 HIGH (https://nvd.nist.gov/vuln-metrics/cvss/v3-calculator?name=CVE-2013-1598&vector=AV:N/AC:L/PR:L/UI:N/S:U/C:H/I:H/A:H&version=3.1&source=NIST)|https://nvd.nist.gov/vuln/detail/CVE-2013-1598
CVE-2013-1599|A Command Injection vulnerability exists in the /var/www/cgi-bin/rtpd.cgi script in D-Link IP Cameras DCS-3411/3430 firmware 1.02, DCS-5605/5635 1.01, DCS-1100L/1130L 1.04, DCS-1100/1130 1.03, DCS-1100/1130 1.04_US, DCS-2102/2121 1.05_RU, DCS-3410 1.02, DCS-5230 1.02, DCS-5230L 1.02, DCS-6410 1.00, DCS-7410 1.00, DCS-7510 1.00, and WCS-1100 1.02, which could let a remote malicious user execute arbitrary commands through the cameras web interface.|January 28, 2020; 3:15:11 PM -0500|V3.1: 9.8 CRITICAL      V2.0: 10.0 HIGH (https://nvd.nist.gov/vuln-metrics/cvss/v3-calculator?name=CVE-2013-1599&vector=AV:N/AC:L/PR:N/UI:N/S:U/C:H/I:H/A:H&version=3.1&source=NIST)|https://nvd.nist.gov/vuln/detail/CVE-2013-1599
CVE-2013-1600|An Authentication Bypass vulnerability exists in upnp/asf-mp4.asf when streaming live video in D-Link TESCO DCS-2121 1.05_TESCO, TESCO DCS-2102 1.05_TESCO, DCS-2121 1.06_FR, 1.06, and 1.05_RU, DCS-2102 1.06_FR. 1.06, and 1.05_RU, which could let a malicious user obtain sensitive information.|January 28, 2020; 4:15:11 PM -0500|V3.1: 5.3 MEDIUM      V2.0: 5.0 MEDIUM (https://nvd.nist.gov/vuln-metrics/cvss/v3-calculator?name=CVE-2013-1600&vector=AV:N/AC:L/PR:N/UI:N/S:U/C:L/I:N/A:N&version=3.1&source=NIST)|https://nvd.nist.gov/vuln/detail/CVE-2013-1600
CVE-2013-1601|An Information Disclosure vulnerability exists due to a failure to restrict access on the lums.cgi script when processing a live video stream in D-LINK An Information Disclosure vulnerability exists due to a failure to restrict access on the lums.cgi script when processing a live video stream in D-LINK WCS-1100 1.02, TESCO DCS-2121 1.05_TESCO, TESCO DCS-2102 1.05_TESCO, DCS-7510 1.00, DCS-7410 1.00, DCS-6410 1.00, DCS-5635 1.01, DCS-5605 1.01, DCS-5230L 1.02, DCS-5230 1.02, DCS-3430 1.02, DCS-3411 1.02, DCS-3410 1.02, DCS-2121 1.06_FR, DCS-2121 1.06, DCS-2121 1.05_RU, DCS-2102 1.06_FR, DCS-2102 1.06, DCS-2102 1.05_RU, DCS-1130L 1.04, DCS-1130 1.04_US, DCS-1130 1.03, DCS-1100L 1.04, DCS-1100 1.04_US, and DCS-1100 1.03, which could let a malicious user obtain sensitive information. which could let a malicious user obtain sensitive information.|January 28, 2020; 4:15:11 PM -0500|V3.1: 5.3 MEDIUM      V2.0: 5.0 MEDIUM (https://nvd.nist.gov/vuln-metrics/cvss/v3-calculator?name=CVE-2013-1601&vector=AV:N/AC:L/PR:N/UI:N/S:U/C:L/I:N/A:N&version=3.1&source=NIST)|https://nvd.nist.gov/vuln/detail/CVE-2013-1601
CVE-2013-1602|An Information Disclosure vulnerability exists due to insufficient validation of authentication cookies for the RTSP session in D-Link DCS-5635 1.01, DCS-1100L 1.04, DCS-1130L 1.04, DCS-1100 1.03/1.04_US, DCS-1130 1.03/1.04_US , DCS-2102 1.05_RU/1.06/1.06_FR/1.05_TESCO, DCS-2121 1.05_RU/1.06/1.06_FR/1.05_TESCO, DCS-3410 1.02, DCS-5230 1.02, DCS-5230L 1.02, DCS-6410 1.0, DCS-7410 1.0, DCS-7510 1.0, and WCS-1100 1.02, which could let a malicious user obtain unauthorized access to video streams.|January 28, 2020; 5:15:10 PM -0500|V3.1: 7.5 HIGH      V2.0: 5.0 MEDIUM (https://nvd.nist.gov/vuln-metrics/cvss/v3-calculator?name=CVE-2013-1602&vector=AV:N/AC:L/PR:N/UI:N/S:U/C:H/I:N/A:N&version=3.1&source=NIST)|https://nvd.nist.gov/vuln/detail/CVE-2013-1602
CVE-2013-1603|An Authentication vulnerability exists in D-LINK WCS-1100 1.02, TESCO DCS-2121 1.05_TESCO, TESCO DCS-2102 1.05_TESCO, DCS-7510 1.00, DCS-7410 1.00, DCS-6410 1.00, DCS-5635 1.01, DCS-5605 1.01, DCS-5230L 1.02, DCS-5230 1.02, DCS-3430 1.02, DCS-3411 1.02, DCS-3410 1.02, DCS-2121 1.06_FR, DCS-2121 1.06, DCS-2121 1.05_RU, DCS-2102 1.06_FR, DCS-2102 1.06, DCS-2102 1.05_RU, DCS-1130L 1.04, DCS-1130 1.04_US, DCS-1130 1.03, DCS-1100L 1.04, DCS-1100 1.04_US, and DCS-1100 1.03 due to hard-coded credentials that serve as a backdoor, which allows remote attackers to access the RTSP video stream.|January 28, 2020; 5:15:10 PM -0500|V3.1: 5.3 MEDIUM      V2.0: 5.0 MEDIUM (https://nvd.nist.gov/vuln-metrics/cvss/v3-calculator?name=CVE-2013-1603&vector=AV:N/AC:L/PR:N/UI:N/S:U/C:L/I:N/A:N&version=3.1&source=NIST)|https://nvd.nist.gov/vuln/detail/CVE-2013-1603
CVE-2013-1607|Ruby PDFKit gem prior to 0.5.3 has a Code Execution Vulnerability|February 11, 2020; 1:15:15 PM -0500|V3.1: 9.8 CRITICAL      V2.0: 7.5 HIGH (https://nvd.nist.gov/vuln-metrics/cvss/v3-calculator?name=CVE-2013-1607&vector=AV:N/AC:L/PR:N/UI:N/S:U/C:H/I:H/A:H&version=3.1&source=NIST)|https://nvd.nist.gov/vuln/detail/CVE-2013-1607
CVE-2013-1631|Verax NMS prior to 2.1.0 leaks connection details when any user executes a Repair Table action|January 30, 2020; 9:15:11 AM -0500|V3.1: 5.3 MEDIUM      V2.0: 5.0 MEDIUM (https://nvd.nist.gov/vuln-metrics/cvss/v3-calculator?name=CVE-2013-1631&vector=AV:N/AC:L/PR:N/UI:N/S:U/C:L/I:N/A:N&version=3.1&source=NIST)|https://nvd.nist.gov/vuln/detail/CVE-2013-1631
CVE-2013-1634|A denial of service vulnerability exists in some motherboard implementations of Intel e1000e/82574L network controller devices through 2013-02-06 where the device can be brought into a non-processing state when parsing 32 hex, 33 hex, or 34 hex byte values at the 0x47f offset. NOTE: A followup statement from Intel suggests that the root cause of this issue was an incorrectly configured EEPROM image.|February 13, 2020; 5:15:11 PM -0500|V3.1: 7.5 HIGH      V2.0: 7.8 HIGH (https://nvd.nist.gov/vuln-metrics/cvss/v3-calculator?name=CVE-2013-1634&vector=AV:N/AC:L/PR:N/UI:N/S:U/C:N/I:N/A:H&version=3.1&source=NIST)|https://nvd.nist.gov/vuln/detail/CVE-2013-1634
CVE-2013-1642|Multiple cross-site scripting (XSS) vulnerabilities in QuiXplorer before 2.5.5 allow remote attackers to inject arbitrary web script or HTML via the (1) dir, (2) item, (3) order, (4) searchitem, (5) selitems[], or (6) srt parameter to index.php or (7) the QUERY_STRING to index.php.|January 02, 2020; 4:15:12 PM -0500|V3.1: 6.1 MEDIUM      V2.0: 4.3 MEDIUM (https://nvd.nist.gov/vuln-metrics/cvss/v3-calculator?name=CVE-2013-1642&vector=AV:N/AC:L/PR:N/UI:R/S:C/C:L/I:L/A:N&version=3.1&source=NIST)|https://nvd.nist.gov/vuln/detail/CVE-2013-1642
CVE-2013-1666|Foswiki before 1.1.8 contains a code injection vulnerability in the MAKETEXT macro.|November 01, 2019; 1:15:10 PM -0400|V3.1: 9.8 CRITICAL      V2.0: 6.8 MEDIUM (https://nvd.nist.gov/vuln-metrics/cvss/v3-calculator?name=CVE-2013-1666&vector=AV:N/AC:L/PR:N/UI:N/S:U/C:H/I:H/A:H&version=3.1&source=NIST)|https://nvd.nist.gov/vuln/detail/CVE-2013-1666
CVE-2013-1689|Mozilla Firefox 20.0a1 and earlier allows remote attackers to cause a denial of service (crash), related to event handling with frames.|December 10, 2019; 1:15:09 PM -0500|V3.1: 6.5 MEDIUM      V2.0: 4.3 MEDIUM (https://nvd.nist.gov/vuln-metrics/cvss/v3-calculator?name=CVE-2013-1689&vector=AV:N/AC:L/PR:N/UI:R/S:U/C:N/I:N/A:H&version=3.1&source=NIST)|https://nvd.nist.gov/vuln/detail/CVE-2013-1689
CVE-2013-1744|IRIS citations management tool through 1.3 allows remote attackers to execute arbitrary commands.|January 25, 2020; 2:15:11 PM -0500|V3.1: 9.8 CRITICAL      V2.0: 7.5 HIGH (https://nvd.nist.gov/vuln-metrics/cvss/v3-calculator?name=CVE-2013-1744&vector=AV:N/AC:L/PR:N/UI:N/S:U/C:H/I:H/A:H&version=3.1&source=NIST)|https://nvd.nist.gov/vuln/detail/CVE-2013-1744
CVE-2013-1751|TWiki before 5.1.4 allows remote attackers to execute arbitrary shell commands by sending a crafted '%MAKETEXT{}%' parameter value containing Perl backtick characters.|November 07, 2019; 5:15:10 PM -0500|V3.1: 9.8 CRITICAL      V2.0: 10.0 HIGH (https://nvd.nist.gov/vuln-metrics/cvss/v3-calculator?name=CVE-2013-1751&vector=AV:N/AC:L/PR:N/UI:N/S:U/C:H/I:H/A:H&version=3.1&source=NIST)|https://nvd.nist.gov/vuln/detail/CVE-2013-1751
CVE-2013-1753|The gzip_decode function in the xmlrpc client library in Python 3.4 and earlier allows remote attackers to cause a denial of service (memory consumption) via a crafted HTTP request.|March 11, 2020; 1:15:12 PM -0400|V3.1: 7.5 HIGH      V2.0: 5.0 MEDIUM (https://nvd.nist.gov/vuln-metrics/cvss/v3-calculator?name=CVE-2013-1753&vector=AV:N/AC:L/PR:N/UI:N/S:U/C:N/I:N/A:H&version=3.1&source=NIST)|https://nvd.nist.gov/vuln/detail/CVE-2013-1753
CVE-2013-1760|The Bug Genie before 3.2.6 has Multiple XSS and HTML Injection Vulnerabilities|February 11, 2020; 1:15:15 PM -0500|V3.1: 6.1 MEDIUM      V2.0: 4.3 MEDIUM (https://nvd.nist.gov/vuln-metrics/cvss/v3-calculator?name=CVE-2013-1760&vector=AV:N/AC:L/PR:N/UI:R/S:C/C:L/I:L/A:N&version=3.1&source=NIST)|https://nvd.nist.gov/vuln/detail/CVE-2013-1760
CVE-2013-1771|The web server Monkeyd produces a world-readable log (/var/log/monkeyd/master.log) on gentoo.|November 07, 2019; 6:15:10 PM -0500|V3.1: 7.5 HIGH      V2.0: 5.0 MEDIUM (https://nvd.nist.gov/vuln-metrics/cvss/v3-calculator?name=CVE-2013-1771&vector=AV:N/AC:L/PR:N/UI:N/S:U/C:H/I:N/A:N&version=3.1&source=NIST)|https://nvd.nist.gov/vuln/detail/CVE-2013-1771
CVE-2013-1793|openstack-utils openstack-db has insecure password creation|December 10, 2019; 9:15:10 AM -0500|V3.1: 7.5 HIGH      V2.0: 5.0 MEDIUM (https://nvd.nist.gov/vuln-metrics/cvss/v3-calculator?name=CVE-2013-1793&vector=AV:N/AC:L/PR:N/UI:N/S:U/C:H/I:N/A:N&version=3.1&source=NIST)|https://nvd.nist.gov/vuln/detail/CVE-2013-1793
CVE-2013-1809|Gambas before 3.4.0 allows remote attackers to move or manipulate directory contents or perform symlink attacks due to the creation of insecure temporary directories.|November 07, 2019; 6:15:10 PM -0500|V3.1: 7.5 HIGH      V2.0: 6.4 MEDIUM (https://nvd.nist.gov/vuln-metrics/cvss/v3-calculator?name=CVE-2013-1809&vector=AV:N/AC:L/PR:N/UI:N/S:U/C:N/I:H/A:N&version=3.1&source=NIST)|https://nvd.nist.gov/vuln/detail/CVE-2013-1809
CVE-2013-1811|"An access control issue in MantisBT before 1.2.13 allows users with ""Reporter"" permissions to change any issue to ""New""."|November 07, 2019; 6:15:10 PM -0500|V3.1: 4.3 MEDIUM      V2.0: 4.0 MEDIUM (https://nvd.nist.gov/vuln-metrics/cvss/v3-calculator?name=CVE-2013-1811&vector=AV:N/AC:L/PR:L/UI:N/S:U/C:N/I:L/A:N&version=3.1&source=NIST)|https://nvd.nist.gov/vuln/detail/CVE-2013-1811
CVE-2013-1816|MediaWiki before 1.19.4 and 1.20.x before 1.20.3 allows remote attackers to cause a denial of service (application crash) by sending a specially crafted request.|November 20, 2019; 3:15:10 PM -0500|V3.1: 7.5 HIGH      V2.0: 5.0 MEDIUM (https://nvd.nist.gov/vuln-metrics/cvss/v3-calculator?name=CVE-2013-1816&vector=AV:N/AC:L/PR:N/UI:N/S:U/C:N/I:N/A:H&version=3.1&source=NIST)|https://nvd.nist.gov/vuln/detail/CVE-2013-1816
CVE-2013-1817|MediaWiki before 1.19.4 and 1.20.x before 1.20.3 contains an error in the api.php script which allows remote attackers to obtain sensitive information.|November 20, 2019; 3:15:11 PM -0500|V3.1: 7.5 HIGH      V2.0: 5.0 MEDIUM (https://nvd.nist.gov/vuln-metrics/cvss/v3-calculator?name=CVE-2013-1817&vector=AV:N/AC:L/PR:N/UI:N/S:U/C:H/I:N/A:N&version=3.1&source=NIST)|https://nvd.nist.gov/vuln/detail/CVE-2013-1817
CVE-2013-1820|tuned before 2.x allows local users to kill running processes due to insecure permissions with tuned's ktune service.|November 08, 2019; 10:15:11 AM -0500|V3.1: 5.5 MEDIUM      V2.0: 4.7 MEDIUM (https://nvd.nist.gov/vuln-metrics/cvss/v3-calculator?name=CVE-2013-1820&vector=AV:L/AC:L/PR:L/UI:N/S:U/C:N/I:N/A:H&version=3.1&source=NIST)|https://nvd.nist.gov/vuln/detail/CVE-2013-1820
CVE-2013-1866|OpenSC OpenSC.tokend has an Arbitrary File Creation/Overwrite Vulnerability|January 30, 2020; 9:15:11 AM -0500|V3.1: 6.1 MEDIUM      V2.0: 6.3 MEDIUM (https://nvd.nist.gov/vuln-metrics/cvss/v3-calculator?name=CVE-2013-1866&vector=AV:P/AC:L/PR:N/UI:N/S:U/C:N/I:H/A:H&version=3.1&source=NIST)|https://nvd.nist.gov/vuln/detail/CVE-2013-1866
CVE-2013-1867|Gemalto Tokend 2013 has an Arbitrary File Creation/Overwrite Vulnerability|January 30, 2020; 9:15:11 AM -0500|V3.1: 6.1 MEDIUM      V2.0: 6.3 MEDIUM (https://nvd.nist.gov/vuln-metrics/cvss/v3-calculator?name=CVE-2013-1867&vector=AV:P/AC:L/PR:N/UI:N/S:U/C:N/I:H/A:H&version=3.1&source=NIST)|https://nvd.nist.gov/vuln/detail/CVE-2013-1867
CVE-2013-1889|mod_ruid2 before 0.9.8 improperly handles file descriptors which allows remote attackers to bypass security using a CGI script to break out of the chroot.|November 08, 2019; 11:15:10 AM -0500|V3.1: 7.5 HIGH      V2.0: 5.0 MEDIUM (https://nvd.nist.gov/vuln-metrics/cvss/v3-calculator?name=CVE-2013-1889&vector=AV:N/AC:L/PR:N/UI:N/S:U/C:N/I:H/A:N&version=3.1&source=NIST)|https://nvd.nist.gov/vuln/detail/CVE-2013-1889
CVE-2013-1891|In OpenCart 1.4.7 to 1.5.5.1, implemented anti-traversal code in filemanager.php is ineffective and can be bypassed.|June 24, 2022; 11:15:08 AM -0400|V3.1: 6.5 MEDIUM      V2.0: 5.5 MEDIUM (https://nvd.nist.gov/vuln-metrics/cvss/v3-calculator?name=CVE-2013-1891&vector=AV:N/AC:L/PR:H/UI:N/S:U/C:H/I:H/A:N&version=3.1&source=NIST)|https://nvd.nist.gov/vuln/detail/CVE-2013-1891
CVE-2013-1895|The py-bcrypt module before 0.3 for Python does not properly handle concurrent memory access, which allows attackers to bypass authentication via multiple authentication requests, which trigger the password hash to be overwritten.|January 28, 2020; 10:15:14 AM -0500|V3.1: 7.5 HIGH      V2.0: 5.0 MEDIUM (https://nvd.nist.gov/vuln-metrics/cvss/v3-calculator?name=CVE-2013-1895&vector=AV:N/AC:L/PR:N/UI:N/S:U/C:N/I:H/A:N&version=3.1&source=NIST)|https://nvd.nist.gov/vuln/detail/CVE-2013-1895
CVE-2013-1910|yum does not properly handle bad metadata, which allows an attacker to cause a denial of service and possibly have other unspecified impact via a Trojan horse file in the metadata of a remote repository.|October 31, 2019; 3:15:10 PM -0400|V3.1: 9.8 CRITICAL      V2.0: 7.5 HIGH (https://nvd.nist.gov/vuln-metrics/cvss/v3-calculator?name=CVE-2013-1910&vector=AV:N/AC:L/PR:N/UI:N/S:U/C:H/I:H/A:H&version=3.1&source=NIST)|https://nvd.nist.gov/vuln/detail/CVE-2013-1910
CVE-2013-1916|In WordPress Plugin User Photo 0.9.4, when a photo is uploaded, it is only partially validated and it is possible to upload a backdoor on the server hosting WordPress. This backdoor can be called (executed) even if the photo has not been yet approved.|June 24, 2022; 11:15:08 AM -0400|V3.1: 8.8 HIGH      V2.0: 8.5 HIGH (https://nvd.nist.gov/vuln-metrics/cvss/v3-calculator?name=CVE-2013-1916&vector=AV:N/AC:L/PR:L/UI:N/S:U/C:H/I:H/A:H&version=3.1&source=NIST)|https://nvd.nist.gov/vuln/detail/CVE-2013-1916
CVE-2013-1924|Commerce Skrill (Formerly Moneybookers) has an Access bypass vulnerability in all versions prior to 7.x-1.2|February 12, 2020; 11:15:10 AM -0500|V3.1: 7.5 HIGH      V2.0: 5.0 MEDIUM (https://nvd.nist.gov/vuln-metrics/cvss/v3-calculator?name=CVE-2013-1924&vector=AV:N/AC:L/PR:N/UI:N/S:U/C:N/I:H/A:N&version=3.1&source=NIST)|https://nvd.nist.gov/vuln/detail/CVE-2013-1924
CVE-2013-1930|MantisBT 1.2.12 before 1.2.15 allows authenticated users to by the workflow restriction and close issues.|October 31, 2019; 4:15:10 PM -0400|V3.1: 4.3 MEDIUM      V2.0: 4.0 MEDIUM (https://nvd.nist.gov/vuln-metrics/cvss/v3-calculator?name=CVE-2013-1930&vector=AV:N/AC:L/PR:L/UI:N/S:U/C:N/I:L/A:N&version=3.1&source=NIST)|https://nvd.nist.gov/vuln/detail/CVE-2013-1930
CVE-2013-1931|A cross-site scripting (XSS) vulnerability in MantisBT 1.2.14 allows remote attackers to inject arbitrary web script or HTML via a version, related to deleting a version.|October 31, 2019; 4:15:10 PM -0400|V3.1: 6.1 MEDIUM      V2.0: 4.3 MEDIUM (https://nvd.nist.gov/vuln-metrics/cvss/v3-calculator?name=CVE-2013-1931&vector=AV:N/AC:L/PR:N/UI:R/S:C/C:L/I:L/A:N&version=3.1&source=NIST)|https://nvd.nist.gov/vuln/detail/CVE-2013-1931
CVE-2013-1932|A cross-site scripting (XSS) vulnerability in the configuration report page (adm_config_report.php) in MantisBT 1.2.13 allows remote authenticated users to inject arbitrary web script or HTML via a project name.|October 31, 2019; 4:15:10 PM -0400|V3.1: 5.4 MEDIUM      V2.0: 3.5 LOW (https://nvd.nist.gov/vuln-metrics/cvss/v3-calculator?name=CVE-2013-1932&vector=AV:N/AC:L/PR:L/UI:R/S:C/C:L/I:L/A:N&version=3.1&source=NIST)|https://nvd.nist.gov/vuln/detail/CVE-2013-1932
CVE-2013-1934|A cross-site scripting (XSS) vulnerability in the configuration report page (adm_config_report.php) in MantisBT 1.2.0rc1 before 1.2.14 allows remote authenticated users to inject arbitrary web script or HTML via a complex value.|October 31, 2019; 4:15:10 PM -0400|V3.1: 5.4 MEDIUM      V2.0: 3.5 LOW (https://nvd.nist.gov/vuln-metrics/cvss/v3-calculator?name=CVE-2013-1934&vector=AV:N/AC:L/PR:L/UI:R/S:C/C:L/I:L/A:N&version=3.1&source=NIST)|https://nvd.nist.gov/vuln/detail/CVE-2013-1934
CVE-2013-1938|Zimbra 2013 has XSS in aspell.php|February 12, 2020; 11:15:10 AM -0500|V3.1: 6.1 MEDIUM      V2.0: 4.3 MEDIUM (https://nvd.nist.gov/vuln-metrics/cvss/v3-calculator?name=CVE-2013-1938&vector=AV:N/AC:L/PR:N/UI:R/S:C/C:L/I:L/A:N&version=3.1&source=NIST)|https://nvd.nist.gov/vuln/detail/CVE-2013-1938
CVE-2013-1945|ruby193 uses an insecure LD_LIBRARY_PATH setting.|October 31, 2019; 4:15:10 PM -0400|V3.1: 3.3 LOW      V2.0: 2.1 LOW (https://nvd.nist.gov/vuln-metrics/cvss/v3-calculator?name=CVE-2013-1945&vector=AV:L/AC:L/PR:L/UI:N/S:U/C:N/I:L/A:N&version=3.1&source=NIST)|https://nvd.nist.gov/vuln/detail/CVE-2013-1945
CVE-2013-1951|A cross-site scripting (XSS) vulnerability in MediaWiki before 1.19.5 and 1.20.x before 1.20.4 and allows remote attackers to inject arbitrary web script or HTML via Lua function names.|October 31, 2019; 4:15:10 PM -0400|V3.1: 6.1 MEDIUM      V2.0: 4.3 MEDIUM (https://nvd.nist.gov/vuln-metrics/cvss/v3-calculator?name=CVE-2013-1951&vector=AV:N/AC:L/PR:N/UI:R/S:C/C:L/I:L/A:N&version=3.1&source=NIST)|https://nvd.nist.gov/vuln/detail/CVE-2013-1951
CVE-2013-20001|An issue was discovered in OpenZFS through 2.0.3. When an NFS share is exported to IPv6 addresses via the sharenfs feature, there is a silent failure to parse the IPv6 address data, and access is allowed to everyone. IPv6 restrictions from the configuration are not applied.|February 12, 2021; 3:15:12 PM -0500|V3.1: 7.5 HIGH      V2.0: 5.0 MEDIUM (https://nvd.nist.gov/vuln-metrics/cvss/v3-calculator?name=CVE-2013-20001&vector=AV:N/AC:L/PR:N/UI:N/S:U/C:H/I:N/A:N&version=3.1&source=NIST)|https://nvd.nist.gov/vuln/detail/CVE-2013-20001
CVE-2013-20002|Elemin allows remote attackers to upload and execute arbitrary PHP code via the Themify framework (before 1.2.2) wp-content/themes/elemin/themify/themify-ajax.php file.|June 17, 2021; 12:15:07 PM -0400|V3.1: 9.8 CRITICAL      V2.0: 7.5 HIGH (https://nvd.nist.gov/vuln-metrics/cvss/v3-calculator?name=CVE-2013-20002&vector=AV:N/AC:L/PR:N/UI:N/S:U/C:H/I:H/A:H&version=3.1&source=NIST)|https://nvd.nist.gov/vuln/detail/CVE-2013-20002
CVE-2013-20003|Z-Wave devices from Sierra Designs (circa 2013) and Silicon Labs (using S0 security) may use a known, shared network key of all zeros, allowing an attacker within radio range to spoof Z-Wave traffic.|February 04, 2022; 6:15:09 PM -0500|V3.1: 8.3 HIGH      V2.0: 7.9 HIGH (https://nvd.nist.gov/vuln-metrics/cvss/v3-calculator?name=CVE-2013-20003&vector=AV:A/AC:H/PR:N/UI:N/S:C/C:H/I:H/A:H&version=3.1&source=NIST)|https://nvd.nist.gov/vuln/detail/CVE-2013-20003
CVE-2013-20004|A flaw was found in StarWind iSCSI target. StarWind service does not limit client connections and allocates memory on each connection attempt. An attacker could create a denial of service state by trying to connect a non-existent target multiple times. This affects iSCSI SAN (Windows Native) Version 6.0, build 2013-01-16.|February 06, 2022; 4:15:07 PM -0500|V3.1: 9.8 CRITICAL      V2.0: 7.5 HIGH (https://nvd.nist.gov/vuln-metrics/cvss/v3-calculator?name=CVE-2013-20004&vector=AV:N/AC:L/PR:N/UI:N/S:U/C:H/I:H/A:H&version=3.1&source=NIST)|https://nvd.nist.gov/vuln/detail/CVE-2013-20004
CVE-2013-2008|WordPress Super Cache Plugin 1.3 has XSS.|February 07, 2020; 9:15:11 AM -0500|V3.1: 6.1 MEDIUM      V2.0: 4.3 MEDIUM (https://nvd.nist.gov/vuln-metrics/cvss/v3-calculator?name=CVE-2013-2008&vector=AV:N/AC:L/PR:N/UI:R/S:C/C:L/I:L/A:N&version=3.1&source=NIST)|https://nvd.nist.gov/vuln/detail/CVE-2013-2008
CVE-2013-2009|WordPress WP Super Cache Plugin 1.2 has Remote PHP Code Execution|February 07, 2020; 9:15:11 AM -0500|V3.1: 8.8 HIGH      V2.0: 6.8 MEDIUM (https://nvd.nist.gov/vuln-metrics/cvss/v3-calculator?name=CVE-2013-2009&vector=AV:N/AC:L/PR:N/UI:R/S:U/C:H/I:H/A:H&version=3.1&source=NIST)|https://nvd.nist.gov/vuln/detail/CVE-2013-2009
CVE-2013-2010|WordPress W3 Total Cache Plugin 0.9.2.8 has a Remote PHP Code Execution Vulnerability|February 12, 2020; 10:15:11 AM -0500|V3.1: 9.8 CRITICAL      V2.0: 7.5 HIGH (https://nvd.nist.gov/vuln-metrics/cvss/v3-calculator?name=CVE-2013-2010&vector=AV:N/AC:L/PR:N/UI:N/S:U/C:H/I:H/A:H&version=3.1&source=NIST)|https://nvd.nist.gov/vuln/detail/CVE-2013-2010
CVE-2013-2011|WordPress W3 Super Cache Plugin before 1.3.2 contains a PHP code-execution vulnerability which could allow remote attackers to inject arbitrary code. This issue exists because of an incomplete fix for CVE-2013-2009.|December 26, 2019; 4:15:11 PM -0500|V3.1: 8.8 HIGH      V2.0: 6.8 MEDIUM (https://nvd.nist.gov/vuln-metrics/cvss/v3-calculator?name=CVE-2013-2011&vector=AV:N/AC:L/PR:N/UI:R/S:U/C:H/I:H/A:H&version=3.1&source=NIST)|https://nvd.nist.gov/vuln/detail/CVE-2013-2011
CVE-2013-2012|autojump before 21.5.8 allows local users to gain privileges via a Trojan horse custom_install directory in the current working directory.|October 31, 2019; 4:15:10 PM -0400|V3.1: 7.3 HIGH      V2.0: 4.4 MEDIUM (https://nvd.nist.gov/vuln-metrics/cvss/v3-calculator?name=CVE-2013-2012&vector=AV:L/AC:L/PR:L/UI:R/S:U/C:H/I:H/A:H&version=3.1&source=NIST)|https://nvd.nist.gov/vuln/detail/CVE-2013-2012
CVE-2013-2016|A flaw was found in the way qemu v1.3.0 and later (virtio-rng) validates addresses when guest accesses the config space of a virtio device. If the virtio device has zero/small sized config space, such as virtio-rng, a privileged guest user could use this flaw to access the matching host's qemu address space and thus increase their privileges on the host.|December 30, 2019; 5:15:11 PM -0500|V3.1: 7.8 HIGH      V2.0: 6.9 MEDIUM (https://nvd.nist.gov/vuln-metrics/cvss/v3-calculator?name=CVE-2013-2016&vector=AV:L/AC:L/PR:L/UI:N/S:U/C:H/I:H/A:H&version=3.1&source=NIST)|https://nvd.nist.gov/vuln/detail/CVE-2013-2016
CVE-2013-2018|Multiple SQL injection vulnerabilities in BOINC allow remote attackers to execute arbitrary SQL commands via unspecified vectors.|February 19, 2020; 7:15:10 PM -0500|V3.1: 9.8 CRITICAL      V2.0: 7.5 HIGH (https://nvd.nist.gov/vuln-metrics/cvss/v3-calculator?name=CVE-2013-2018&vector=AV:N/AC:L/PR:N/UI:N/S:U/C:H/I:H/A:H&version=3.1&source=NIST)|https://nvd.nist.gov/vuln/detail/CVE-2013-2018
CVE-2013-2024|"OS command injection vulnerability in the ""qs"" procedure from the ""utils"" module in Chicken before 4.9.0."|October 31, 2019; 4:15:10 PM -0400|V3.1: 8.8 HIGH      V2.0: 9.0 HIGH (https://nvd.nist.gov/vuln-metrics/cvss/v3-calculator?name=CVE-2013-2024&vector=AV:N/AC:L/PR:L/UI:N/S:U/C:H/I:H/A:H&version=3.1&source=NIST)|https://nvd.nist.gov/vuln/detail/CVE-2013-2024
CVE-2013-2049|Red Hat CloudForms 2 Management Engine (CFME) allows remote attackers to conduct session tampering attacks by leveraging use of a static secret_token.rb secret.|May 01, 2018; 3:29:00 PM -0400|V3.0: 7.5 HIGH      V2.0: 5.0 MEDIUM (https://nvd.nist.gov/vuln-metrics/cvss/v3-calculator?name=CVE-2013-2049&vector=AV:N/AC:L/PR:N/UI:N/S:U/C:N/I:H/A:N&version=3.0&source=NIST)|https://nvd.nist.gov/vuln/detail/CVE-2013-2049
CVE-2013-2057|YaBB through 2.5.2: 'guestlanguage' Cookie Parameter Local File Include Vulnerability|February 11, 2020; 1:15:15 PM -0500|V3.1: 9.8 CRITICAL      V2.0: 7.5 HIGH (https://nvd.nist.gov/vuln-metrics/cvss/v3-calculator?name=CVE-2013-2057&vector=AV:N/AC:L/PR:N/UI:N/S:U/C:H/I:H/A:H&version=3.1&source=NIST)|https://nvd.nist.gov/vuln/detail/CVE-2013-2057
CVE-2013-2060|The download_from_url function in OpenShift Origin allows remote attackers to execute arbitrary commands via shell metacharacters in the URL of a request to download a cart.|January 28, 2020; 11:15:11 AM -0500|V3.1: 9.8 CRITICAL      V2.0: 10.0 HIGH (https://nvd.nist.gov/vuln-metrics/cvss/v3-calculator?name=CVE-2013-2060&vector=AV:N/AC:L/PR:N/UI:N/S:U/C:H/I:H/A:H&version=3.1&source=NIST)|https://nvd.nist.gov/vuln/detail/CVE-2013-2060
CVE-2013-2075|Multiple buffer overflows in the (1) R5RS char-ready, (2) tcp-accept-ready, and (3) file-select procedures in Chicken through 4.8.0.3 allows attackers to cause a denial of service (crash) by opening a file descriptor with a large integer value. NOTE: this issue exists because of an incomplete fix for CVE-2012-6122.|October 31, 2019; 5:15:12 PM -0400|V3.1: 8.8 HIGH      V2.0: 7.5 HIGH (https://nvd.nist.gov/vuln-metrics/cvss/v3-calculator?name=CVE-2013-2075&vector=AV:N/AC:L/PR:N/UI:R/S:U/C:H/I:H/A:H&version=3.1&source=NIST)|https://nvd.nist.gov/vuln/detail/CVE-2013-2075
CVE-2013-2091|SQL injection vulnerability in Dolibarr ERP/CRM 3.3.1 allows remote attackers to execute arbitrary SQL commands via the 'pays' parameter in fiche.php.|November 20, 2019; 3:15:11 PM -0500|V3.1: 9.8 CRITICAL      V2.0: 7.5 HIGH (https://nvd.nist.gov/vuln-metrics/cvss/v3-calculator?name=CVE-2013-2091&vector=AV:N/AC:L/PR:N/UI:N/S:U/C:H/I:H/A:H&version=3.1&source=NIST)|https://nvd.nist.gov/vuln/detail/CVE-2013-2091
