Vuln ID|Summary|Published Date|CVSS Severity|Link
CVE-2013-0159|The fedora-business-cards package before 1-0.1.beta1.fc17 on Fedora 17 and before 1-0.1.beta1.fc18 on Fedora 18 allows local users to cause a denial of service or write to arbitrary files via a symlink attack on /tmp/fedora-business-cards-buffer.svg.|May 01, 2018; 3:29:00 PM -0400|V3.0: 7.1 HIGH      V2.0: 3.6 LOW (https://nvd.nist.gov/vuln-metrics/cvss/v3-calculator?name=CVE-2013-0159&vector=AV:L/AC:L/PR:L/UI:N/S:U/C:N/I:H/A:H&version=3.0&source=NIST)|https://nvd.nist.gov/vuln/detail/CVE-2013-0159
CVE-2013-0161|Havalite CMS 1.1.7 has a stored XSS vulnerability|January 29, 2020; 10:15:10 AM -0500|V3.1: 5.4 MEDIUM      V2.0: 3.5 LOW (https://nvd.nist.gov/vuln-metrics/cvss/v3-calculator?name=CVE-2013-0161&vector=AV:N/AC:L/PR:L/UI:R/S:C/C:L/I:L/A:N&version=3.1&source=NIST)|https://nvd.nist.gov/vuln/detail/CVE-2013-0161
CVE-2013-0163|OpenShift haproxy cartridge: predictable /tmp in set-proxy connection hook which could facilitate DoS|December 05, 2019; 10:15:11 AM -0500|V3.1: 5.5 MEDIUM      V2.0: 2.1 LOW (https://nvd.nist.gov/vuln-metrics/cvss/v3-calculator?name=CVE-2013-0163&vector=AV:L/AC:L/PR:L/UI:N/S:U/C:N/I:N/A:H&version=3.1&source=NIST)|https://nvd.nist.gov/vuln/detail/CVE-2013-0163
CVE-2013-0165|cartridges/openshift-origin-cartridge-mongodb-2.2/info/bin/dump.sh in OpenShift does not properly create files in /tmp.|November 01, 2019; 3:15:10 PM -0400|V3.1: 7.3 HIGH      V2.0: 7.5 HIGH (https://nvd.nist.gov/vuln-metrics/cvss/v3-calculator?name=CVE-2013-0165&vector=AV:N/AC:L/PR:N/UI:N/S:U/C:L/I:L/A:L&version=3.1&source=NIST)|https://nvd.nist.gov/vuln/detail/CVE-2013-0165
CVE-2013-0178|Insecure temporary file vulnerability in Redis before 2.6 related to /tmp/redis-%p.vm.|November 01, 2019; 3:15:10 PM -0400|V3.1: 5.5 MEDIUM      V2.0: 3.6 LOW (https://nvd.nist.gov/vuln-metrics/cvss/v3-calculator?name=CVE-2013-0178&vector=AV:L/AC:L/PR:L/UI:N/S:U/C:N/I:H/A:N&version=3.1&source=NIST)|https://nvd.nist.gov/vuln/detail/CVE-2013-0178
CVE-2013-0180|Insecure temporary file vulnerability in Redis 2.6 related to /tmp/redis.ds.|November 01, 2019; 3:15:10 PM -0400|V3.1: 5.5 MEDIUM      V2.0: 3.6 LOW (https://nvd.nist.gov/vuln-metrics/cvss/v3-calculator?name=CVE-2013-0180&vector=AV:L/AC:L/PR:L/UI:N/S:U/C:N/I:H/A:N&version=3.1&source=NIST)|https://nvd.nist.gov/vuln/detail/CVE-2013-0180
CVE-2013-0185|Cross-site request forgery (CSRF) vulnerability in ManageIQ Enterprise Virtualization Manager (EVM) allows remote attackers to hijack the authentication of users for requests that have unspecified impact via unknown vectors.|May 01, 2018; 3:29:00 PM -0400|V3.0: 8.8 HIGH      V2.0: 6.8 MEDIUM (https://nvd.nist.gov/vuln-metrics/cvss/v3-calculator?name=CVE-2013-0185&vector=AV:N/AC:L/PR:N/UI:R/S:U/C:H/I:H/A:H&version=3.0&source=NIST)|https://nvd.nist.gov/vuln/detail/CVE-2013-0185
CVE-2013-0186|Multiple cross-site scripting (XSS) vulnerabilities in ManageIQ EVM allows remote attackers to inject arbitrary web script or HTML via unspecified vectors.|November 01, 2019; 3:15:10 PM -0400|V3.1: 6.1 MEDIUM      V2.0: 4.3 MEDIUM (https://nvd.nist.gov/vuln-metrics/cvss/v3-calculator?name=CVE-2013-0186&vector=AV:N/AC:L/PR:N/UI:R/S:C/C:L/I:L/A:N&version=3.1&source=NIST)|https://nvd.nist.gov/vuln/detail/CVE-2013-0186
CVE-2013-0192|File Disclosure in SMF (SimpleMachines Forum) <= 2.0.3: Forum admin can read files such as the database config.|February 07, 2020; 9:15:10 AM -0500|V3.1: 4.9 MEDIUM      V2.0: 4.0 MEDIUM (https://nvd.nist.gov/vuln-metrics/cvss/v3-calculator?name=CVE-2013-0192&vector=AV:N/AC:L/PR:H/UI:N/S:U/C:H/I:N/A:N&version=3.1&source=NIST)|https://nvd.nist.gov/vuln/detail/CVE-2013-0192
CVE-2013-0193|Cross-site Scripting (XSS) in Piwik before 1.10.1 allows remote attackers to inject arbitrary web script or HTML via unspecified vectors. NOTE: This is a different vulnerability than CVE-2013-0194 and CVE-2013-0195.|November 20, 2019; 10:15:11 AM -0500|V3.1: 6.1 MEDIUM      V2.0: 4.3 MEDIUM (https://nvd.nist.gov/vuln-metrics/cvss/v3-calculator?name=CVE-2013-0193&vector=AV:N/AC:L/PR:N/UI:R/S:C/C:L/I:L/A:N&version=3.1&source=NIST)|https://nvd.nist.gov/vuln/detail/CVE-2013-0193
CVE-2013-0194|Cross-site Scripting (XSS) in Piwik before 1.10.1 allows remote attackers to inject arbitrary web script or HTML via unspecified vectors. NOTE: This is a different vulnerability than CVE-2013-0193 and CVE-2013-0195.|November 20, 2019; 10:15:11 AM -0500|V3.1: 6.1 MEDIUM      V2.0: 4.3 MEDIUM (https://nvd.nist.gov/vuln-metrics/cvss/v3-calculator?name=CVE-2013-0194&vector=AV:N/AC:L/PR:N/UI:R/S:C/C:L/I:L/A:N&version=3.1&source=NIST)|https://nvd.nist.gov/vuln/detail/CVE-2013-0194
CVE-2013-0195|Cross-site Scripting (XSS) in Piwik before 1.10.1 allows remote attackers to inject arbitrary web script or HTML via unspecified vectors. NOTE: This is a different vulnerability than CVE-2013-0193 and CVE-2013-0194.|November 20, 2019; 10:15:11 AM -0500|V3.1: 6.1 MEDIUM      V2.0: 4.3 MEDIUM (https://nvd.nist.gov/vuln-metrics/cvss/v3-calculator?name=CVE-2013-0195&vector=AV:N/AC:L/PR:N/UI:R/S:C/C:L/I:L/A:N&version=3.1&source=NIST)|https://nvd.nist.gov/vuln/detail/CVE-2013-0195
CVE-2013-0196|A CSRF issue was found in OpenShift Enterprise 1.2. The web console is using 'Basic authentication' and the REST API has no CSRF attack protection mechanism. This can allow an attacker to obtain the credential and the Authorization: header when requesting the REST API via web browser.|December 30, 2019; 5:15:11 PM -0500|V3.1: 6.5 MEDIUM      V2.0: 4.3 MEDIUM (https://nvd.nist.gov/vuln-metrics/cvss/v3-calculator?name=CVE-2013-0196&vector=AV:N/AC:L/PR:N/UI:R/S:U/C:N/I:H/A:N&version=3.1&source=NIST)|https://nvd.nist.gov/vuln/detail/CVE-2013-0196
CVE-2013-0202|Cross-site scripting (XSS) vulnerability in ownCloud 4.5.5, 4.0.10, and earlier allows remote attackers to inject arbitrary web script or HTML via the action parameter to core/ajax/sharing.php.|December 17, 2019; 1:15:13 PM -0500|V3.1: 6.1 MEDIUM      V2.0: 4.3 MEDIUM (https://nvd.nist.gov/vuln-metrics/cvss/v3-calculator?name=CVE-2013-0202&vector=AV:N/AC:L/PR:N/UI:R/S:C/C:L/I:L/A:N&version=3.1&source=NIST)|https://nvd.nist.gov/vuln/detail/CVE-2013-0202
CVE-2013-0203|Multiple cross-site scripting (XSS) vulnerabilities in ownCloud 4.5.5, 4.0.10, and earlier allow remote attackers to inject arbitrary web script or HTML via the (1) unspecified parameters to apps/calendar/ajax/event/new.php or (2) url parameter to apps/bookmarks/ajax/addBookmark.php.|November 22, 2019; 2:15:11 PM -0500|V3.1: 5.4 MEDIUM      V2.0: 3.5 LOW (https://nvd.nist.gov/vuln-metrics/cvss/v3-calculator?name=CVE-2013-0203&vector=AV:N/AC:L/PR:L/UI:R/S:C/C:L/I:L/A:N&version=3.1&source=NIST)|https://nvd.nist.gov/vuln/detail/CVE-2013-0203
CVE-2013-0243|haskell-tls-extra before 0.6.1 has Basic Constraints attribute vulnerability may lead to Man in the Middle attacks on TLS connections|December 05, 2019; 11:15:10 AM -0500|V3.1: 7.4 HIGH      V2.0: 5.8 MEDIUM (https://nvd.nist.gov/vuln-metrics/cvss/v3-calculator?name=CVE-2013-0243&vector=AV:N/AC:H/PR:N/UI:N/S:U/C:H/I:H/A:N&version=3.1&source=NIST)|https://nvd.nist.gov/vuln/detail/CVE-2013-0243
CVE-2013-0264|An import error was introduced in Cumin in the code refactoring in r5310. Server certificate validation is always disabled when connecting to Aviary servers, even if the installed packages on a system support it.|December 30, 2019; 5:15:11 PM -0500|V3.1: 7.5 HIGH      V2.0: 5.0 MEDIUM (https://nvd.nist.gov/vuln-metrics/cvss/v3-calculator?name=CVE-2013-0264&vector=AV:N/AC:L/PR:N/UI:N/S:U/C:N/I:H/A:N&version=3.1&source=NIST)|https://nvd.nist.gov/vuln/detail/CVE-2013-0264
CVE-2013-0267|The Privileges portion of the web GUI and the XMLRPC API in Apache VCL 2.3.x before 2.3.2, 2.2.x before 2.2.2 and 2.1 allow remote authenticated users with nodeAdmin, manageGroup, resourceGrant, or userGrant permissions to gain privileges, cause a denial of service, or conduct cross-site scripting (XSS) attacks by leveraging improper data validation.|February 21, 2018; 10:29:00 AM -0500|V3.0: 8.8 HIGH      V2.0: 6.5 MEDIUM (https://nvd.nist.gov/vuln-metrics/cvss/v3-calculator?name=CVE-2013-0267&vector=AV:N/AC:L/PR:L/UI:N/S:U/C:H/I:H/A:H&version=3.0&source=NIST)|https://nvd.nist.gov/vuln/detail/CVE-2013-0267
CVE-2013-0283|Katello: Username in Notification page has cross site scripting|December 05, 2019; 12:15:11 PM -0500|V3.1: 5.4 MEDIUM      V2.0: 3.5 LOW (https://nvd.nist.gov/vuln-metrics/cvss/v3-calculator?name=CVE-2013-0283&vector=AV:N/AC:L/PR:L/UI:R/S:C/C:L/I:L/A:N&version=3.1&source=NIST)|https://nvd.nist.gov/vuln/detail/CVE-2013-0283
CVE-2013-0286|Pinboard 1.0.6 theme for Wordpress has XSS.|January 27, 2020; 10:15:11 AM -0500|V3.1: 5.4 MEDIUM      V2.0: 3.5 LOW (https://nvd.nist.gov/vuln-metrics/cvss/v3-calculator?name=CVE-2013-0286&vector=AV:N/AC:L/PR:L/UI:R/S:C/C:L/I:L/A:N&version=3.1&source=NIST)|https://nvd.nist.gov/vuln/detail/CVE-2013-0286
CVE-2013-0291|NextGEN Gallery Plugin for WordPress 1.9.10 and 1.9.11 has a Path Disclosure Vulnerability|January 30, 2020; 8:15:14 AM -0500|V3.1: 7.5 HIGH      V2.0: 5.0 MEDIUM (https://nvd.nist.gov/vuln-metrics/cvss/v3-calculator?name=CVE-2013-0291&vector=AV:N/AC:L/PR:N/UI:N/S:U/C:H/I:N/A:N&version=3.1&source=NIST)|https://nvd.nist.gov/vuln/detail/CVE-2013-0291
CVE-2013-0293|oVirt Node: Lock screen accepts F2 to drop to shell causing privilege escalation|December 10, 2019; 9:15:10 AM -0500|V3.1: 7.8 HIGH      V2.0: 7.2 HIGH (https://nvd.nist.gov/vuln-metrics/cvss/v3-calculator?name=CVE-2013-0293&vector=AV:L/AC:L/PR:L/UI:N/S:U/C:H/I:H/A:H&version=3.1&source=NIST)|https://nvd.nist.gov/vuln/detail/CVE-2013-0293
CVE-2013-0294|packet.py in pyrad before 2.1 uses weak random numbers to generate RADIUS authenticators and hash passwords, which makes it easier for remote attackers to obtain sensitive information via a brute force attack.|January 28, 2020; 11:15:11 AM -0500|V3.1: 5.9 MEDIUM      V2.0: 4.3 MEDIUM (https://nvd.nist.gov/vuln-metrics/cvss/v3-calculator?name=CVE-2013-0294&vector=AV:N/AC:H/PR:N/UI:N/S:U/C:H/I:N/A:N&version=3.1&source=NIST)|https://nvd.nist.gov/vuln/detail/CVE-2013-0294
CVE-2013-0326|OpenStack nova base images permissions are world readable|December 05, 2019; 12:15:11 PM -0500|V3.1: 5.5 MEDIUM      V2.0: 2.1 LOW (https://nvd.nist.gov/vuln-metrics/cvss/v3-calculator?name=CVE-2013-0326&vector=AV:L/AC:L/PR:L/UI:N/S:U/C:H/I:N/A:N&version=3.1&source=NIST)|https://nvd.nist.gov/vuln/detail/CVE-2013-0326
CVE-2013-0342|The CreateID function in packet.py in pyrad before 2.1 uses sequential packet IDs, which makes it easier for remote attackers to spoof packets by predicting the next ID, a different vulnerability than CVE-2013-0294.|December 09, 2019; 4:15:10 PM -0500|V3.1: 4.3 MEDIUM      V2.0: 4.3 MEDIUM (https://nvd.nist.gov/vuln-metrics/cvss/v3-calculator?name=CVE-2013-0342&vector=AV:N/AC:L/PR:N/UI:R/S:U/C:N/I:L/A:N&version=3.1&source=NIST)|https://nvd.nist.gov/vuln/detail/CVE-2013-0342
CVE-2013-0507|IBM InfoSphere Information Server 8.1, 8.5, 8.7, 9.1 has a Session Fixation Vulnerability|February 05, 2020; 11:15:10 AM -0500|V3.1: 8.1 HIGH      V2.0: 5.8 MEDIUM (https://nvd.nist.gov/vuln-metrics/cvss/v3-calculator?name=CVE-2013-0507&vector=AV:N/AC:L/PR:N/UI:R/S:U/C:H/I:H/A:N&version=3.1&source=NIST)|https://nvd.nist.gov/vuln/detail/CVE-2013-0507
CVE-2013-0517|A Command Execution Vulnerability exists in IBM Sterling External Authentication Server 2.2.0, 2.3.01, 2.4.0, and 2.4.1 via an unspecified OS command, which could let a local malicious user execute arbitrary code.|February 11, 2020; 1:15:15 PM -0500|V3.1: 7.8 HIGH      V2.0: 7.2 HIGH (https://nvd.nist.gov/vuln-metrics/cvss/v3-calculator?name=CVE-2013-0517&vector=AV:L/AC:L/PR:L/UI:N/S:U/C:H/I:H/A:H&version=3.1&source=NIST)|https://nvd.nist.gov/vuln/detail/CVE-2013-0517
CVE-2013-0522|The Notes Client Single Logon feature in IBM Notes 8.0, 8.0.1, 8.0.2, 8.5, 8.5.1, 8.5.2, 8.5.3, and 9.0 on Windows allows local users to discover passwords via vectors involving an unspecified operating system communication mechanism for password transmission between Windows and Notes. IBM X-Force ID: 82531.|July 16, 2018; 10:29:00 AM -0400|V3.0: 7.0 HIGH      V2.0: 1.9 LOW (https://nvd.nist.gov/vuln-metrics/cvss/v3-calculator?name=CVE-2013-0522&vector=AV:L/AC:H/PR:L/UI:N/S:U/C:H/I:H/A:H&version=3.0&source=NIST)|https://nvd.nist.gov/vuln/detail/CVE-2013-0522
CVE-2013-0570|The Fibre Channel over Ethernet (FCoE) feature in IBM System Networking and Blade Network Technology (BNT) switches running IBM Networking Operating System (aka NOS, formerly BLADE Operating System) floods data frames with unknown MAC addresses out on all interfaces on the same VLAN, which might allow remote attackers to obtain sensitive information in opportunistic circumstances by eavesdropping on the broadcast domain. IBM X-Force ID: 83166.|July 13, 2018; 5:29:00 PM -0400|V3.0: 5.3 MEDIUM      V2.0: 2.9 LOW (https://nvd.nist.gov/vuln-metrics/cvss/v3-calculator?name=CVE-2013-0570&vector=AV:A/AC:H/PR:N/UI:N/S:U/C:H/I:N/A:N&version=3.0&source=NIST)|https://nvd.nist.gov/vuln/detail/CVE-2013-0570
CVE-2013-0589|IBM iNotes before 8.5.3 Fix Pack 6 and 9.x before 9.0.1 allows remote attackers to bypass the remote image filtering mechanism and obtain sensitive information via a crafted e-mail message. IBM X-Force ID: 83371.|July 11, 2018; 12:29:00 PM -0400|V3.0: 7.5 HIGH      V2.0: 5.0 MEDIUM (https://nvd.nist.gov/vuln-metrics/cvss/v3-calculator?name=CVE-2013-0589&vector=AV:N/AC:L/PR:N/UI:N/S:U/C:H/I:N/A:N&version=3.0&source=NIST)|https://nvd.nist.gov/vuln/detail/CVE-2013-0589
CVE-2013-0592|Cross-site scripting (XSS) vulnerability in IBM iNotes before 8.5.3 Fix Pack 6 and 9.x before 9.0.1 allows remote attackers to inject arbitrary web script or HTML via unspecified vectors. IBM X-Force ID: 83815.|July 11, 2018; 12:29:00 PM -0400|V3.0: 5.4 MEDIUM      V2.0: 3.5 LOW (https://nvd.nist.gov/vuln-metrics/cvss/v3-calculator?name=CVE-2013-0592&vector=AV:N/AC:L/PR:L/UI:R/S:C/C:L/I:L/A:N&version=3.0&source=NIST)|https://nvd.nist.gov/vuln/detail/CVE-2013-0592
CVE-2013-0594|Open redirect vulnerability in IBM iNotes before 8.5.3 Fix Pack 6 and 9.x before 9.0.1 allows remote attackers to redirect users to arbitrary web sites and conduct phishing attacks via unspecified vectors. IBM X-Force ID: 83383.|July 11, 2018; 12:29:00 PM -0400|V3.0: 6.1 MEDIUM      V2.0: 5.8 MEDIUM (https://nvd.nist.gov/vuln-metrics/cvss/v3-calculator?name=CVE-2013-0594&vector=AV:N/AC:L/PR:N/UI:R/S:C/C:L/I:L/A:N&version=3.0&source=NIST)|https://nvd.nist.gov/vuln/detail/CVE-2013-0594
CVE-2013-0725|ERDAS ER Viewer 13.0 has dwmapi.dll and irml.dll libraries arbitrary code execution vulnerabilities|January 30, 2020; 9:15:10 AM -0500|V3.1: 7.8 HIGH      V2.0: 6.9 MEDIUM (https://nvd.nist.gov/vuln-metrics/cvss/v3-calculator?name=CVE-2013-0725&vector=AV:L/AC:L/PR:N/UI:R/S:U/C:H/I:H/A:H&version=3.1&source=NIST)|https://nvd.nist.gov/vuln/detail/CVE-2013-0725
CVE-2013-0737|Cross-site scripting (XSS) vulnerability in BoltWire 3.5 and earlier allows remote attackers to inject arbitrary web script or HTML via the fieldnames parameter.|January 02, 2020; 4:15:12 PM -0500|V3.1: 6.1 MEDIUM      V2.0: 4.3 MEDIUM (https://nvd.nist.gov/vuln-metrics/cvss/v3-calculator?name=CVE-2013-0737&vector=AV:N/AC:L/PR:N/UI:R/S:C/C:L/I:L/A:N&version=3.1&source=NIST)|https://nvd.nist.gov/vuln/detail/CVE-2013-0737
CVE-2013-0738|Chamilo 1.9.4 has Multiple XSS and HTML Injection Vulnerabilities: blog.php and announcements.php.|January 30, 2020; 9:15:10 AM -0500|V3.1: 6.1 MEDIUM      V2.0: 4.3 MEDIUM (https://nvd.nist.gov/vuln-metrics/cvss/v3-calculator?name=CVE-2013-0738&vector=AV:N/AC:L/PR:N/UI:R/S:C/C:L/I:L/A:N&version=3.1&source=NIST)|https://nvd.nist.gov/vuln/detail/CVE-2013-0738
CVE-2013-0739|Chamilo 1.9.4 has XSS due to improper validation of user-supplied input by the chat.php script.|January 30, 2020; 9:15:11 AM -0500|V3.1: 6.1 MEDIUM      V2.0: 4.3 MEDIUM (https://nvd.nist.gov/vuln-metrics/cvss/v3-calculator?name=CVE-2013-0739&vector=AV:N/AC:L/PR:N/UI:R/S:C/C:L/I:L/A:N&version=3.1&source=NIST)|https://nvd.nist.gov/vuln/detail/CVE-2013-0739
CVE-2013-0803|A PHP File Upload Vulnerability exists in PolarBear CMS 2.5 via upload.php, which could let a malicious user execute arbitrary code.|February 11, 2020; 12:15:11 PM -0500|V3.1: 9.8 CRITICAL      V2.0: 7.5 HIGH (https://nvd.nist.gov/vuln-metrics/cvss/v3-calculator?name=CVE-2013-0803&vector=AV:N/AC:L/PR:N/UI:N/S:U/C:H/I:H/A:H&version=3.1&source=NIST)|https://nvd.nist.gov/vuln/detail/CVE-2013-0803
CVE-2013-0870|The 'vp3_decode_frame' function in FFmpeg 1.1.4 moves threads check out of header packet type check.|August 28, 2017; 11:29:00 AM -0400|V3.0: 9.8 CRITICAL      V2.0: 7.5 HIGH (https://nvd.nist.gov/vuln-metrics/cvss/v3-calculator?name=CVE-2013-0870&vector=AV:N/AC:L/PR:N/UI:N/S:U/C:H/I:H/A:H&version=3.0&source=NIST)|https://nvd.nist.gov/vuln/detail/CVE-2013-0870
CVE-2013-10001|A vulnerability was found in HTC One/Sense 4.x. It has been rated as problematic. Affected by this issue is the certification validation of the mail client. An exploit has been disclosed to the public and may be used.|May 17, 2022; 4:15:06 AM -0400|V3.1: 5.9 MEDIUM      V2.0: 4.3 MEDIUM (https://nvd.nist.gov/vuln-metrics/cvss/v3-calculator?name=CVE-2013-10001&vector=AV:N/AC:H/PR:N/UI:N/S:U/C:H/I:N/A:N&version=3.1&source=NIST)|https://nvd.nist.gov/vuln/detail/CVE-2013-10001
CVE-2013-10002|A vulnerability was found in Telecommunication Software SAMwin Contact Center Suite 5.1. It has been rated as critical. Affected by this issue is the function getCurrentDBVersion in the library SAMwinLIBVB.dll of the credential handler. Authentication is possible with hard-coded credentials. Upgrading to version 6.2 is able to address this issue. It is recommended to upgrade the affected component.|May 24, 2022; 12:15:07 PM -0400|V3.1: 9.1 CRITICAL      V2.0: 6.4 MEDIUM (https://nvd.nist.gov/vuln-metrics/cvss/v3-calculator?name=CVE-2013-10002&vector=AV:N/AC:L/PR:N/UI:N/S:U/C:H/I:H/A:N&version=3.1&source=NIST)|https://nvd.nist.gov/vuln/detail/CVE-2013-10002
CVE-2013-10003|A vulnerability classified as critical has been found in Telecommunication Software SAMwin Contact Center Suite 5.1. This affects the function getCurrentDBVersion in the library SAMwinLIBVB.dll of the database handler. The manipulation leads to sql injection. The exploit has been disclosed to the public and may be used. Upgrading to version 6.2 is able to address this issue. It is recommended to upgrade the affected component.|May 24, 2022; 12:15:07 PM -0400|V3.1: 9.8 CRITICAL      V2.0: 7.5 HIGH (https://nvd.nist.gov/vuln-metrics/cvss/v3-calculator?name=CVE-2013-10003&vector=AV:N/AC:L/PR:N/UI:N/S:U/C:H/I:H/A:H&version=3.1&source=NIST)|https://nvd.nist.gov/vuln/detail/CVE-2013-10003
CVE-2013-10004|A vulnerability classified as critical was found in Telecommunication Software SAMwin Contact Center Suite 5.1. This vulnerability affects the function passwordScramble in the library SAMwinLIBVB.dll of the component Password Handler. Incorrect implementation of a hashing function leads to predictable authentication possibilities. Upgrading to version 6.2 is able to address this issue. It is recommended to upgrade the affected component.|May 24, 2022; 12:15:07 PM -0400|V3.1: 9.8 CRITICAL      V2.0: 5.0 MEDIUM (https://nvd.nist.gov/vuln-metrics/cvss/v3-calculator?name=CVE-2013-10004&vector=AV:N/AC:L/PR:N/UI:N/S:U/C:H/I:H/A:H&version=3.1&source=NIST)|https://nvd.nist.gov/vuln/detail/CVE-2013-10004
CVE-2013-10005|The RemoteAddr and LocalAddr methods on the returned net.Conn may call themselves, leading to an infinite loop which will crash the program due to a stack overflow.|December 27, 2022; 5:15:10 PM -0500|V3.1: 7.5 HIGHV2.0:(not available)  (https://nvd.nist.gov/vuln-metrics/cvss/v3-calculator?name=CVE-2013-10005&vector=AV:N/AC:L/PR:N/UI:N/S:U/C:N/I:N/A:H&version=3.1&source=NIST)|https://nvd.nist.gov/vuln/detail/CVE-2013-10005
CVE-2013-10006|A vulnerability classified as problematic was found in Ziftr primecoin up to 0.8.4rc1. Affected by this vulnerability is the function HTTPAuthorized of the file src/bitcoinrpc.cpp. The manipulation of the argument strUserPass/strRPCUserColonPass leads to observable timing discrepancy. The complexity of an attack is rather high. The exploitation appears to be difficult. Upgrading to version 0.8.4rc2 is able to address this issue. The patch is named cdb3441b5cd2c1bae49fae671dc4a496f7c96322. It is recommended to upgrade the affected component. The associated identifier of this vulnerability is VDB-217171.|January 01, 2023; 12:15:10 PM -0500|V3.1: 7.5 HIGHV2.0:(not available)  (https://nvd.nist.gov/vuln-metrics/cvss/v3-calculator?name=CVE-2013-10006&vector=AV:N/AC:L/PR:N/UI:N/S:U/C:H/I:N/A:N&version=3.1&source=NIST)|https://nvd.nist.gov/vuln/detail/CVE-2013-10006
CVE-2013-10007|A vulnerability classified as problematic has been found in ethitter WP-Print-Friendly up to 0.5.2. This affects an unknown part of the file wp-print-friendly.php. The manipulation leads to information disclosure. It is possible to initiate the attack remotely. Upgrading to version 0.5.3 is able to address this issue. The identifier of the patch is 437787292670c20b4abe20160ebbe8428187f2b4. It is recommended to upgrade the affected component. The identifier VDB-217269 was assigned to this vulnerability.|January 03, 2023; 6:15:09 AM -0500|V3.1: 7.5 HIGHV2.0:(not available)  (https://nvd.nist.gov/vuln-metrics/cvss/v3-calculator?name=CVE-2013-10007&vector=AV:N/AC:L/PR:N/UI:N/S:U/C:H/I:N/A:N&version=3.1&source=NIST)|https://nvd.nist.gov/vuln/detail/CVE-2013-10007
CVE-2013-10008|A vulnerability was found in sheilazpy eShop. It has been classified as critical. Affected is an unknown function. The manipulation leads to sql injection. The name of the patch is e096c5849c4dc09e1074104531014a62a5413884. It is recommended to apply a patch to fix this issue. The identifier of this vulnerability is VDB-217572.|January 06, 2023; 5:15:08 PM -0500|V3.1: 9.8 CRITICALV2.0:(not available)  (https://nvd.nist.gov/vuln-metrics/cvss/v3-calculator?name=CVE-2013-10008&vector=AV:N/AC:L/PR:N/UI:N/S:U/C:H/I:H/A:H&version=3.1&source=NIST)|https://nvd.nist.gov/vuln/detail/CVE-2013-10008
CVE-2013-10009|A vulnerability was found in DrAzraelTod pyChao and classified as critical. Affected by this issue is the function klauen/lesen of the file mod_fun/__init__.py. The manipulation leads to sql injection. The patch is identified as 9d8adbc07c384ba51c2583ce0819c9abb77dc648. It is recommended to apply a patch to fix this issue. VDB-217634 is the identifier assigned to this vulnerability.|January 07, 2023; 3:15:08 PM -0500|V3.1: 9.8 CRITICALV2.0:(not available)  (https://nvd.nist.gov/vuln-metrics/cvss/v3-calculator?name=CVE-2013-10009&vector=AV:N/AC:L/PR:N/UI:N/S:U/C:H/I:H/A:H&version=3.1&source=NIST)|https://nvd.nist.gov/vuln/detail/CVE-2013-10009
CVE-2013-10010|A vulnerability classified as problematic has been found in zerochplus. This affects the function PrintResList of the file test/mordor/thread.res.pl. The manipulation leads to cross site scripting. It is possible to initiate the attack remotely. The patch is named 9ddf9ecca8565341d8d26a3b2f64540bde4fa273. It is recommended to apply a patch to fix this issue. The associated identifier of this vulnerability is VDB-218007.|January 11, 2023; 11:15:09 AM -0500|V3.1: 6.1 MEDIUMV2.0:(not available)  (https://nvd.nist.gov/vuln-metrics/cvss/v3-calculator?name=CVE-2013-10010&vector=AV:N/AC:L/PR:N/UI:R/S:C/C:L/I:L/A:N&version=3.1&source=NIST)|https://nvd.nist.gov/vuln/detail/CVE-2013-10010
CVE-2013-10011|A vulnerability was found in aeharding classroom-engagement-system and classified as critical. Affected by this issue is some unknown functionality. The manipulation leads to sql injection. The attack may be launched remotely. The name of the patch is 096de5815c7b414e7339f3439522a446098fb73a. It is recommended to apply a patch to fix this issue. The identifier of this vulnerability is VDB-218156.|January 12, 2023; 11:15:09 AM -0500|V3.1: 9.8 CRITICALV2.0:(not available)  (https://nvd.nist.gov/vuln-metrics/cvss/v3-calculator?name=CVE-2013-10011&vector=AV:N/AC:L/PR:N/UI:N/S:U/C:H/I:H/A:H&version=3.1&source=NIST)|https://nvd.nist.gov/vuln/detail/CVE-2013-10011
CVE-2013-10012|A vulnerability, which was classified as critical, was found in antonbolling clan7ups. Affected is an unknown function of the component Login/Session. The manipulation leads to sql injection. The name of the patch is 25afad571c488291033958d845830ba0a1710764. It is recommended to apply a patch to fix this issue. The identifier of this vulnerability is VDB-218388.|January 16, 2023; 6:15:10 AM -0500|V3.1: 9.8 CRITICALV2.0:(not available)  (https://nvd.nist.gov/vuln-metrics/cvss/v3-calculator?name=CVE-2013-10012&vector=AV:N/AC:L/PR:N/UI:N/S:U/C:H/I:H/A:H&version=3.1&source=NIST)|https://nvd.nist.gov/vuln/detail/CVE-2013-10012
CVE-2013-10013|A vulnerability was found in Bricco Authenticator Plugin. It has been declared as critical. This vulnerability affects the function authenticate/compare of the file src/java/talentum/escenic/plugins/authenticator/authenticators/DBAuthenticator.java. The manipulation leads to sql injection. Upgrading to version 1.39 is able to address this issue. The name of the patch is a5456633ff75e8f13705974c7ed1ce77f3f142d5. It is recommended to upgrade the affected component. The identifier of this vulnerability is VDB-218428.|January 17, 2023; 11:15:16 AM -0500|V3.1: 9.8 CRITICALV2.0:(not available)  (https://nvd.nist.gov/vuln-metrics/cvss/v3-calculator?name=CVE-2013-10013&vector=AV:N/AC:L/PR:N/UI:N/S:U/C:H/I:H/A:H&version=3.1&source=NIST)|https://nvd.nist.gov/vuln/detail/CVE-2013-10013
