Vuln ID|Summary|Published Date|CVSS Severity|Link
CVE-2013-10027|A vulnerability was found in Blogger Importer Plugin up to 0.5 on WordPress. It has been classified as problematic. Affected is the function start/restart of the file blogger-importer.php. The manipulation leads to cross-site request forgery. It is possible to launch the attack remotely. Upgrading to version 0.6 is able to address this issue. The patch is identified as b83fa4f862b0f19a54cfee76060ec9c2e7f7ca70. It is recommended to upgrade the affected component. VDB-230658 is the identifier assigned to this vulnerability.|June 04, 2023; 10:15:09 AM -0400|V3.1: 8.8 HIGHV2.0:(not available)  (https://nvd.nist.gov/vuln-metrics/cvss/v3-calculator?name=CVE-2013-10027&vector=AV:N/AC:L/PR:N/UI:R/S:U/C:H/I:H/A:H&version=3.1&source=NIST)|https://nvd.nist.gov/vuln/detail/CVE-2013-10027
CVE-2013-10028|A vulnerability was found in EELV Newsletter Plugin 2.x on WordPress. It has been rated as problematic. Affected by this issue is the function style_newsletter of the file lettreinfo.php. The manipulation of the argument email leads to cross site scripting. The attack may be launched remotely. The name of the patch is 3339b42316c5edf73e56eb209b6a3bb3e868d6ed. It is recommended to upgrade the affected component. The identifier of this vulnerability is VDB-230660.|June 04, 2023; 3:15:09 PM -0400|V3.1: 6.1 MEDIUMV2.0:(not available)  (https://nvd.nist.gov/vuln-metrics/cvss/v3-calculator?name=CVE-2013-10028&vector=AV:N/AC:L/PR:N/UI:R/S:C/C:L/I:L/A:N&version=3.1&source=NIST)|https://nvd.nist.gov/vuln/detail/CVE-2013-10028
CVE-2013-10029|A vulnerability classified as problematic was found in Exit Box Lite Plugin up to 1.06 on WordPress. Affected by this vulnerability is the function exitboxadmin of the file wordpress-exit-box-lite.php. The manipulation leads to cross-site request forgery. The attack can be launched remotely. Upgrading to version 1.10 is able to address this issue. The patch is named fad26701addb862c51baf85c6e3cc136aa79c309. It is recommended to upgrade the affected component. The associated identifier of this vulnerability is VDB-230671.|June 05, 2023; 5:15:09 PM -0400|V3.1: 8.8 HIGHV2.0:(not available)  (https://nvd.nist.gov/vuln-metrics/cvss/v3-calculator?name=CVE-2013-10029&vector=AV:N/AC:L/PR:N/UI:R/S:U/C:H/I:H/A:H&version=3.1&source=NIST)|https://nvd.nist.gov/vuln/detail/CVE-2013-10029
CVE-2013-10030|A vulnerability, which was classified as problematic, has been found in Exit Box Lite Plugin up to 1.06 on WordPress. Affected by this issue is some unknown functionality of the file wordpress-exit-box-lite.php. The manipulation leads to information disclosure. The attack may be launched remotely. Upgrading to version 1.10 is able to address this issue. The name of the patch is fad26701addb862c51baf85c6e3cc136aa79c309. It is recommended to upgrade the affected component. The identifier of this vulnerability is VDB-230672.|June 05, 2023; 6:15:09 PM -0400|V3.1: 7.5 HIGHV2.0:(not available)  (https://nvd.nist.gov/vuln-metrics/cvss/v3-calculator?name=CVE-2013-10030&vector=AV:N/AC:L/PR:N/UI:N/S:U/C:H/I:N/A:N&version=3.1&source=NIST)|https://nvd.nist.gov/vuln/detail/CVE-2013-10030
CVE-2013-2513|The flash_tool gem through 0.6.0 for Ruby allows command execution via shell metacharacters in the name of a downloaded file.|December 12, 2023; 11:15:07 AM -0500|V3.1: 9.8 CRITICALV2.0:(not available)  (https://nvd.nist.gov/vuln-metrics/cvss/v3-calculator?name=CVE-2013-2513&vector=AV:N/AC:L/PR:N/UI:N/S:U/C:H/I:H/A:H&version=3.1&source=NIST)|https://nvd.nist.gov/vuln/detail/CVE-2013-2513
