Vuln ID|Summary|Published Date|CVSS Severity|Link
CVE-2018-14628|An information leak vulnerability was discovered in Samba's LDAP server. Due to missing access control checks, an authenticated but unprivileged attacker could discover the names and preserved attributes of deleted objects in the LDAP store.|January 17, 2023; 1:15:10 PM -0500|V3.1: 4.3 MEDIUMV2.0:(not available)  (https://nvd.nist.gov/vuln-metrics/cvss/v3-calculator?name=CVE-2018-14628&vector=AV:N/AC:L/PR:L/UI:N/S:U/C:L/I:N/A:N&version=3.1&source=NIST)|https://nvd.nist.gov/vuln/detail/CVE-2018-14628
CVE-2018-15472|An issue was discovered in GitLab Community and Enterprise Edition before 11.1.7, 11.2.x before 11.2.4, and 11.3.x before 11.3.1. The diff formatter using rouge can block for a long time in Sidekiq jobs without any timeout.|April 15, 2023; 7:15:13 PM -0400|V3.1: 7.5 HIGHV2.0:(not available)  (https://nvd.nist.gov/vuln-metrics/cvss/v3-calculator?name=CVE-2018-15472&vector=AV:N/AC:L/PR:N/UI:N/S:U/C:N/I:N/A:H&version=3.1&source=NIST)|https://nvd.nist.gov/vuln/detail/CVE-2018-15472
CVE-2018-16135|The Opera Mini application 47.1.2249.129326 for Android allows remote attackers to spoof the Location Permission dialog via a crafted web site.|December 26, 2022; 5:15:10 PM -0500|V3.1: 6.5 MEDIUMV2.0:(not available)  (https://nvd.nist.gov/vuln-metrics/cvss/v3-calculator?name=CVE-2018-16135&vector=AV:N/AC:L/PR:N/UI:R/S:U/C:N/I:H/A:N&version=3.1&source=NIST)|https://nvd.nist.gov/vuln/detail/CVE-2018-16135
CVE-2018-16153|An issue was discovered in Apereo Opencast 4.x through 10.x before 10.6. It sends system digest credentials during authentication attempts to arbitrary external services in some situations.|December 12, 2023; 12:15:07 PM -0500|V3.1: 7.5 HIGHV2.0:(not available)  (https://nvd.nist.gov/vuln-metrics/cvss/v3-calculator?name=CVE-2018-16153&vector=AV:N/AC:L/PR:N/UI:N/S:U/C:H/I:N/A:N&version=3.1&source=NIST)|https://nvd.nist.gov/vuln/detail/CVE-2018-16153
CVE-2018-16739|An issue was discovered on certain ABUS TVIP devices. Due to a path traversal in /opt/cgi/admin/filewrite, an attacker can write to files, and thus execute code arbitrarily with root privileges.|October 26, 2023; 6:15:08 PM -0400|V3.1: 8.8 HIGHV2.0:(not available)  (https://nvd.nist.gov/vuln-metrics/cvss/v3-calculator?name=CVE-2018-16739&vector=AV:N/AC:L/PR:L/UI:N/S:U/C:H/I:H/A:H&version=3.1&source=NIST)|https://nvd.nist.gov/vuln/detail/CVE-2018-16739
CVE-2018-17449|An issue was discovered in GitLab Community and Enterprise Edition before 11.1.7, 11.2.x before 11.2.4, and 11.3.x before 11.3.1. Remote attackers could obtain sensitive information about issues, comments, and project titles via events API insecure direct object reference.|April 15, 2023; 7:15:13 PM -0400|V3.1: 7.5 HIGHV2.0:(not available)  (https://nvd.nist.gov/vuln-metrics/cvss/v3-calculator?name=CVE-2018-17449&vector=AV:N/AC:L/PR:N/UI:N/S:U/C:H/I:N/A:N&version=3.1&source=NIST)|https://nvd.nist.gov/vuln/detail/CVE-2018-17449
CVE-2018-17450|An issue was discovered in GitLab Community and Enterprise Edition before 11.1.7, 11.2.x before 11.2.4, and 11.3.x before 11.3.1. There is Server-Side Request Forgery (SSRF) via the Kubernetes integration, leading (for example) to disclosure of a GCP service token.|April 15, 2023; 7:15:13 PM -0400|V3.1: 4.3 MEDIUMV2.0:(not available)  (https://nvd.nist.gov/vuln-metrics/cvss/v3-calculator?name=CVE-2018-17450&vector=AV:N/AC:L/PR:L/UI:N/S:U/C:L/I:N/A:N&version=3.1&source=NIST)|https://nvd.nist.gov/vuln/detail/CVE-2018-17450
CVE-2018-17451|An issue was discovered in GitLab Community and Enterprise Edition before 11.1.7, 11.2.x before 11.2.4, and 11.3.x before 11.3.1. There is Cross Site Request Forgery (CSRF) in the Slack integration for issuing slash commands.|April 15, 2023; 7:15:13 PM -0400|V3.1: 8.8 HIGHV2.0:(not available)  (https://nvd.nist.gov/vuln-metrics/cvss/v3-calculator?name=CVE-2018-17451&vector=AV:N/AC:L/PR:N/UI:R/S:U/C:H/I:H/A:H&version=3.1&source=NIST)|https://nvd.nist.gov/vuln/detail/CVE-2018-17451
CVE-2018-17452|An issue was discovered in GitLab Community and Enterprise Edition before 11.1.7, 11.2.x before 11.2.4, and 11.3.x before 11.3.1. There is Server-Side Request Forgery (SSRF) via a loopback address to the validate_localhost function in url_blocker.rb.|April 15, 2023; 7:15:13 PM -0400|V3.1: 9.8 CRITICALV2.0:(not available)  (https://nvd.nist.gov/vuln-metrics/cvss/v3-calculator?name=CVE-2018-17452&vector=AV:N/AC:L/PR:N/UI:N/S:U/C:H/I:H/A:H&version=3.1&source=NIST)|https://nvd.nist.gov/vuln/detail/CVE-2018-17452
CVE-2018-17453|An issue was discovered in GitLab Community and Enterprise Edition before 11.1.7, 11.2.x before 11.2.4, and 11.3.x before 11.3.1. Attackers may have been able to obtain sensitive access-token data from Sentry logs via the GRPC::Unknown exception.|April 15, 2023; 7:15:13 PM -0400|V3.1: 5.3 MEDIUMV2.0:(not available)  (https://nvd.nist.gov/vuln-metrics/cvss/v3-calculator?name=CVE-2018-17453&vector=AV:N/AC:L/PR:N/UI:N/S:U/C:L/I:N/A:N&version=3.1&source=NIST)|https://nvd.nist.gov/vuln/detail/CVE-2018-17453
CVE-2018-17454|An issue was discovered in GitLab Community and Enterprise Edition before 11.1.7, 11.2.x before 11.2.4, and 11.3.x before 11.3.1. There is stored XSS on the issue details screen.|April 15, 2023; 7:15:13 PM -0400|V3.1: 5.4 MEDIUMV2.0:(not available)  (https://nvd.nist.gov/vuln-metrics/cvss/v3-calculator?name=CVE-2018-17454&vector=AV:N/AC:L/PR:L/UI:R/S:C/C:L/I:L/A:N&version=3.1&source=NIST)|https://nvd.nist.gov/vuln/detail/CVE-2018-17454
CVE-2018-17455|"An issue was discovered in GitLab Enterprise Edition before 11.1.7, 11.2.x before 11.2.4, and 11.3.x before 11.3.1. Attackers could obtain sensitive information about group names, avatars, LDAP settings, and descriptions via an insecure direct object reference to the ""merge request approvals"" feature."|April 15, 2023; 7:15:13 PM -0400|V3.1: 7.5 HIGHV2.0:(not available)  (https://nvd.nist.gov/vuln-metrics/cvss/v3-calculator?name=CVE-2018-17455&vector=AV:N/AC:L/PR:N/UI:N/S:U/C:H/I:N/A:N&version=3.1&source=NIST)|https://nvd.nist.gov/vuln/detail/CVE-2018-17455
CVE-2018-17536|An issue was discovered in GitLab Community and Enterprise Edition before 11.1.7, 11.2.x before 11.2.4, and 11.3.x before 11.3.1. There is stored XSS on the merge request page via project import.|April 15, 2023; 7:15:13 PM -0400|V3.1: 5.4 MEDIUMV2.0:(not available)  (https://nvd.nist.gov/vuln-metrics/cvss/v3-calculator?name=CVE-2018-17536&vector=AV:N/AC:L/PR:L/UI:R/S:C/C:L/I:L/A:N&version=3.1&source=NIST)|https://nvd.nist.gov/vuln/detail/CVE-2018-17536
CVE-2018-17537|An issue was discovered in GitLab Community and Enterprise Edition before 11.1.7, 11.2.x before 11.2.4, and 11.3.x before 11.3.1. blog-viewer has stored XSS during repository browsing, if package.json exists. .|April 15, 2023; 8:15:07 PM -0400|V3.1: 5.4 MEDIUMV2.0:(not available)  (https://nvd.nist.gov/vuln-metrics/cvss/v3-calculator?name=CVE-2018-17537&vector=AV:N/AC:L/PR:L/UI:R/S:C/C:L/I:L/A:N&version=3.1&source=NIST)|https://nvd.nist.gov/vuln/detail/CVE-2018-17537
CVE-2018-17558|Hardcoded manufacturer credentials and an OS command injection vulnerability in the /cgi-bin/mft/ directory on ABUS TVIP TVIP20050 LM.1.6.18, TVIP10051 LM.1.6.18, TVIP11050 MG.1.6.03.05, TVIP20550 LM.1.6.18, TVIP10050 LM.1.6.18, TVIP11550 MG.1.6.03, TVIP21050 MG.1.6.03, and TVIP51550 MG.1.6.03 cameras allow remote attackers to execute code as root.|October 26, 2023; 6:15:08 PM -0400|V3.1: 9.8 CRITICALV2.0:(not available)  (https://nvd.nist.gov/vuln-metrics/cvss/v3-calculator?name=CVE-2018-17558&vector=AV:N/AC:L/PR:N/UI:N/S:U/C:H/I:H/A:H&version=3.1&source=NIST)|https://nvd.nist.gov/vuln/detail/CVE-2018-17558
CVE-2018-17559|Due to incorrect access control, unauthenticated remote attackers can view the /video.mjpg video stream of certain ABUS TVIP cameras.|October 26, 2023; 6:15:08 PM -0400|V3.1: 7.5 HIGHV2.0:(not available)  (https://nvd.nist.gov/vuln-metrics/cvss/v3-calculator?name=CVE-2018-17559&vector=AV:N/AC:L/PR:N/UI:N/S:U/C:H/I:N/A:N&version=3.1&source=NIST)|https://nvd.nist.gov/vuln/detail/CVE-2018-17559
CVE-2018-17878|Buffer Overflow vulnerability in certain ABUS TVIP cameras allows attackers to gain control of the program via crafted string sent to sprintf() function.|October 26, 2023; 6:15:08 PM -0400|V3.1: 9.8 CRITICALV2.0:(not available)  (https://nvd.nist.gov/vuln-metrics/cvss/v3-calculator?name=CVE-2018-17878&vector=AV:N/AC:L/PR:N/UI:N/S:U/C:H/I:H/A:H&version=3.1&source=NIST)|https://nvd.nist.gov/vuln/detail/CVE-2018-17878
CVE-2018-17879|An issue was discovered on certain ABUS TVIP cameras. The CGI scripts allow remote attackers to execute code via system() as root. There are several injection points in various scripts.|October 26, 2023; 6:15:08 PM -0400|V3.1: 9.8 CRITICALV2.0:(not available)  (https://nvd.nist.gov/vuln-metrics/cvss/v3-calculator?name=CVE-2018-17879&vector=AV:N/AC:L/PR:N/UI:N/S:U/C:H/I:H/A:H&version=3.1&source=NIST)|https://nvd.nist.gov/vuln/detail/CVE-2018-17879
CVE-2018-17883|An issue was discovered in Open Ticket Request System (OTRS) 6.0.x before 6.0.12. An attacker could send an e-mail message with a malicious link to an OTRS system or an agent. If a logged-in agent opens this link, it could cause the execution of JavaScript in the context of OTRS.|April 15, 2023; 8:15:07 PM -0400|V3.1: 6.1 MEDIUMV2.0:(not available)  (https://nvd.nist.gov/vuln-metrics/cvss/v3-calculator?name=CVE-2018-17883&vector=AV:N/AC:L/PR:N/UI:R/S:C/C:L/I:L/A:N&version=3.1&source=NIST)|https://nvd.nist.gov/vuln/detail/CVE-2018-17883
CVE-2018-25046|Due to improper path sanitization, archives containing relative file paths can cause files to be written (or overwritten) outside of the target directory.|December 27, 2022; 5:15:11 PM -0500|V3.1: 9.1 CRITICALV2.0:(not available)  (https://nvd.nist.gov/vuln-metrics/cvss/v3-calculator?name=CVE-2018-25046&vector=AV:N/AC:L/PR:N/UI:N/S:U/C:N/I:H/A:H&version=3.1&source=NIST)|https://nvd.nist.gov/vuln/detail/CVE-2018-25046
CVE-2018-25048|The CODESYS runtime system in multiple versions allows an remote low privileged attacker to use a path traversal vulnerability to access and modify all system files as well as DoS the device.|March 23, 2023; 7:15:12 AM -0400|V3.1: 8.8 HIGHV2.0:(not available)  (https://nvd.nist.gov/vuln-metrics/cvss/v3-calculator?name=CVE-2018-25048&vector=AV:N/AC:L/PR:L/UI:N/S:U/C:H/I:H/A:H&version=3.1&source=CERT%20VDE)|https://nvd.nist.gov/vuln/detail/CVE-2018-25048
CVE-2018-25049|A vulnerability was found in email-existence. It has been rated as problematic. Affected by this issue is some unknown functionality of the file index.js. The manipulation leads to inefficient regular expression complexity. The name of the patch is 0029ba71b6ad0d8ec0baa2ecc6256d038bdd9b56. It is recommended to apply a patch to fix this issue. VDB-216854 is the identifier assigned to this vulnerability.|December 27, 2022; 4:15:09 AM -0500|V3.1: 7.5 HIGHV2.0:(not available)  (https://nvd.nist.gov/vuln-metrics/cvss/v3-calculator?name=CVE-2018-25049&vector=AV:N/AC:L/PR:N/UI:N/S:U/C:N/I:N/A:H&version=3.1&source=NIST)|https://nvd.nist.gov/vuln/detail/CVE-2018-25049
CVE-2018-25050|A vulnerability, which was classified as problematic, has been found in Harvest Chosen up to 1.8.6. Affected by this issue is the function AbstractChosen of the file coffee/lib/abstract-chosen.coffee. The manipulation of the argument group_label leads to cross site scripting. The attack may be launched remotely. Upgrading to version 1.8.7 is able to address this issue. The name of the patch is 77fd031d541e77510268d1041ed37798fdd1017e. It is recommended to upgrade the affected component. The identifier of this vulnerability is VDB-216956.|December 28, 2022; 5:15:08 AM -0500|V3.1: 6.1 MEDIUMV2.0:(not available)  (https://nvd.nist.gov/vuln-metrics/cvss/v3-calculator?name=CVE-2018-25050&vector=AV:N/AC:L/PR:N/UI:R/S:C/C:L/I:L/A:N&version=3.1&source=NIST)|https://nvd.nist.gov/vuln/detail/CVE-2018-25050
CVE-2018-25051|A vulnerability, which was classified as problematic, was found in JmPotato Pomash. This affects an unknown part of the file Pomash/theme/clean/templates/editor.html. The manipulation of the argument article.title/content.title/article.tag leads to cross site scripting. It is possible to initiate the attack remotely. The name of the patch is be1914ef0a6808e00f51618b2de92496a3604415. It is recommended to apply a patch to fix this issue. The identifier VDB-216957 was assigned to this vulnerability.|December 28, 2022; 7:15:08 AM -0500|V3.1: 6.1 MEDIUMV2.0:(not available)  (https://nvd.nist.gov/vuln-metrics/cvss/v3-calculator?name=CVE-2018-25051&vector=AV:N/AC:L/PR:N/UI:R/S:C/C:L/I:L/A:N&version=3.1&source=NIST)|https://nvd.nist.gov/vuln/detail/CVE-2018-25051
CVE-2018-25052|A vulnerability has been found in Catalyst-Plugin-Session up to 0.40 and classified as problematic. This vulnerability affects the function _load_sessionid of the file lib/Catalyst/Plugin/Session.pm of the component Session ID Handler. The manipulation of the argument sid leads to cross site scripting. The attack can be initiated remotely. Upgrading to version 0.41 is able to address this issue. The name of the patch is 88d1b599e1163761c9bd53bec53ba078f13e09d4. It is recommended to upgrade the affected component. VDB-216958 is the identifier assigned to this vulnerability.|December 28, 2022; 7:15:08 AM -0500|V3.1: 6.1 MEDIUMV2.0:(not available)  (https://nvd.nist.gov/vuln-metrics/cvss/v3-calculator?name=CVE-2018-25052&vector=AV:N/AC:L/PR:N/UI:R/S:C/C:L/I:L/A:N&version=3.1&source=NIST)|https://nvd.nist.gov/vuln/detail/CVE-2018-25052
CVE-2018-25053|A vulnerability was found in moappi Json2html up to 1.1.x and classified as problematic. This issue affects some unknown processing of the file json2html.js. The manipulation leads to cross site scripting. The attack may be initiated remotely. Upgrading to version 1.2.0 is able to address this issue. The name of the patch is 2d3d24d971b19a8ed1fb823596300b9835d55801. It is recommended to upgrade the affected component. The associated identifier of this vulnerability is VDB-216959.|December 28, 2022; 7:15:08 AM -0500|V3.1: 6.1 MEDIUMV2.0:(not available)  (https://nvd.nist.gov/vuln-metrics/cvss/v3-calculator?name=CVE-2018-25053&vector=AV:N/AC:L/PR:N/UI:R/S:C/C:L/I:L/A:N&version=3.1&source=NIST)|https://nvd.nist.gov/vuln/detail/CVE-2018-25053
CVE-2018-25054|A vulnerability was found in shred cilla. It has been classified as problematic. Affected is an unknown function of the file cilla-xample/src/main/webapp/WEB-INF/jsp/view/search.jsp of the component Search Handler. The manipulation of the argument details leads to cross site scripting. It is possible to launch the attack remotely. The name of the patch is d345e6bc7798bd717a583ec7f545ca387819d5c7. It is recommended to apply a patch to fix this issue. The identifier of this vulnerability is VDB-216960.|December 28, 2022; 7:15:08 AM -0500|V3.1: 5.4 MEDIUMV2.0:(not available)  (https://nvd.nist.gov/vuln-metrics/cvss/v3-calculator?name=CVE-2018-25054&vector=AV:N/AC:L/PR:L/UI:R/S:C/C:L/I:L/A:N&version=3.1&source=NIST)|https://nvd.nist.gov/vuln/detail/CVE-2018-25054
CVE-2018-25055|A vulnerability was found in FarCry Solr Pro Plugin up to 1.5.x. It has been declared as problematic. Affected by this vulnerability is an unknown functionality of the file packages/forms/solrProSearch.cfc of the component Search Handler. The manipulation of the argument suggestion leads to cross site scripting. The attack can be launched remotely. Upgrading to version 1.6.0 is able to address this issue. The name of the patch is b8f3d61511c9b02b781ec442bfb803cbff8e08d5. It is recommended to upgrade the affected component. The identifier VDB-216961 was assigned to this vulnerability.|December 28, 2022; 7:15:08 AM -0500|V3.1: 6.1 MEDIUMV2.0:(not available)  (https://nvd.nist.gov/vuln-metrics/cvss/v3-calculator?name=CVE-2018-25055&vector=AV:N/AC:L/PR:N/UI:R/S:C/C:L/I:L/A:N&version=3.1&source=NIST)|https://nvd.nist.gov/vuln/detail/CVE-2018-25055
CVE-2018-25056|A vulnerability, which was classified as problematic, was found in yolapi. Affected is the function render_description of the file yolapi/pypi/metadata.py. The manipulation of the argument text leads to cross site scripting. It is possible to launch the attack remotely. The name of the patch is a0fe129055a99f429133a5c40cb13b44611ff796. It is recommended to apply a patch to fix this issue. VDB-216966 is the identifier assigned to this vulnerability.|December 28, 2022; 7:15:08 AM -0500|V3.1: 6.1 MEDIUMV2.0:(not available)  (https://nvd.nist.gov/vuln-metrics/cvss/v3-calculator?name=CVE-2018-25056&vector=AV:N/AC:L/PR:N/UI:R/S:C/C:L/I:L/A:N&version=3.1&source=NIST)|https://nvd.nist.gov/vuln/detail/CVE-2018-25056
CVE-2018-25057|"A vulnerability was found in simple_php_link_shortener. It has been classified as critical. Affected is an unknown function of the file index.php. The manipulation of the argument $link[""id""] leads to sql injection. The name of the patch is b26ac6480761635ed94ccb0222ba6b732de6e53f. It is recommended to apply a patch to fix this issue. The identifier of this vulnerability is VDB-216996."|December 28, 2022; 4:15:09 PM -0500|V3.1: 9.8 CRITICALV2.0:(not available)  (https://nvd.nist.gov/vuln-metrics/cvss/v3-calculator?name=CVE-2018-25057&vector=AV:N/AC:L/PR:N/UI:N/S:U/C:H/I:H/A:H&version=3.1&source=NIST)|https://nvd.nist.gov/vuln/detail/CVE-2018-25057
CVE-2018-25058|A vulnerability classified as problematic has been found in Twitter-Post-Fetcher up to 17.x. This affects an unknown part of the file js/twitterFetcher.js of the component Link Target Handler. The manipulation leads to use of web link to untrusted target with window.opener access. It is possible to initiate the attack remotely. Upgrading to version 18.0.0 is able to address this issue. The name of the patch is 7d281c6fb5acbc29a2cad295262c1f0c19ca56f3. It is recommended to upgrade the affected component. The identifier VDB-217017 was assigned to this vulnerability.|December 29, 2022; 3:15:08 AM -0500|V3.1: 6.1 MEDIUMV2.0:(not available)  (https://nvd.nist.gov/vuln-metrics/cvss/v3-calculator?name=CVE-2018-25058&vector=AV:N/AC:L/PR:N/UI:R/S:C/C:L/I:L/A:N&version=3.1&source=NIST)|https://nvd.nist.gov/vuln/detail/CVE-2018-25058
CVE-2018-25059|A vulnerability was found in pastebinit up to 0.2.2 and classified as problematic. Affected by this issue is the function pasteHandler of the file server.go. The manipulation of the argument r.URL.Path leads to path traversal. Upgrading to version 0.2.3 is able to address this issue. The name of the patch is 1af2facb6d95976c532b7f8f82747d454a092272. It is recommended to upgrade the affected component. The identifier of this vulnerability is VDB-217040.|December 30, 2022; 6:15:10 AM -0500|V3.1: 5.3 MEDIUMV2.0:(not available)  (https://nvd.nist.gov/vuln-metrics/cvss/v3-calculator?name=CVE-2018-25059&vector=AV:N/AC:L/PR:N/UI:N/S:U/C:L/I:N/A:N&version=3.1&source=NIST)|https://nvd.nist.gov/vuln/detail/CVE-2018-25059
CVE-2018-25060|A vulnerability was found in Macaron csrf and classified as problematic. Affected by this issue is some unknown functionality of the file csrf.go. The manipulation of the argument Generate leads to sensitive cookie without secure attribute. The attack may be launched remotely. The complexity of an attack is rather high. The exploitation is known to be difficult. The patch is identified as dadd1711a617000b70e5e408a76531b73187031c. It is recommended to apply a patch to fix this issue. VDB-217058 is the identifier assigned to this vulnerability.|December 30, 2022; 7:15:09 AM -0500|V3.1: 7.5 HIGHV2.0:(not available)  (https://nvd.nist.gov/vuln-metrics/cvss/v3-calculator?name=CVE-2018-25060&vector=AV:N/AC:L/PR:N/UI:N/S:U/C:H/I:N/A:N&version=3.1&source=NIST)|https://nvd.nist.gov/vuln/detail/CVE-2018-25060
CVE-2018-25061|A vulnerability was found in rgb2hex up to 0.1.5. It has been rated as problematic. This issue affects some unknown processing. The manipulation leads to inefficient regular expression complexity. The attack may be initiated remotely. Upgrading to version 0.1.6 is able to address this issue. The patch is named 9e0c38594432edfa64136fdf7bb651835e17c34f. It is recommended to upgrade the affected component. The associated identifier of this vulnerability is VDB-217151.|December 31, 2022; 3:15:08 PM -0500|V3.1: 7.5 HIGHV2.0:(not available)  (https://nvd.nist.gov/vuln-metrics/cvss/v3-calculator?name=CVE-2018-25061&vector=AV:N/AC:L/PR:N/UI:N/S:U/C:N/I:N/A:H&version=3.1&source=NIST)|https://nvd.nist.gov/vuln/detail/CVE-2018-25061
CVE-2018-25062|A vulnerability classified as problematic has been found in flar2 ElementalX up to 6.x on Nexus 9. Affected is the function xfrm_dump_policy_done of the file net/xfrm/xfrm_user.c of the component ipsec. The manipulation leads to denial of service. Upgrading to version 7.00 is able to address this issue. The name of the patch is 1df72c9f0f61304437f4f1037df03b5fb36d5a79. It is recommended to upgrade the affected component. The identifier of this vulnerability is VDB-217152.|January 01, 2023; 4:15:09 AM -0500|V3.1: 7.5 HIGHV2.0:(not available)  (https://nvd.nist.gov/vuln-metrics/cvss/v3-calculator?name=CVE-2018-25062&vector=AV:N/AC:L/PR:N/UI:N/S:U/C:N/I:N/A:H&version=3.1&source=NIST)|https://nvd.nist.gov/vuln/detail/CVE-2018-25062
CVE-2018-25063|A vulnerability classified as problematic was found in Zenoss Dashboard up to 1.3.4. Affected by this vulnerability is an unknown functionality of the file ZenPacks/zenoss/Dashboard/browser/resources/js/defaultportlets.js. The manipulation of the argument HTMLString leads to cross site scripting. The attack can be launched remotely. Upgrading to version 1.3.5 is able to address this issue. The identifier of the patch is f462285a0a2d7e1a9255b0820240b94a43b00a44. It is recommended to upgrade the affected component. The identifier VDB-217153 was assigned to this vulnerability.|January 01, 2023; 4:15:09 AM -0500|V3.1: 6.1 MEDIUMV2.0:(not available)  (https://nvd.nist.gov/vuln-metrics/cvss/v3-calculator?name=CVE-2018-25063&vector=AV:N/AC:L/PR:N/UI:R/S:C/C:L/I:L/A:N&version=3.1&source=NIST)|https://nvd.nist.gov/vuln/detail/CVE-2018-25063
CVE-2018-25064|A vulnerability was found in OSM Lab show-me-the-way. It has been rated as problematic. This issue affects some unknown processing of the file js/site.js. The manipulation leads to cross site scripting. The attack may be initiated remotely. The patch is named 4bed3b34dcc01fe6661f39c0e5d2285b340f7cac. It is recommended to apply a patch to fix this issue. The associated identifier of this vulnerability is VDB-217439.|January 05, 2023; 4:15:08 AM -0500|V3.1: 6.1 MEDIUMV2.0:(not available)  (https://nvd.nist.gov/vuln-metrics/cvss/v3-calculator?name=CVE-2018-25064&vector=AV:N/AC:L/PR:N/UI:R/S:C/C:L/I:L/A:N&version=3.1&source=NIST)|https://nvd.nist.gov/vuln/detail/CVE-2018-25064
CVE-2018-25065|A vulnerability was found in Wikimedia mediawiki-extensions-I18nTags and classified as problematic. This issue affects some unknown processing of the file I18nTags_body.php of the component Unlike Parser. The manipulation leads to cross site scripting. The attack may be initiated remotely. The identifier of the patch is b4bc3cbbb099eab50cf2b544cf577116f1867b94. It is recommended to apply a patch to fix this issue. The identifier VDB-217445 was assigned to this vulnerability.|January 05, 2023; 5:15:09 AM -0500|V3.1: 6.1 MEDIUMV2.0:(not available)  (https://nvd.nist.gov/vuln-metrics/cvss/v3-calculator?name=CVE-2018-25065&vector=AV:N/AC:L/PR:N/UI:R/S:C/C:L/I:L/A:N&version=3.1&source=NIST)|https://nvd.nist.gov/vuln/detail/CVE-2018-25065
CVE-2018-25066|A vulnerability was found in PeterMu nodebatis up to 2.1.x. It has been classified as critical. Affected is an unknown function. The manipulation leads to sql injection. Upgrading to version 2.2.0 is able to address this issue. The patch is identified as 6629ff5b7e3d62ad8319007a54589ec1f62c7c35. It is recommended to upgrade the affected component. VDB-217554 is the identifier assigned to this vulnerability.|January 06, 2023; 6:15:09 AM -0500|V3.1: 9.8 CRITICALV2.0:(not available)  (https://nvd.nist.gov/vuln-metrics/cvss/v3-calculator?name=CVE-2018-25066&vector=AV:N/AC:L/PR:N/UI:N/S:U/C:H/I:H/A:H&version=3.1&source=NIST)|https://nvd.nist.gov/vuln/detail/CVE-2018-25066
CVE-2018-25067|A vulnerability, which was classified as critical, was found in JoomGallery up to 3.3.3. This affects an unknown part of the file administrator/components/com_joomgallery/views/config/tmpl/default.php of the component Image Sort Handler. The manipulation leads to sql injection. Upgrading to version 3.3.4 is able to address this issue. The identifier of the patch is dc414ee954e849082260f8613e15a1c1e1d354a1. It is recommended to upgrade the affected component. The identifier VDB-217569 was assigned to this vulnerability.|January 06, 2023; 4:15:09 PM -0500|V3.1: 7.2 HIGHV2.0:(not available)  (https://nvd.nist.gov/vuln-metrics/cvss/v3-calculator?name=CVE-2018-25067&vector=AV:N/AC:L/PR:H/UI:N/S:U/C:H/I:H/A:H&version=3.1&source=NIST)|https://nvd.nist.gov/vuln/detail/CVE-2018-25067
