Vuln ID|Summary|Published Date|CVSS Severity|Link
CVE-2013-5571|HMailServer 5.3.x and prior: Memory Corruption which could cause DOS|January 07, 2020; 9:15:10 AM -0500|V3.1: 5.9 MEDIUM      V2.0: 2.6 LOW (https://nvd.nist.gov/vuln-metrics/cvss/v3-calculator?name=CVE-2013-5571&vector=AV:N/AC:H/PR:N/UI:N/S:U/C:N/I:N/A:H&version=3.1&source=NIST)|https://nvd.nist.gov/vuln/detail/CVE-2013-5571
CVE-2013-5582|Ammyy Admin 3.2 and earlier stores the client ID at a fixed memory location, which might make it easier for user-assisted remote attackers to bypass authentication by running a local program that extracts a field from the AA_v3.2.exe file.|February 11, 2020; 2:15:10 PM -0500|V3.1: 7.8 HIGH      V2.0: 6.8 MEDIUM (https://nvd.nist.gov/vuln-metrics/cvss/v3-calculator?name=CVE-2013-5582&vector=AV:L/AC:L/PR:N/UI:R/S:U/C:H/I:H/A:H&version=3.1&source=NIST)|https://nvd.nist.gov/vuln/detail/CVE-2013-5582
CVE-2013-5594|Mozilla Firefox before 25 allows modification of anonymous content of pluginProblem.xml binding|February 18, 2020; 8:15:10 AM -0500|V3.1: 4.3 MEDIUM      V2.0: 4.3 MEDIUM (https://nvd.nist.gov/vuln-metrics/cvss/v3-calculator?name=CVE-2013-5594&vector=AV:N/AC:L/PR:N/UI:R/S:U/C:N/I:L/A:N&version=3.1&source=NIST)|https://nvd.nist.gov/vuln/detail/CVE-2013-5594
CVE-2013-5637|PQI AirCard has persistent XSS|January 07, 2020; 12:15:10 PM -0500|V3.1: 5.4 MEDIUM      V2.0: 3.5 LOW (https://nvd.nist.gov/vuln-metrics/cvss/v3-calculator?name=CVE-2013-5637&vector=AV:N/AC:L/PR:L/UI:R/S:C/C:L/I:L/A:N&version=3.1&source=NIST)|https://nvd.nist.gov/vuln/detail/CVE-2013-5637
CVE-2013-5638|Transcend WiFiSD 1.8 has persistent XSS|January 07, 2020; 12:15:10 PM -0500|V3.1: 5.4 MEDIUM      V2.0: 3.5 LOW (https://nvd.nist.gov/vuln-metrics/cvss/v3-calculator?name=CVE-2013-5638&vector=AV:N/AC:L/PR:L/UI:R/S:C/C:L/I:L/A:N&version=3.1&source=NIST)|https://nvd.nist.gov/vuln/detail/CVE-2013-5638
CVE-2013-5654|Vulnerability in YingZhi Python Programming Language v1.9 allows arbitrary anonymous uploads to the phone's storage|February 15, 2019; 4:29:00 PM -0500|V3.0: 9.1 CRITICAL      V2.0: 9.4 HIGH (https://nvd.nist.gov/vuln-metrics/cvss/v3-calculator?name=CVE-2013-5654&vector=AV:N/AC:L/PR:N/UI:N/S:U/C:H/I:H/A:N&version=3.0&source=NIST)|https://nvd.nist.gov/vuln/detail/CVE-2013-5654
CVE-2013-5656|FuzeZip 1.0.0.131625 has a Local Buffer Overflow vulnerability|January 07, 2020; 12:15:10 PM -0500|V3.1: 7.8 HIGH      V2.0: 4.6 MEDIUM (https://nvd.nist.gov/vuln-metrics/cvss/v3-calculator?name=CVE-2013-5656&vector=AV:L/AC:L/PR:L/UI:N/S:U/C:H/I:H/A:H&version=3.1&source=NIST)|https://nvd.nist.gov/vuln/detail/CVE-2013-5656
CVE-2013-5657|AultWare pwStore 2010.8.30.0 has DoS via an empty HTTP request|January 07, 2020; 12:15:10 PM -0500|V3.1: 7.5 HIGH      V2.0: 5.0 MEDIUM (https://nvd.nist.gov/vuln-metrics/cvss/v3-calculator?name=CVE-2013-5657&vector=AV:N/AC:L/PR:N/UI:N/S:U/C:N/I:N/A:H&version=3.1&source=NIST)|https://nvd.nist.gov/vuln/detail/CVE-2013-5657
CVE-2013-5658|AultWare pwStore 2010.8.30.0 has XSS|January 07, 2020; 12:15:10 PM -0500|V3.1: 6.1 MEDIUM      V2.0: 4.3 MEDIUM (https://nvd.nist.gov/vuln-metrics/cvss/v3-calculator?name=CVE-2013-5658&vector=AV:N/AC:L/PR:N/UI:R/S:C/C:L/I:L/A:N&version=3.1&source=NIST)|https://nvd.nist.gov/vuln/detail/CVE-2013-5658
CVE-2013-5659|Wiz 5.0.3 has a user mode write access violation|January 27, 2020; 10:15:11 AM -0500|V3.1: 7.5 HIGH      V2.0: 5.0 MEDIUM (https://nvd.nist.gov/vuln-metrics/cvss/v3-calculator?name=CVE-2013-5659&vector=AV:N/AC:L/PR:N/UI:N/S:U/C:N/I:N/A:H&version=3.1&source=NIST)|https://nvd.nist.gov/vuln/detail/CVE-2013-5659
CVE-2013-5661|Cache Poisoning issue exists in DNS Response Rate Limiting.|November 05, 2019; 2:15:10 PM -0500|V3.1: 5.9 MEDIUM      V2.0: 2.6 LOW (https://nvd.nist.gov/vuln-metrics/cvss/v3-calculator?name=CVE-2013-5661&vector=AV:N/AC:H/PR:N/UI:N/S:U/C:N/I:H/A:N&version=3.1&source=NIST)|https://nvd.nist.gov/vuln/detail/CVE-2013-5661
CVE-2013-5687|RiskNet Acquirer before hotfix 6.0 b7+ADHOC-443 ApplicationServiceBean contains a service information disclosure.|February 13, 2020; 7:15:11 PM -0500|V3.1: 7.5 HIGH      V2.0: 5.0 MEDIUM (https://nvd.nist.gov/vuln-metrics/cvss/v3-calculator?name=CVE-2013-5687&vector=AV:N/AC:L/PR:N/UI:N/S:U/C:H/I:N/A:N&version=3.1&source=NIST)|https://nvd.nist.gov/vuln/detail/CVE-2013-5687
CVE-2013-5743|Multiple SQL injection vulnerabilities in Zabbix 1.8.x before 1.8.18rc1, 2.0.x before 2.0.9rc1, and 2.1.x before 2.1.7.|December 11, 2019; 2:15:12 PM -0500|V3.1: 9.8 CRITICAL      V2.0: 7.5 HIGH (https://nvd.nist.gov/vuln-metrics/cvss/v3-calculator?name=CVE-2013-5743&vector=AV:N/AC:L/PR:N/UI:N/S:U/C:H/I:H/A:H&version=3.1&source=NIST)|https://nvd.nist.gov/vuln/detail/CVE-2013-5743
CVE-2013-5945|Multiple SQL injection vulnerabilities in D-Link DSR-150 with firmware before 1.08B44; DSR-150N with firmware before 1.05B64; DSR-250 and DSR-250N with firmware before 1.08B44; and DSR-500, DSR-500N, DSR-1000, and DSR-1000N with firmware before 1.08B77 allow remote attackers to execute arbitrary SQL commands via the password to (1) the login.authenticate function in share/lua/5.1/teamf1lualib/login.lua or (2) captivePortal.lua.|February 11, 2020; 7:15:11 AM -0500|V3.1: 9.8 CRITICAL      V2.0: 10.0 HIGH (https://nvd.nist.gov/vuln-metrics/cvss/v3-calculator?name=CVE-2013-5945&vector=AV:N/AC:L/PR:N/UI:N/S:U/C:H/I:H/A:H&version=3.1&source=NIST)|https://nvd.nist.gov/vuln/detail/CVE-2013-5945
CVE-2013-5978|Multiple cross-site scripting (XSS) vulnerabilities in products.php in the Cart66 Lite plugin before 1.5.1.15 for WordPress allow remote attackers to inject arbitrary web script or HTML via the (1) Product name or (2) Price description fields via a request to wp-admin/admin.php. NOTE: This issue may only cross privilege boundaries if used in combination with CVE-2013-5977.|December 11, 2019; 2:15:12 PM -0500|V3.1: 6.1 MEDIUM      V2.0: 4.3 MEDIUM (https://nvd.nist.gov/vuln-metrics/cvss/v3-calculator?name=CVE-2013-5978&vector=AV:N/AC:L/PR:N/UI:R/S:C/C:L/I:L/A:N&version=3.1&source=NIST)|https://nvd.nist.gov/vuln/detail/CVE-2013-5978
CVE-2013-5988|A Cross-site Scripting (XSS) vulnerability exists in the All in One SEO Pack plugin before 2.0.3.1 for WordPress via the Search parameter.|February 11, 2020; 1:15:16 PM -0500|V3.1: 6.1 MEDIUM      V2.0: 4.3 MEDIUM (https://nvd.nist.gov/vuln-metrics/cvss/v3-calculator?name=CVE-2013-5988&vector=AV:N/AC:L/PR:N/UI:R/S:C/C:L/I:L/A:N&version=3.1&source=NIST)|https://nvd.nist.gov/vuln/detail/CVE-2013-5988
CVE-2013-6022|A Cross-Site Scripting (XSS) vulnerability exists in Tiki Wiki CMG Groupware 11.0 via the id paraZeroClipboard.swf, which could let a remote malicious user execute arbitrary code.|February 12, 2020; 5:15:12 PM -0500|V3.1: 6.1 MEDIUM      V2.0: 4.3 MEDIUM (https://nvd.nist.gov/vuln-metrics/cvss/v3-calculator?name=CVE-2013-6022&vector=AV:N/AC:L/PR:N/UI:R/S:C/C:L/I:L/A:N&version=3.1&source=NIST)|https://nvd.nist.gov/vuln/detail/CVE-2013-6022
CVE-2013-6049|apt-listbugs before 0.1.10 creates temporary files insecurely, which allows attackers to have unspecified impact via unknown vectors.|October 20, 2017; 2:29:00 PM -0400|V3.0: 7.8 HIGH      V2.0: 4.6 MEDIUM (https://nvd.nist.gov/vuln-metrics/cvss/v3-calculator?name=CVE-2013-6049&vector=AV:L/AC:L/PR:L/UI:N/S:U/C:H/I:H/A:H&version=3.0&source=NIST)|https://nvd.nist.gov/vuln/detail/CVE-2013-6049
CVE-2013-6056|OSSIM before 4.3.3.1 has tele_compress.php path traversal vulnerability|January 27, 2020; 10:15:11 AM -0500|V3.1: 7.5 HIGH      V2.0: 7.8 HIGH (https://nvd.nist.gov/vuln-metrics/cvss/v3-calculator?name=CVE-2013-6056&vector=AV:N/AC:L/PR:N/UI:N/S:U/C:H/I:N/A:N&version=3.1&source=NIST)|https://nvd.nist.gov/vuln/detail/CVE-2013-6056
CVE-2013-6225|LiveZilla 5.0.1.4 has a Remote Code Execution vulnerability|January 13, 2020; 9:15:12 AM -0500|V3.1: 9.8 CRITICAL      V2.0: 7.5 HIGH (https://nvd.nist.gov/vuln-metrics/cvss/v3-calculator?name=CVE-2013-6225&vector=AV:N/AC:L/PR:N/UI:N/S:U/C:H/I:H/A:H&version=3.1&source=NIST)|https://nvd.nist.gov/vuln/detail/CVE-2013-6225
CVE-2013-6231|SpagoBI before 4.1 has Privilege Escalation via an error in the AdapterHTTP script|January 10, 2020; 9:15:10 AM -0500|V3.1: 8.8 HIGH      V2.0: 9.0 HIGH (https://nvd.nist.gov/vuln-metrics/cvss/v3-calculator?name=CVE-2013-6231&vector=AV:N/AC:L/PR:L/UI:N/S:U/C:H/I:H/A:H&version=3.1&source=NIST)|https://nvd.nist.gov/vuln/detail/CVE-2013-6231
CVE-2013-6234|"Unrestricted file upload vulnerability in the Worksheet designer in SpagoBI before 4.1 allows remote authenticated users to execute arbitrary code by uploading a file with an executable extension, then accessing it via a direct request to the file in an unspecified directory, aka ""XSS File Upload."""|November 22, 2019; 2:15:11 PM -0500|V3.1: 8.0 HIGH      V2.0: 6.0 MEDIUM (https://nvd.nist.gov/vuln-metrics/cvss/v3-calculator?name=CVE-2013-6234&vector=AV:N/AC:L/PR:L/UI:R/S:U/C:H/I:H/A:H&version=3.1&source=NIST)|https://nvd.nist.gov/vuln/detail/CVE-2013-6234
CVE-2013-6236|IZON IP 2.0.2: hard-coded password vulnerability|February 12, 2020; 11:15:11 AM -0500|V3.1: 9.8 CRITICAL      V2.0: 10.0 HIGH (https://nvd.nist.gov/vuln-metrics/cvss/v3-calculator?name=CVE-2013-6236&vector=AV:N/AC:L/PR:N/UI:N/S:U/C:H/I:H/A:H&version=3.1&source=NIST)|https://nvd.nist.gov/vuln/detail/CVE-2013-6236
CVE-2013-6239|Cross-site scripting (XSS) vulnerability in the photo gallery model in Exis Contexis before 2.0 allows remote attackers to inject arbitrary web script or HTML via the image parameter in a detail action.|November 22, 2019; 2:15:11 PM -0500|V3.1: 6.1 MEDIUM      V2.0: 4.3 MEDIUM (https://nvd.nist.gov/vuln-metrics/cvss/v3-calculator?name=CVE-2013-6239&vector=AV:N/AC:L/PR:N/UI:R/S:C/C:L/I:L/A:N&version=3.1&source=NIST)|https://nvd.nist.gov/vuln/detail/CVE-2013-6239
CVE-2013-6242|Cross-site scripting (XSS) vulnerability in the frontend in Open-Xchange (OX) AppSuite 6.22.3 before 6.22.3-rev5 and 6.22.4 before 6.22.4-rev12 allows remote attackers to inject arbitrary web script or HTML via the subject of an email. NOTE: the vulnerabilities related to the body of the email and the publication name were SPLIT from this CVE ID because they affect different sets of versions.|January 02, 2020; 2:15:11 PM -0500|V3.1: 6.1 MEDIUM      V2.0: 4.3 MEDIUM (https://nvd.nist.gov/vuln-metrics/cvss/v3-calculator?name=CVE-2013-6242&vector=AV:N/AC:L/PR:N/UI:R/S:C/C:L/I:L/A:N&version=3.1&source=NIST)|https://nvd.nist.gov/vuln/detail/CVE-2013-6242
CVE-2013-6272|The NotificationBroadcastReceiver class in the com.android.phone process in Google Android 4.1.1 through 4.4.2 allows attackers to bypass intended access restrictions and consequently make phone calls to arbitrary numbers, send mmi or ussd codes, or hangup ongoing calls via a crafted application.|May 02, 2018; 11:29:00 AM -0400|V3.0: 7.8 HIGH      V2.0: 6.8 MEDIUM (https://nvd.nist.gov/vuln-metrics/cvss/v3-calculator?name=CVE-2013-6272&vector=AV:L/AC:L/PR:N/UI:R/S:U/C:H/I:H/A:H&version=3.0&source=NIST)|https://nvd.nist.gov/vuln/detail/CVE-2013-6272
CVE-2013-6275|Multiple CSRF issues in Horde Groupware Webmail Edition 5.1.2 and earlier in basic.php.|November 05, 2019; 2:15:10 PM -0500|V3.1: 6.5 MEDIUM      V2.0: 4.3 MEDIUM (https://nvd.nist.gov/vuln-metrics/cvss/v3-calculator?name=CVE-2013-6275&vector=AV:N/AC:L/PR:N/UI:R/S:U/C:N/I:H/A:N&version=3.1&source=NIST)|https://nvd.nist.gov/vuln/detail/CVE-2013-6275
CVE-2013-6276|QNAP F_VioCard 2312 and F_VioGate 2308 have hardcoded entries in authorized_keys files. NOTE: 1. All active models are not affected. The last affected model was EOL since 2010. 2. The legacy authorization mechanism is no longer adopted in all active models|August 09, 2021; 2:15:07 PM -0400|V3.1: 9.8 CRITICAL      V2.0: 5.0 MEDIUM (https://nvd.nist.gov/vuln-metrics/cvss/v3-calculator?name=CVE-2013-6276&vector=AV:N/AC:L/PR:N/UI:N/S:U/C:H/I:H/A:H&version=3.1&source=NIST)|https://nvd.nist.gov/vuln/detail/CVE-2013-6276
CVE-2013-6277|QNAP VioCard 300 has hardcoded RSA private keys.|February 13, 2020; 6:15:11 PM -0500|V3.1: 7.5 HIGH      V2.0: 5.0 MEDIUM (https://nvd.nist.gov/vuln-metrics/cvss/v3-calculator?name=CVE-2013-6277&vector=AV:N/AC:L/PR:N/UI:N/S:U/C:H/I:N/A:N&version=3.1&source=NIST)|https://nvd.nist.gov/vuln/detail/CVE-2013-6277
CVE-2013-6295|PrestaShop 1.5.5 vulnerable to privilege escalation via a Salesman account via upload module|February 18, 2020; 12:15:12 PM -0500|V3.1: 9.8 CRITICAL      V2.0: 7.5 HIGH (https://nvd.nist.gov/vuln-metrics/cvss/v3-calculator?name=CVE-2013-6295&vector=AV:N/AC:L/PR:N/UI:N/S:U/C:H/I:H/A:H&version=3.1&source=NIST)|https://nvd.nist.gov/vuln/detail/CVE-2013-6295
CVE-2013-6358|PrestaShop 1.5.5 allows remote authenticated attackers to execute arbitrary code by uploading a crafted profile and then accessing it in the module/ directory.|January 23, 2020; 10:15:12 AM -0500|V3.1: 8.8 HIGH      V2.0: 9.0 HIGH (https://nvd.nist.gov/vuln-metrics/cvss/v3-calculator?name=CVE-2013-6358&vector=AV:N/AC:L/PR:L/UI:N/S:U/C:H/I:H/A:H&version=3.1&source=NIST)|https://nvd.nist.gov/vuln/detail/CVE-2013-6358
CVE-2013-6360|TRENDnet TS-S402 has a backdoor to enable TELNET.|February 13, 2020; 6:15:11 PM -0500|V3.1: 7.5 HIGH      V2.0: 5.0 MEDIUM (https://nvd.nist.gov/vuln-metrics/cvss/v3-calculator?name=CVE-2013-6360&vector=AV:N/AC:L/PR:N/UI:N/S:U/C:N/I:H/A:N&version=3.1&source=NIST)|https://nvd.nist.gov/vuln/detail/CVE-2013-6360
CVE-2013-6362|Xerox ColorCube and WorkCenter devices in 2013 had hardcoded FTP and shell user accounts.|February 13, 2020; 6:15:11 PM -0500|V3.1: 9.8 CRITICAL      V2.0: 5.0 MEDIUM (https://nvd.nist.gov/vuln-metrics/cvss/v3-calculator?name=CVE-2013-6362&vector=AV:N/AC:L/PR:N/UI:N/S:U/C:H/I:H/A:H&version=3.1&source=NIST)|https://nvd.nist.gov/vuln/detail/CVE-2013-6362
CVE-2013-6364|Horde Groupware Webmail Edition has CSRF and XSS when saving search as a virtual address book|November 05, 2019; 9:15:13 AM -0500|V3.1: 8.8 HIGH      V2.0: 6.8 MEDIUM (https://nvd.nist.gov/vuln-metrics/cvss/v3-calculator?name=CVE-2013-6364&vector=AV:N/AC:L/PR:N/UI:R/S:U/C:H/I:H/A:H&version=3.1&source=NIST)|https://nvd.nist.gov/vuln/detail/CVE-2013-6364
CVE-2013-6365|Horde Groupware Web mail 5.1.2 has CSRF with requests to change permissions|November 05, 2019; 9:15:13 AM -0500|V3.1: 5.3 MEDIUM      V2.0: 2.6 LOW (https://nvd.nist.gov/vuln-metrics/cvss/v3-calculator?name=CVE-2013-6365&vector=AV:N/AC:H/PR:N/UI:R/S:U/C:N/I:H/A:N&version=3.1&source=NIST)|https://nvd.nist.gov/vuln/detail/CVE-2013-6365
CVE-2013-6430|The JavaScriptUtils.javaScriptEscape method in web/util/JavaScriptUtils.java in Spring MVC in Spring Framework before 3.2.2 does not properly escape certain characters, which allows remote attackers to conduct cross-site scripting (XSS) attacks via a (1) line separator or (2) paragraph separator Unicode character or (3) left or (4) right angle bracket.|January 10, 2020; 9:15:10 AM -0500|V3.1: 5.4 MEDIUM      V2.0: 3.5 LOW (https://nvd.nist.gov/vuln-metrics/cvss/v3-calculator?name=CVE-2013-6430&vector=AV:N/AC:L/PR:L/UI:R/S:C/C:L/I:L/A:N&version=3.1&source=NIST)|https://nvd.nist.gov/vuln/detail/CVE-2013-6430
CVE-2013-6451|Cross-site scripting (XSS) vulnerability in MediaWiki 1.19.9 before 1.19.10, 1.2x before 1.21.4, and 1.22.x before 1.22.1 allows remote attackers to inject arbitrary web script or HTML via unspecified CSS values.|January 28, 2020; 10:15:14 AM -0500|V3.1: 6.1 MEDIUM      V2.0: 4.3 MEDIUM (https://nvd.nist.gov/vuln-metrics/cvss/v3-calculator?name=CVE-2013-6451&vector=AV:N/AC:L/PR:N/UI:R/S:C/C:L/I:L/A:N&version=3.1&source=NIST)|https://nvd.nist.gov/vuln/detail/CVE-2013-6451
CVE-2013-6455|The CentralAuth extension for MediaWiki before 1.19.10, 1.2x before 1.21.4, and 1.22.x before 1.22.1 allows remote attackers to obtain usernames via vectors related to writing the names to the DOM of a page.|January 28, 2020; 10:15:14 AM -0500|V3.1: 5.3 MEDIUM      V2.0: 5.0 MEDIUM (https://nvd.nist.gov/vuln-metrics/cvss/v3-calculator?name=CVE-2013-6455&vector=AV:N/AC:L/PR:N/UI:N/S:U/C:L/I:N/A:N&version=3.1&source=NIST)|https://nvd.nist.gov/vuln/detail/CVE-2013-6455
CVE-2013-6460|Nokogiri gem 1.5.x has Denial of Service via infinite loop when parsing XML documents|November 05, 2019; 10:15:11 AM -0500|V3.1: 6.5 MEDIUM      V2.0: 4.3 MEDIUM (https://nvd.nist.gov/vuln-metrics/cvss/v3-calculator?name=CVE-2013-6460&vector=AV:N/AC:L/PR:N/UI:R/S:U/C:N/I:N/A:H&version=3.1&source=NIST)|https://nvd.nist.gov/vuln/detail/CVE-2013-6460
CVE-2013-6461|Nokogiri gem 1.5.x and 1.6.x has DoS while parsing XML entities by failing to apply limits|November 05, 2019; 10:15:11 AM -0500|V3.1: 6.5 MEDIUM      V2.0: 4.3 MEDIUM (https://nvd.nist.gov/vuln-metrics/cvss/v3-calculator?name=CVE-2013-6461&vector=AV:N/AC:L/PR:N/UI:R/S:U/C:N/I:N/A:H&version=3.1&source=NIST)|https://nvd.nist.gov/vuln/detail/CVE-2013-6461
CVE-2013-6465|Multiple cross-site scripting (XSS) vulnerabilities in JBPM KIE Workbench 6.0.x allow remote authenticated users to inject arbitrary web script or HTML via vectors related to task name html inputs.|December 19, 2017; 2:29:00 PM -0500|V3.0: 5.4 MEDIUM      V2.0: 3.5 LOW (https://nvd.nist.gov/vuln-metrics/cvss/v3-calculator?name=CVE-2013-6465&vector=AV:N/AC:L/PR:L/UI:R/S:C/C:L/I:L/A:N&version=3.0&source=NIST)|https://nvd.nist.gov/vuln/detail/CVE-2013-6465
CVE-2013-6495|JBossWeb Bayeux has reflected XSS|December 11, 2019; 9:15:09 AM -0500|V3.1: 6.1 MEDIUM      V2.0: 4.3 MEDIUM (https://nvd.nist.gov/vuln-metrics/cvss/v3-calculator?name=CVE-2013-6495&vector=AV:N/AC:L/PR:N/UI:R/S:C/C:L/I:L/A:N&version=3.1&source=NIST)|https://nvd.nist.gov/vuln/detail/CVE-2013-6495
CVE-2013-6681|Tube Map Live Underground for Android before 3.0.22 has an Information Disclosure Vulnerability|February 12, 2020; 11:15:11 AM -0500|V3.1: 5.9 MEDIUM      V2.0: 4.3 MEDIUM (https://nvd.nist.gov/vuln-metrics/cvss/v3-calculator?name=CVE-2013-6681&vector=AV:N/AC:H/PR:N/UI:N/S:U/C:H/I:N/A:N&version=3.1&source=NIST)|https://nvd.nist.gov/vuln/detail/CVE-2013-6681
CVE-2013-6739|IBM SPSS Modeler before 16 on UNIX allows remote authenticated users to bypass intended access restrictions via an SSO token. IBM X-Force ID: 89855.|April 27, 2018; 12:29:00 PM -0400|V3.0: 5.4 MEDIUM      V2.0: 5.5 MEDIUM (https://nvd.nist.gov/vuln-metrics/cvss/v3-calculator?name=CVE-2013-6739&vector=AV:N/AC:L/PR:L/UI:N/S:U/C:L/I:L/A:N&version=3.0&source=NIST)|https://nvd.nist.gov/vuln/detail/CVE-2013-6739
CVE-2013-6772|Splunk before 5.0.4 lacks X-Frame-Options which can allow Clickjacking|January 23, 2020; 10:15:12 AM -0500|V3.1: 4.3 MEDIUM      V2.0: 4.3 MEDIUM (https://nvd.nist.gov/vuln-metrics/cvss/v3-calculator?name=CVE-2013-6772&vector=AV:N/AC:L/PR:N/UI:R/S:U/C:N/I:L/A:N&version=3.1&source=NIST)|https://nvd.nist.gov/vuln/detail/CVE-2013-6772
CVE-2013-6773|Splunk 5.0.3 has an Unquoted Service Path in Windows for Universal Forwarder which can allow an attacker to escalate privileges|January 23, 2020; 10:15:12 AM -0500|V3.1: 7.8 HIGH      V2.0: 4.6 MEDIUM (https://nvd.nist.gov/vuln-metrics/cvss/v3-calculator?name=CVE-2013-6773&vector=AV:L/AC:L/PR:L/UI:N/S:U/C:H/I:H/A:H&version=3.1&source=NIST)|https://nvd.nist.gov/vuln/detail/CVE-2013-6773
CVE-2013-6785|Directory traversal vulnerability in url_redirect.cgi in Supermicro IPMI before SMT_X9_315 allows authenticated attackers to read arbitrary files via the url_name parameter.|January 23, 2020; 10:15:12 AM -0500|V3.1: 4.3 MEDIUM      V2.0: 4.0 MEDIUM (https://nvd.nist.gov/vuln-metrics/cvss/v3-calculator?name=CVE-2013-6785&vector=AV:N/AC:L/PR:L/UI:N/S:U/C:L/I:N/A:N&version=3.1&source=NIST)|https://nvd.nist.gov/vuln/detail/CVE-2013-6785
CVE-2013-6792|Google Android prior to 4.4 has an APK Signature Security Bypass Vulnerability|January 23, 2020; 10:15:13 AM -0500|V3.1: 9.8 CRITICAL      V2.0: 7.5 HIGH (https://nvd.nist.gov/vuln-metrics/cvss/v3-calculator?name=CVE-2013-6792&vector=AV:N/AC:L/PR:N/UI:N/S:U/C:H/I:H/A:H&version=3.1&source=NIST)|https://nvd.nist.gov/vuln/detail/CVE-2013-6792
CVE-2013-6811|Multiple cross-site request forgery (CSRF) vulnerabilities in the D-Link DSL-6740U gateway (Rev. H1) allow remote attackers to hijack the authentication of administrators for requests that change administrator credentials or enable remote management services to (1) Custom Services in Port Forwarding, (2) Port Triggering Entries, (3) URL Filters in Parental Control, (4) Print Server settings, (5) QoS Queue Setup, or (6) QoS Classification Entries.|November 22, 2019; 1:15:10 PM -0500|V3.1: 8.8 HIGH      V2.0: 6.8 MEDIUM (https://nvd.nist.gov/vuln-metrics/cvss/v3-calculator?name=CVE-2013-6811&vector=AV:N/AC:L/PR:N/UI:R/S:U/C:H/I:H/A:H&version=3.1&source=NIST)|https://nvd.nist.gov/vuln/detail/CVE-2013-6811
CVE-2013-6876|The (1) pty_init_terminal and (2) pipe_init_terminal functions in main.c in s3dvt 0.2.2 and earlier allows local users to gain privileges by leveraging setuid permissions and usage of bash 4.3 and earlier.  NOTE: this vulnerability was fixed with commit ad732f00b411b092c66a04c359da0f16ec3b387, but the version number was not changed.|April 06, 2018; 1:29:00 PM -0400|V3.0: 7.8 HIGH      V2.0: 7.2 HIGH (https://nvd.nist.gov/vuln-metrics/cvss/v3-calculator?name=CVE-2013-6876&vector=AV:L/AC:L/PR:L/UI:N/S:U/C:H/I:H/A:H&version=3.0&source=NIST)|https://nvd.nist.gov/vuln/detail/CVE-2013-6876
CVE-2013-6878|Cross-site scripting (XSS) vulnerability in the Mijosoft MijoSearch component 2.0.4 and earlier for Joomla! allows remote attackers to inject arbitrary web script or HTML via the query parameter to component/mijosearch/search.|November 22, 2019; 2:15:11 PM -0500|V3.1: 6.1 MEDIUM      V2.0: 4.3 MEDIUM (https://nvd.nist.gov/vuln-metrics/cvss/v3-calculator?name=CVE-2013-6878&vector=AV:N/AC:L/PR:N/UI:R/S:C/C:L/I:L/A:N&version=3.1&source=NIST)|https://nvd.nist.gov/vuln/detail/CVE-2013-6878
CVE-2013-6879|The Mijosoft MijoSearch component 2.0.1 and earlier for Joomla! allows remote attackers to obtain sensitive information via a request to component/mijosearch/search, which reveals the installation path in an error message.|November 22, 2019; 2:15:11 PM -0500|V3.1: 5.3 MEDIUM      V2.0: 5.0 MEDIUM (https://nvd.nist.gov/vuln-metrics/cvss/v3-calculator?name=CVE-2013-6879&vector=AV:N/AC:L/PR:N/UI:N/S:U/C:L/I:N/A:N&version=3.1&source=NIST)|https://nvd.nist.gov/vuln/detail/CVE-2013-6879
CVE-2013-6880|Open redirect in proxy.php in FlashCanvas before 1.6 allows remote attackers to redirect users to arbitrary web sites and conduct cross-site scripting (XSS) attacks via the HTTP Referer header.|November 22, 2019; 1:15:10 PM -0500|V3.1: 6.1 MEDIUM      V2.0: 4.3 MEDIUM (https://nvd.nist.gov/vuln-metrics/cvss/v3-calculator?name=CVE-2013-6880&vector=AV:N/AC:L/PR:N/UI:R/S:C/C:L/I:L/A:N&version=3.1&source=NIST)|https://nvd.nist.gov/vuln/detail/CVE-2013-6880
CVE-2013-6924|Seagate BlackArmor NAS devices with firmware sg2000-2000.1331 allow remote attackers to execute arbitrary commands via shell metacharacters in the ip parameter to backupmgt/getAlias.php.|October 11, 2017; 8:29:00 AM -0400|V3.0: 9.8 CRITICAL      V2.0: 10.0 HIGH (https://nvd.nist.gov/vuln-metrics/cvss/v3-calculator?name=CVE-2013-6924&vector=AV:N/AC:L/PR:N/UI:N/S:U/C:H/I:H/A:H&version=3.0&source=NIST)|https://nvd.nist.gov/vuln/detail/CVE-2013-6924
CVE-2013-6927|Internet TRiLOGI Server (unknown versions) could allow a local user to bypass security and create a local user account.|February 13, 2020; 6:15:11 PM -0500|V3.1: 5.5 MEDIUM      V2.0: 2.1 LOW (https://nvd.nist.gov/vuln-metrics/cvss/v3-calculator?name=CVE-2013-6927&vector=AV:L/AC:L/PR:L/UI:N/S:U/C:N/I:H/A:N&version=3.1&source=NIST)|https://nvd.nist.gov/vuln/detail/CVE-2013-6927
CVE-2013-7051|D-Link DIR-100 4.03B07: cli.cgi security bypass due to failure to check authentication parameters|February 04, 2020; 9:15:11 AM -0500|V3.1: 8.8 HIGH      V2.0: 6.8 MEDIUM (https://nvd.nist.gov/vuln-metrics/cvss/v3-calculator?name=CVE-2013-7051&vector=AV:N/AC:L/PR:N/UI:R/S:U/C:H/I:H/A:H&version=3.1&source=NIST)|https://nvd.nist.gov/vuln/detail/CVE-2013-7051
CVE-2013-7052|D-Link DIR-100 4.03B07: security bypass via an error in the cliget.cgi script|February 04, 2020; 9:15:11 AM -0500|V3.1: 9.8 CRITICAL      V2.0: 5.0 MEDIUM (https://nvd.nist.gov/vuln-metrics/cvss/v3-calculator?name=CVE-2013-7052&vector=AV:N/AC:L/PR:N/UI:N/S:U/C:H/I:H/A:H&version=3.1&source=NIST)|https://nvd.nist.gov/vuln/detail/CVE-2013-7052
CVE-2013-7053|D-Link DIR-100 4.03B07: cli.cgi CSRF|February 04, 2020; 9:15:11 AM -0500|V3.1: 8.8 HIGH      V2.0: 6.8 MEDIUM (https://nvd.nist.gov/vuln-metrics/cvss/v3-calculator?name=CVE-2013-7053&vector=AV:N/AC:L/PR:N/UI:R/S:U/C:H/I:H/A:H&version=3.1&source=NIST)|https://nvd.nist.gov/vuln/detail/CVE-2013-7053
CVE-2013-7054|D-Link DIR-100 4.03B07: cli.cgi XSS|February 04, 2020; 9:15:12 AM -0500|V3.1: 6.1 MEDIUM      V2.0: 4.3 MEDIUM (https://nvd.nist.gov/vuln-metrics/cvss/v3-calculator?name=CVE-2013-7054&vector=AV:N/AC:L/PR:N/UI:R/S:C/C:L/I:L/A:N&version=3.1&source=NIST)|https://nvd.nist.gov/vuln/detail/CVE-2013-7054
CVE-2013-7055|D-Link DIR-100 4.03B07 has PPTP and poe information disclosure|February 04, 2020; 9:15:12 AM -0500|V3.1: 9.8 CRITICAL      V2.0: 5.0 MEDIUM (https://nvd.nist.gov/vuln-metrics/cvss/v3-calculator?name=CVE-2013-7055&vector=AV:N/AC:L/PR:N/UI:N/S:U/C:H/I:H/A:H&version=3.1&source=NIST)|https://nvd.nist.gov/vuln/detail/CVE-2013-7055
CVE-2013-7062|Multiple cross-site scripting (XSS) vulnerabilities in Zope, as used in Plone 3.3.x through 3.3.6, 4.0.x through 4.0.9, 4.1.x through 4.1.6, 4.2.x through 4.2.7, and 4.3 through 4.3.2, allow remote attackers to inject arbitrary web script or HTML via unspecified input in the (1) browser_id_manager or (2) OFS.Image method.|January 02, 2020; 2:15:12 PM -0500|V3.1: 6.1 MEDIUM      V2.0: 4.3 MEDIUM (https://nvd.nist.gov/vuln-metrics/cvss/v3-calculator?name=CVE-2013-7062&vector=AV:N/AC:L/PR:N/UI:R/S:C/C:L/I:L/A:N&version=3.1&source=NIST)|https://nvd.nist.gov/vuln/detail/CVE-2013-7062
