Vuln ID|Summary|Published Date|CVSS Severity|Link
CVE-1999-0422|"In some cases, NetBSD 1.3.3 mount allows local users to execute programs in some file systems that have the ""noexec"" flag set."|March 17, 1999; 12:00:00 AM -0500|V3.x:(not available)       V2.0: 4.6 MEDIUM (https://nvd.nist.gov/vuln-metrics/cvss/v2-calculator?name=CVE-1999-0422&vector=(AV:L/AC:L/Au:N/C:P/I:P/A:P)&version=2.0&source=NIST)|https://nvd.nist.gov/vuln/detail/CVE-1999-0422
CVE-1999-0423|Vulnerability in hpterm on HP-UX 10.20 allows local users to gain additional privileges.|June 01, 1994; 12:00:00 AM -0400|V3.x:(not available)       V2.0: 4.6 MEDIUM (https://nvd.nist.gov/vuln-metrics/cvss/v2-calculator?name=CVE-1999-0423&vector=(AV:L/AC:L/Au:N/C:P/I:P/A:P)&version=2.0&source=NIST)|https://nvd.nist.gov/vuln/detail/CVE-1999-0423
CVE-1999-0424|talkback in Netscape 4.5 allows a local user to overwrite arbitrary files of another user whose Netscape crashes.|March 18, 1999; 12:00:00 AM -0500|V3.x:(not available)       V2.0: 2.1 LOW (https://nvd.nist.gov/vuln-metrics/cvss/v2-calculator?name=CVE-1999-0424&vector=(AV:L/AC:L/Au:N/C:P/I:N/A:N)&version=2.0&source=NIST)|https://nvd.nist.gov/vuln/detail/CVE-1999-0424
CVE-1999-0425|talkback in Netscape 4.5 allows a local user to kill an arbitrary process of another user whose Netscape crashes.|March 18, 1999; 12:00:00 AM -0500|V3.x:(not available)       V2.0: 6.4 MEDIUM (https://nvd.nist.gov/vuln-metrics/cvss/v2-calculator?name=CVE-1999-0425&vector=(AV:N/AC:L/Au:N/C:N/I:P/A:P)&version=2.0&source=NIST)|https://nvd.nist.gov/vuln/detail/CVE-1999-0425
CVE-1999-0426|The default permissions of /dev/kmem in Linux versions before 2.0.36 allows IP spoofing.|March 01, 1999; 12:00:00 AM -0500|V3.1: 9.8 CRITICAL      V2.0: 10.0 HIGH (https://nvd.nist.gov/vuln-metrics/cvss/v3-calculator?name=CVE-1999-0426&vector=AV:N/AC:L/PR:N/UI:N/S:U/C:H/I:H/A:H&version=3.1&source=NIST)|https://nvd.nist.gov/vuln/detail/CVE-1999-0426
CVE-1999-0427|Eudora 4.1 allows remote attackers to perform a denial of service by sending attachments with long file names.|May 01, 2000; 12:00:00 AM -0400|V3.x:(not available)       V2.0: 7.5 HIGH (https://nvd.nist.gov/vuln-metrics/cvss/v2-calculator?name=CVE-1999-0427&vector=(AV:N/AC:L/Au:N/C:P/I:P/A:P)&version=2.0&source=NIST)|https://nvd.nist.gov/vuln/detail/CVE-1999-0427
CVE-1999-0428|OpenSSL and SSLeay allow remote attackers to reuse SSL sessions and bypass access controls.|March 22, 1999; 12:00:00 AM -0500|V3.x:(not available)       V2.0: 7.5 HIGH (https://nvd.nist.gov/vuln-metrics/cvss/v2-calculator?name=CVE-1999-0428&vector=(AV:N/AC:L/Au:N/C:P/I:P/A:P)&version=2.0&source=NIST)|https://nvd.nist.gov/vuln/detail/CVE-1999-0428
CVE-1999-0429|"The Lotus Notes 4.5 client may send a copy of encrypted mail in the clear across the network if the user does not set the ""Encrypt Saved Mail"" preference."|March 01, 1999; 12:00:00 AM -0500|V3.x:(not available)       V2.0: 7.5 HIGH (https://nvd.nist.gov/vuln-metrics/cvss/v2-calculator?name=CVE-1999-0429&vector=(AV:N/AC:L/Au:N/C:P/I:P/A:P)&version=2.0&source=NIST)|https://nvd.nist.gov/vuln/detail/CVE-1999-0429
CVE-1999-0430|Cisco Catalyst LAN switches running Catalyst 5000 supervisor software allows remote attackers to perform a denial of service by forcing the supervisor module to reload.|March 01, 1999; 12:00:00 AM -0500|V3.x:(not available)       V2.0: 5.0 MEDIUM (https://nvd.nist.gov/vuln-metrics/cvss/v2-calculator?name=CVE-1999-0430&vector=(AV:N/AC:L/Au:N/C:N/I:N/A:P)&version=2.0&source=NIST)|https://nvd.nist.gov/vuln/detail/CVE-1999-0430
CVE-1999-0431|Linux 2.2.3 and earlier allow a remote attacker to perform an IP fragmentation attack, causing a denial of service.|March 01, 1999; 12:00:00 AM -0500|V3.x:(not available)       V2.0: 5.0 MEDIUM (https://nvd.nist.gov/vuln-metrics/cvss/v2-calculator?name=CVE-1999-0431&vector=(AV:N/AC:L/Au:N/C:N/I:N/A:P)&version=2.0&source=NIST)|https://nvd.nist.gov/vuln/detail/CVE-1999-0431
CVE-1999-0432|ftp on HP-UX 11.00 allows local users to gain privileges.|March 01, 1999; 12:00:00 AM -0500|V3.x:(not available)       V2.0: 4.6 MEDIUM (https://nvd.nist.gov/vuln-metrics/cvss/v2-calculator?name=CVE-1999-0432&vector=(AV:L/AC:L/Au:N/C:P/I:P/A:P)&version=2.0&source=NIST)|https://nvd.nist.gov/vuln/detail/CVE-1999-0432
CVE-1999-0433|XFree86 startx command is vulnerable to a symlink attack, allowing local users to create files in restricted directories, possibly allowing them to gain privileges or cause a denial of service.|March 21, 1999; 12:00:00 AM -0500|V3.x:(not available)       V2.0: 4.6 MEDIUM (https://nvd.nist.gov/vuln-metrics/cvss/v2-calculator?name=CVE-1999-0433&vector=(AV:L/AC:L/Au:N/C:P/I:P/A:P)&version=2.0&source=NIST)|https://nvd.nist.gov/vuln/detail/CVE-1999-0433
CVE-1999-0434|XFree86 xfs command is vulnerable to a symlink attack, allowing local users to create files in restricted directories, possibly allowing them to gain privileges or cause a denial of service.|March 30, 1999; 12:00:00 AM -0500|V3.x:(not available)       V2.0: 7.5 HIGH (https://nvd.nist.gov/vuln-metrics/cvss/v2-calculator?name=CVE-1999-0434&vector=(AV:N/AC:L/Au:N/C:P/I:P/A:P)&version=2.0&source=NIST)|https://nvd.nist.gov/vuln/detail/CVE-1999-0434
CVE-1999-0435|MC/ServiceGuard and MC/LockManager in HP-UX allows local users to gain privileges through SAM.|March 01, 1999; 12:00:00 AM -0500|V3.x:(not available)       V2.0: 7.2 HIGH (https://nvd.nist.gov/vuln-metrics/cvss/v2-calculator?name=CVE-1999-0435&vector=(AV:L/AC:L/Au:N/C:C/I:C/A:C)&version=2.0&source=NIST)|https://nvd.nist.gov/vuln/detail/CVE-1999-0435
CVE-1999-0436|Domain Enterprise Server Management System (DESMS) in HP-UX allows local users to gain privileges.|March 01, 1999; 12:00:00 AM -0500|V3.x:(not available)       V2.0: 4.6 MEDIUM (https://nvd.nist.gov/vuln-metrics/cvss/v2-calculator?name=CVE-1999-0436&vector=(AV:L/AC:L/Au:N/C:P/I:P/A:P)&version=2.0&source=NIST)|https://nvd.nist.gov/vuln/detail/CVE-1999-0436
CVE-1999-0437|Remote attackers can perform a denial of service in WebRamp systems by sending a malicious string to the HTTP port.|March 01, 1999; 12:00:00 AM -0500|V3.x:(not available)       V2.0: 5.0 MEDIUM (https://nvd.nist.gov/vuln-metrics/cvss/v2-calculator?name=CVE-1999-0437&vector=(AV:N/AC:L/Au:N/C:N/I:N/A:P)&version=2.0&source=NIST)|https://nvd.nist.gov/vuln/detail/CVE-1999-0437
CVE-1999-0438|Remote attackers can perform a denial of service in WebRamp systems by sending a malicious UDP packet to port 5353, changing its IP address.|March 01, 1999; 12:00:00 AM -0500|V3.x:(not available)       V2.0: 5.0 MEDIUM (https://nvd.nist.gov/vuln-metrics/cvss/v2-calculator?name=CVE-1999-0438&vector=(AV:N/AC:L/Au:N/C:N/I:N/A:P)&version=2.0&source=NIST)|https://nvd.nist.gov/vuln/detail/CVE-1999-0438
CVE-1999-0439|Buffer overflow in procmail before version 3.12 allows remote or local attackers to execute commands via expansions in the procmailrc configuration file.|April 05, 1999; 12:00:00 AM -0400|V3.x:(not available)       V2.0: 7.5 HIGH (https://nvd.nist.gov/vuln-metrics/cvss/v2-calculator?name=CVE-1999-0439&vector=(AV:N/AC:L/Au:N/C:P/I:P/A:P)&version=2.0&source=NIST)|https://nvd.nist.gov/vuln/detail/CVE-1999-0439
CVE-1999-0440|The byte code verifier component of the Java Virtual Machine (JVM) allows remote execution through malicious web pages.|March 01, 1999; 12:00:00 AM -0500|V3.x:(not available)       V2.0: 7.5 HIGH (https://nvd.nist.gov/vuln-metrics/cvss/v2-calculator?name=CVE-1999-0440&vector=(AV:N/AC:L/Au:N/C:P/I:P/A:P)&version=2.0&source=NIST)|https://nvd.nist.gov/vuln/detail/CVE-1999-0440
CVE-1999-0441|Remote attackers can perform a denial of service in WinGate machines using a buffer overflow in the Winsock Redirector Service.|February 22, 1999; 12:00:00 AM -0500|V3.x:(not available)       V2.0: 5.0 MEDIUM (https://nvd.nist.gov/vuln-metrics/cvss/v2-calculator?name=CVE-1999-0441&vector=(AV:N/AC:L/Au:N/C:N/I:N/A:P)&version=2.0&source=NIST)|https://nvd.nist.gov/vuln/detail/CVE-1999-0441
CVE-1999-0442|Solaris ff.core allows local users to modify files.|January 07, 1999; 12:00:00 AM -0500|V3.x:(not available)       V2.0: 2.1 LOW (https://nvd.nist.gov/vuln-metrics/cvss/v2-calculator?name=CVE-1999-0442&vector=(AV:L/AC:L/Au:N/C:N/I:P/A:N)&version=2.0&source=NIST)|https://nvd.nist.gov/vuln/detail/CVE-1999-0442
CVE-1999-0443|Patrol management software allows a remote attacker to conduct a replay attack to steal the administrator password.|April 01, 1999; 12:00:00 AM -0500|V3.x:(not available)       V2.0: 10.0 HIGH (https://nvd.nist.gov/vuln-metrics/cvss/v2-calculator?name=CVE-1999-0443&vector=(AV:N/AC:L/Au:N/C:C/I:C/A:C)&version=2.0&source=NIST)|https://nvd.nist.gov/vuln/detail/CVE-1999-0443
CVE-1999-0444|Remote attackers can perform a denial of service in Windows machines using malicious ARP packets, forcing a message box display for each packet or filling up log files.|April 12, 1999; 12:00:00 AM -0400|V3.x:(not available)       V2.0: 5.0 MEDIUM (https://nvd.nist.gov/vuln-metrics/cvss/v2-calculator?name=CVE-1999-0444&vector=(AV:N/AC:L/Au:N/C:N/I:N/A:P)&version=2.0&source=NIST)|https://nvd.nist.gov/vuln/detail/CVE-1999-0444
CVE-1999-0445|In Cisco routers under some versions of IOS 12.0 running NAT, some packets may not be filtered by input access list filters.|April 01, 1999; 12:00:00 AM -0500|V3.x:(not available)       V2.0: 5.0 MEDIUM (https://nvd.nist.gov/vuln-metrics/cvss/v2-calculator?name=CVE-1999-0445&vector=(AV:N/AC:L/Au:N/C:P/I:N/A:N)&version=2.0&source=NIST)|https://nvd.nist.gov/vuln/detail/CVE-1999-0445
CVE-1999-0446|Local users can perform a denial of service in NetBSD 1.3.3 and earlier versions by creating an unusual symbolic link with the ln command, triggering a bug in VFS.|April 12, 1999; 12:00:00 AM -0400|V3.x:(not available)       V2.0: 2.1 LOW (https://nvd.nist.gov/vuln-metrics/cvss/v2-calculator?name=CVE-1999-0446&vector=(AV:L/AC:L/Au:N/C:N/I:N/A:P)&version=2.0&source=NIST)|https://nvd.nist.gov/vuln/detail/CVE-1999-0446
CVE-1999-0447|Local users can gain privileges using the debug utility in the MPE/iX operating system.|April 01, 1999; 12:00:00 AM -0500|V3.x:(not available)       V2.0: 4.6 MEDIUM (https://nvd.nist.gov/vuln-metrics/cvss/v2-calculator?name=CVE-1999-0447&vector=(AV:L/AC:L/Au:N/C:P/I:P/A:P)&version=2.0&source=NIST)|https://nvd.nist.gov/vuln/detail/CVE-1999-0447
CVE-1999-0448|IIS 4.0 and Apache log HTTP request methods, regardless of how long they are, allowing a remote attacker to hide the URL they really request.|January 01, 1999; 12:00:00 AM -0500|V3.x:(not available)       V2.0: 5.0 MEDIUM (https://nvd.nist.gov/vuln-metrics/cvss/v2-calculator?name=CVE-1999-0448&vector=(AV:N/AC:L/Au:N/C:P/I:N/A:N)&version=2.0&source=NIST)|https://nvd.nist.gov/vuln/detail/CVE-1999-0448
CVE-1999-0449|The ExAir sample site in IIS 4 allows remote attackers to cause a denial of service (CPU consumption) via a direct request to the (1) advsearch.asp, (2) query.asp, or (3) search.asp scripts.|January 26, 1999; 12:00:00 AM -0500|V3.x:(not available)       V2.0: 7.8 HIGH (https://nvd.nist.gov/vuln-metrics/cvss/v2-calculator?name=CVE-1999-0449&vector=(AV:N/AC:L/Au:N/C:N/I:N/A:C)&version=2.0&source=NIST)|https://nvd.nist.gov/vuln/detail/CVE-1999-0449
CVE-1999-0450|In IIS, an attacker could determine a real path using a request for a non-existent URL that would be interpreted by Perl (perl.exe).|January 26, 1999; 12:00:00 AM -0500|V3.x:(not available)       V2.0: 7.5 HIGH (https://nvd.nist.gov/vuln-metrics/cvss/v2-calculator?name=CVE-1999-0450&vector=(AV:N/AC:L/Au:N/C:P/I:P/A:P)&version=2.0&source=NIST)|https://nvd.nist.gov/vuln/detail/CVE-1999-0450
CVE-1999-0451|Denial of service in Linux 2.0.36 allows local users to prevent any server from listening on any non-privileged port.|January 19, 1999; 12:00:00 AM -0500|V3.x:(not available)       V2.0: 2.1 LOW (https://nvd.nist.gov/vuln-metrics/cvss/v2-calculator?name=CVE-1999-0451&vector=(AV:L/AC:L/Au:N/C:N/I:N/A:P)&version=2.0&source=NIST)|https://nvd.nist.gov/vuln/detail/CVE-1999-0451
CVE-1999-0452|A service or application has a backdoor password that was placed there by the developer.|January 01, 1999; 12:00:00 AM -0500|V3.x:(not available)       V2.0: 10.0 HIGH (https://nvd.nist.gov/vuln-metrics/cvss/v2-calculator?name=CVE-1999-0452&vector=(AV:N/AC:L/Au:N/C:C/I:C/A:C)&version=2.0&source=NIST)|https://nvd.nist.gov/vuln/detail/CVE-1999-0452
CVE-1999-0453|An attacker can identify a CISCO device by sending a SYN packet to port 1999, which is for the Cisco Discovery Protocol (CDP).|January 01, 1999; 12:00:00 AM -0500|V3.x:(not available)       V2.0: 5.0 MEDIUM (https://nvd.nist.gov/vuln-metrics/cvss/v2-calculator?name=CVE-1999-0453&vector=(AV:N/AC:L/Au:N/C:P/I:N/A:N)&version=2.0&source=NIST)|https://nvd.nist.gov/vuln/detail/CVE-1999-0453
CVE-1999-0454|A remote attacker can sometimes identify the operating system of a host based on how it reacts to some IP or ICMP packets, using a tool such as nmap or queso.|January 01, 1999; 12:00:00 AM -0500|V3.x:(not available)       V2.0: 10.0 HIGH (https://nvd.nist.gov/vuln-metrics/cvss/v2-calculator?name=CVE-1999-0454&vector=(AV:N/AC:L/Au:N/C:C/I:C/A:C)&version=2.0&source=NIST)|https://nvd.nist.gov/vuln/detail/CVE-1999-0454
CVE-1999-0455|The Expression Evaluator sample application in ColdFusion allows remote attackers to read or delete files on the server via exprcalc.cfm, which does not restrict access to the server properly.|December 25, 1999; 12:00:00 AM -0500|V3.x:(not available)       V2.0: 7.5 HIGH (https://nvd.nist.gov/vuln-metrics/cvss/v2-calculator?name=CVE-1999-0455&vector=(AV:N/AC:L/Au:N/C:P/I:P/A:P)&version=2.0&source=NIST)|https://nvd.nist.gov/vuln/detail/CVE-1999-0455
CVE-1999-0457|Linux ftpwatch program allows local users to gain root privileges.|January 17, 1999; 12:00:00 AM -0500|V3.x:(not available)       V2.0: 7.2 HIGH (https://nvd.nist.gov/vuln-metrics/cvss/v2-calculator?name=CVE-1999-0457&vector=(AV:L/AC:L/Au:N/C:C/I:C/A:C)&version=2.0&source=NIST)|https://nvd.nist.gov/vuln/detail/CVE-1999-0457
CVE-1999-0458|L0phtcrack 2.5 used temporary files in the system TEMP directory which could contain password information.|January 06, 1999; 12:00:00 AM -0500|V3.x:(not available)       V2.0: 2.1 LOW (https://nvd.nist.gov/vuln-metrics/cvss/v2-calculator?name=CVE-1999-0458&vector=(AV:L/AC:L/Au:N/C:P/I:N/A:N)&version=2.0&source=NIST)|https://nvd.nist.gov/vuln/detail/CVE-1999-0458
CVE-1999-0459|Local users can perform a denial of service in Alpha Linux, using MILO to force a reboot.|February 01, 1999; 12:00:00 AM -0500|V3.x:(not available)       V2.0: 4.6 MEDIUM (https://nvd.nist.gov/vuln-metrics/cvss/v2-calculator?name=CVE-1999-0459&vector=(AV:L/AC:L/Au:N/C:P/I:P/A:P)&version=2.0&source=NIST)|https://nvd.nist.gov/vuln/detail/CVE-1999-0459
CVE-1999-0460|Buffer overflow in Linux autofs module through long directory names allows local users to perform a denial of service.|February 19, 1999; 12:00:00 AM -0500|V3.x:(not available)       V2.0: 2.1 LOW (https://nvd.nist.gov/vuln-metrics/cvss/v2-calculator?name=CVE-1999-0460&vector=(AV:L/AC:L/Au:N/C:N/I:N/A:P)&version=2.0&source=NIST)|https://nvd.nist.gov/vuln/detail/CVE-1999-0460
CVE-1999-0461|Versions of rpcbind including Linux, IRIX, and Wietse Venema's rpcbind allow a remote attacker to insert and delete entries by spoofing a source address.|January 28, 1999; 12:00:00 AM -0500|V3.x:(not available)       V2.0: 10.0 HIGH (https://nvd.nist.gov/vuln-metrics/cvss/v2-calculator?name=CVE-1999-0461&vector=(AV:N/AC:L/Au:N/C:C/I:C/A:C)&version=2.0&source=NIST)|https://nvd.nist.gov/vuln/detail/CVE-1999-0461
CVE-1999-0462|suidperl in Linux Perl does not check the nosuid mount option on file systems, allowing local users to gain root access by placing a setuid script in a mountable file system, e.g. a CD-ROM or floppy disk.|March 17, 1999; 12:00:00 AM -0500|V3.x:(not available)       V2.0: 7.2 HIGH (https://nvd.nist.gov/vuln-metrics/cvss/v2-calculator?name=CVE-1999-0462&vector=(AV:L/AC:L/Au:N/C:C/I:C/A:C)&version=2.0&source=NIST)|https://nvd.nist.gov/vuln/detail/CVE-1999-0462
CVE-1999-0463|Remote attackers can perform a denial of service using IRIX fcagent.|December 01, 1998; 12:00:00 AM -0500|V3.x:(not available)       V2.0: 5.0 MEDIUM (https://nvd.nist.gov/vuln-metrics/cvss/v2-calculator?name=CVE-1999-0463&vector=(AV:N/AC:L/Au:N/C:N/I:N/A:P)&version=2.0&source=NIST)|https://nvd.nist.gov/vuln/detail/CVE-1999-0463
CVE-1999-0464|Local users can perform a denial of service in Tripwire 1.2 and earlier using long filenames.|January 04, 1999; 12:00:00 AM -0500|V3.x:(not available)       V2.0: 2.1 LOW (https://nvd.nist.gov/vuln-metrics/cvss/v2-calculator?name=CVE-1999-0464&vector=(AV:L/AC:L/Au:N/C:N/I:N/A:P)&version=2.0&source=NIST)|https://nvd.nist.gov/vuln/detail/CVE-1999-0464
CVE-1999-0465|Remote attackers can crash Lynx and Internet Explorer using an IMG tag with a large width parameter.|January 01, 1999; 12:00:00 AM -0500|V3.x:(not available)       V2.0: 10.0 HIGH (https://nvd.nist.gov/vuln-metrics/cvss/v2-calculator?name=CVE-1999-0465&vector=(AV:N/AC:L/Au:N/C:C/I:C/A:C)&version=2.0&source=NIST)|https://nvd.nist.gov/vuln/detail/CVE-1999-0465
CVE-1999-0466|The SVR4 /dev/wabi special device file in NetBSD 1.3.3 and earlier allows a local user to read or write arbitrary files on the disk associated with that device.|April 21, 1999; 12:00:00 AM -0400|V3.x:(not available)       V2.0: 7.2 HIGH (https://nvd.nist.gov/vuln-metrics/cvss/v2-calculator?name=CVE-1999-0466&vector=(AV:L/AC:L/Au:N/C:C/I:C/A:C)&version=2.0&source=NIST)|https://nvd.nist.gov/vuln/detail/CVE-1999-0466
CVE-1999-0467|"The Webcom CGI Guestbook programs wguest.exe and rguest.exe allow a remote attacker to read arbitrary files using the ""template"" parameter."|April 01, 1999; 12:00:00 AM -0500|V3.x:(not available)       V2.0: 5.0 MEDIUM (https://nvd.nist.gov/vuln-metrics/cvss/v2-calculator?name=CVE-1999-0467&vector=(AV:N/AC:L/Au:N/C:P/I:N/A:N)&version=2.0&source=NIST)|https://nvd.nist.gov/vuln/detail/CVE-1999-0467
CVE-1999-0468|Internet Explorer 5.0 allows a remote server to read arbitrary files on the client's file system using the Microsoft Scriptlet Component.|April 09, 1999; 12:00:00 AM -0400|V3.x:(not available)       V2.0: 2.6 LOW (https://nvd.nist.gov/vuln-metrics/cvss/v2-calculator?name=CVE-1999-0468&vector=(AV:N/AC:H/Au:N/C:P/I:N/A:N)&version=2.0&source=NIST)|https://nvd.nist.gov/vuln/detail/CVE-1999-0468
CVE-1999-0469|Internet Explorer 5.0 allows window spoofing, allowing a remote attacker to spoof a legitimate web site and capture information from the client.|April 01, 1999; 12:00:00 AM -0500|V3.x:(not available)       V2.0: 5.0 MEDIUM (https://nvd.nist.gov/vuln-metrics/cvss/v2-calculator?name=CVE-1999-0469&vector=(AV:N/AC:L/Au:N/C:P/I:N/A:N)&version=2.0&source=NIST)|https://nvd.nist.gov/vuln/detail/CVE-1999-0469
CVE-1999-0470|A weak encryption algorithm is used for passwords in Novell Remote.NLM, allowing them to be easily decrypted.|April 09, 1999; 12:00:00 AM -0400|V3.x:(not available)       V2.0: 5.0 MEDIUM (https://nvd.nist.gov/vuln-metrics/cvss/v2-calculator?name=CVE-1999-0470&vector=(AV:N/AC:L/Au:N/C:P/I:N/A:N)&version=2.0&source=NIST)|https://nvd.nist.gov/vuln/detail/CVE-1999-0470
CVE-1999-0471|"The remote proxy server in Winroute allows a remote attacker to reconfigure the proxy without authentication through the ""cancel"" button."|April 09, 1999; 12:00:00 AM -0400|V3.x:(not available)       V2.0: 5.0 MEDIUM (https://nvd.nist.gov/vuln-metrics/cvss/v2-calculator?name=CVE-1999-0471&vector=(AV:N/AC:L/Au:N/C:P/I:N/A:N)&version=2.0&source=NIST)|https://nvd.nist.gov/vuln/detail/CVE-1999-0471
CVE-1999-0472|"The SNMP default community name ""public"" is not properly removed in NetApps C630 Netcache, even if the administrator tries to disable it."|April 07, 1999; 12:00:00 AM -0400|V3.x:(not available)       V2.0: 5.0 MEDIUM (https://nvd.nist.gov/vuln-metrics/cvss/v2-calculator?name=CVE-1999-0472&vector=(AV:N/AC:L/Au:N/C:P/I:N/A:N)&version=2.0&source=NIST)|https://nvd.nist.gov/vuln/detail/CVE-1999-0472
CVE-1999-0473|The rsync command before rsync 2.3.1 may inadvertently change the permissions of the client's working directory to the permissions of the directory being transferred.|April 07, 1999; 12:00:00 AM -0400|V3.x:(not available)       V2.0: 2.1 LOW (https://nvd.nist.gov/vuln-metrics/cvss/v2-calculator?name=CVE-1999-0473&vector=(AV:L/AC:L/Au:N/C:N/I:P/A:N)&version=2.0&source=NIST)|https://nvd.nist.gov/vuln/detail/CVE-1999-0473
CVE-1999-0474|The ICQ Webserver allows remote attackers to use .. to access arbitrary files outside of the user's personal directory.|April 05, 1999; 12:00:00 AM -0400|V3.x:(not available)       V2.0: 5.0 MEDIUM (https://nvd.nist.gov/vuln-metrics/cvss/v2-calculator?name=CVE-1999-0474&vector=(AV:N/AC:L/Au:N/C:P/I:N/A:N)&version=2.0&source=NIST)|https://nvd.nist.gov/vuln/detail/CVE-1999-0474
CVE-1999-0475|A race condition in how procmail handles .procmailrc files allows a local user to read arbitrary files available to the user who is running procmail.|April 05, 1999; 12:00:00 AM -0400|V3.x:(not available)       V2.0: 1.2 LOW (https://nvd.nist.gov/vuln-metrics/cvss/v2-calculator?name=CVE-1999-0475&vector=(AV:L/AC:H/Au:N/C:P/I:N/A:N)&version=2.0&source=NIST)|https://nvd.nist.gov/vuln/detail/CVE-1999-0475
CVE-1999-0476|A weak encryption algorithm is used for passwords in SCO TermVision, allowing them to be easily decrypted by a local user.|March 01, 1999; 12:00:00 AM -0500|V3.x:(not available)       V2.0: 7.2 HIGH (https://nvd.nist.gov/vuln-metrics/cvss/v2-calculator?name=CVE-1999-0476&vector=(AV:L/AC:L/Au:N/C:C/I:C/A:C)&version=2.0&source=NIST)|https://nvd.nist.gov/vuln/detail/CVE-1999-0476
CVE-1999-0477|The Expression Evaluator in the ColdFusion Application Server allows a remote attacker to upload files to the server via openfile.cfm, which does not restrict access to the server properly.|December 25, 1999; 12:00:00 AM -0500|V3.x:(not available)       V2.0: 7.5 HIGH (https://nvd.nist.gov/vuln-metrics/cvss/v2-calculator?name=CVE-1999-0477&vector=(AV:N/AC:L/Au:N/C:P/I:P/A:P)&version=2.0&source=NIST)|https://nvd.nist.gov/vuln/detail/CVE-1999-0477
CVE-1999-0478|Denial of service in HP-UX sendmail 8.8.6 related to accepting connections.|December 01, 1998; 12:00:00 AM -0500|V3.x:(not available)       V2.0: 5.0 MEDIUM (https://nvd.nist.gov/vuln-metrics/cvss/v2-calculator?name=CVE-1999-0478&vector=(AV:N/AC:L/Au:N/C:N/I:N/A:P)&version=2.0&source=NIST)|https://nvd.nist.gov/vuln/detail/CVE-1999-0478
CVE-1999-0479|Denial of service Netscape Enterprise Server with VirtualVault on HP-UX VVOS systems.|March 01, 1999; 12:00:00 AM -0500|V3.x:(not available)       V2.0: 5.0 MEDIUM (https://nvd.nist.gov/vuln-metrics/cvss/v2-calculator?name=CVE-1999-0479&vector=(AV:N/AC:L/Au:N/C:N/I:N/A:P)&version=2.0&source=NIST)|https://nvd.nist.gov/vuln/detail/CVE-1999-0479
CVE-1999-0480|Local attackers can conduct a denial of service in Midnight Commander 4.x with a symlink attack.|April 01, 1999; 12:00:00 AM -0500|V3.x:(not available)       V2.0: 2.1 LOW (https://nvd.nist.gov/vuln-metrics/cvss/v2-calculator?name=CVE-1999-0480&vector=(AV:L/AC:L/Au:N/C:N/I:N/A:P)&version=2.0&source=NIST)|https://nvd.nist.gov/vuln/detail/CVE-1999-0480
CVE-1999-0481|"Denial of service in ""poll"" in OpenBSD."|March 22, 1999; 12:00:00 AM -0500|V3.x:(not available)       V2.0: 5.0 MEDIUM (https://nvd.nist.gov/vuln-metrics/cvss/v2-calculator?name=CVE-1999-0481&vector=(AV:N/AC:L/Au:N/C:N/I:N/A:P)&version=2.0&source=NIST)|https://nvd.nist.gov/vuln/detail/CVE-1999-0481
CVE-1999-0482|OpenBSD kernel crash through TSS handling, as caused by the crashme program.|March 21, 1999; 12:00:00 AM -0500|V3.x:(not available)       V2.0: 5.0 MEDIUM (https://nvd.nist.gov/vuln-metrics/cvss/v2-calculator?name=CVE-1999-0482&vector=(AV:N/AC:L/Au:N/C:N/I:N/A:P)&version=2.0&source=NIST)|https://nvd.nist.gov/vuln/detail/CVE-1999-0482
CVE-1999-0483|OpenBSD crash using nlink value in FFS and EXT2FS filesystems.|February 25, 1999; 12:00:00 AM -0500|V3.x:(not available)       V2.0: 2.1 LOW (https://nvd.nist.gov/vuln-metrics/cvss/v2-calculator?name=CVE-1999-0483&vector=(AV:L/AC:L/Au:N/C:N/I:N/A:P)&version=2.0&source=NIST)|https://nvd.nist.gov/vuln/detail/CVE-1999-0483
CVE-1999-0484|Buffer overflow in OpenBSD ping.|February 23, 1999; 12:00:00 AM -0500|V3.x:(not available)       V2.0: 2.1 LOW (https://nvd.nist.gov/vuln-metrics/cvss/v2-calculator?name=CVE-1999-0484&vector=(AV:L/AC:L/Au:N/C:N/I:P/A:N)&version=2.0&source=NIST)|https://nvd.nist.gov/vuln/detail/CVE-1999-0484
CVE-1999-0485|Remote attackers can cause a system crash through ipintr() in ipq in OpenBSD.|February 19, 1999; 12:00:00 AM -0500|V3.x:(not available)       V2.0: 2.6 LOW (https://nvd.nist.gov/vuln-metrics/cvss/v2-calculator?name=CVE-1999-0485&vector=(AV:N/AC:H/Au:N/C:N/I:N/A:P)&version=2.0&source=NIST)|https://nvd.nist.gov/vuln/detail/CVE-1999-0485
CVE-1999-0486|Denial of service in AOL Instant Messenger when a remote attacker sends a malicious hyperlink to the receiving client, potentially causing a system crash.|February 01, 1998; 12:00:00 AM -0500|V3.x:(not available)       V2.0: 5.0 MEDIUM (https://nvd.nist.gov/vuln-metrics/cvss/v2-calculator?name=CVE-1999-0486&vector=(AV:N/AC:L/Au:N/C:N/I:N/A:P)&version=2.0&source=NIST)|https://nvd.nist.gov/vuln/detail/CVE-1999-0486
CVE-1999-0487|The DHTML Edit ActiveX control in Internet Explorer allows remote attackers to read arbitrary files.|May 01, 1999; 12:00:00 AM -0400|V3.x:(not available)       V2.0: 2.6 LOW (https://nvd.nist.gov/vuln-metrics/cvss/v2-calculator?name=CVE-1999-0487&vector=(AV:N/AC:H/Au:N/C:P/I:N/A:N)&version=2.0&source=NIST)|https://nvd.nist.gov/vuln/detail/CVE-1999-0487
