Vuln ID|Summary|Published Date|CVSS Severity|Link
CVE-2009-10001|A vulnerability classified as problematic was found in jianlinwei cool-php-captcha up to 0.2. This vulnerability affects unknown code of the file example-form.php. The manipulation of the argument captcha with the input %3Cscript%3Ealert(1)%3C/script%3E leads to cross site scripting. The attack can be initiated remotely. The exploit has been disclosed to the public and may be used. Upgrading to version 0.3 is able to address this issue. The name of the patch is c84fb6b153bebaf228feee0cbf50728d27ae3f80. It is recommended to upgrade the affected component. The identifier of this vulnerability is VDB-218296.|January 13, 2023; 1:15:08 PM -0500|V3.1: 6.1 MEDIUMV2.0:(not available)  (https://nvd.nist.gov/vuln-metrics/cvss/v3-calculator?name=CVE-2009-10001&vector=AV:N/AC:L/PR:N/UI:R/S:C/C:L/I:L/A:N&version=3.1&source=NIST)|https://nvd.nist.gov/vuln/detail/CVE-2009-10001
CVE-2009-10002|A vulnerability, which was classified as problematic, has been found in dpup fittr-flickr. This issue affects some unknown processing of the file fittr-flickr/features/easy-exif.js of the component EXIF Preview Handler. The manipulation leads to cross site scripting. The attack may be initiated remotely. The identifier of the patch is 08875dd8a2e5d0d16568bb0d67cb4328062fccde. It is recommended to apply a patch to fix this issue. The identifier VDB-218297 was assigned to this vulnerability.|January 13, 2023; 1:15:10 PM -0500|V3.1: 6.1 MEDIUMV2.0:(not available)  (https://nvd.nist.gov/vuln-metrics/cvss/v3-calculator?name=CVE-2009-10002&vector=AV:N/AC:L/PR:N/UI:R/S:C/C:L/I:L/A:N&version=3.1&source=NIST)|https://nvd.nist.gov/vuln/detail/CVE-2009-10002
CVE-2009-10003|A vulnerability was found in capnsquarepants wordcraft up to 0.6. It has been classified as problematic. Affected is an unknown function of the file tag.php. The manipulation of the argument tag leads to cross site scripting. It is possible to launch the attack remotely. Upgrading to version 0.7 is able to address this issue. The patch is identified as be23028633e8105de92f387036871c03f34d3124. It is recommended to upgrade the affected component. VDB-219714 is the identifier assigned to this vulnerability.|January 29, 2023; 2:15:08 PM -0500|V3.1: 6.1 MEDIUMV2.0:(not available)  (https://nvd.nist.gov/vuln-metrics/cvss/v3-calculator?name=CVE-2009-10003&vector=AV:N/AC:L/PR:N/UI:R/S:C/C:L/I:L/A:N&version=3.1&source=NIST)|https://nvd.nist.gov/vuln/detail/CVE-2009-10003
CVE-2009-10004|A vulnerability was found in Turante Sandbox Theme up to 1.5.2. It has been classified as problematic. This affects the function sandbox_body_class of the file functions.php. The manipulation of the argument page leads to cross site scripting. It is possible to initiate the attack remotely. Upgrading to version 1.6.1 is able to address this issue. The identifier of the patch is 8045b1e10970342f558b2c5f360e0bd135af2b10. It is recommended to upgrade the affected component. The identifier VDB-225357 was assigned to this vulnerability.|April 09, 2023; 8:15:08 PM -0400|V3.1: 6.1 MEDIUMV2.0:(not available)  (https://nvd.nist.gov/vuln-metrics/cvss/v3-calculator?name=CVE-2009-10004&vector=AV:N/AC:L/PR:N/UI:R/S:C/C:L/I:L/A:N&version=3.1&source=NIST)|https://nvd.nist.gov/vuln/detail/CVE-2009-10004
CVE-2009-1142|An issue was discovered in open-vm-tools 2009.03.18-154848. Local users can gain privileges via a symlink attack on /tmp files if vmware-user-suid-wrapper is setuid root and the ChmodChownDirectory function is enabled.|November 23, 2022; 1:15:10 PM -0500|V3.1: 6.7 MEDIUMV2.0:(not available)  (https://nvd.nist.gov/vuln-metrics/cvss/v3-calculator?name=CVE-2009-1142&vector=AV:L/AC:L/PR:H/UI:N/S:U/C:H/I:H/A:H&version=3.1&source=NIST)|https://nvd.nist.gov/vuln/detail/CVE-2009-1142
CVE-2009-1143|An issue was discovered in open-vm-tools 2009.03.18-154848. Local users can bypass intended access restrictions on mounting shares via a symlink attack that leverages a realpath race condition in mount.vmhgfs (aka hgfsmounter).|November 23, 2022; 1:15:10 PM -0500|V3.1: 7.0 HIGHV2.0:(not available)  (https://nvd.nist.gov/vuln-metrics/cvss/v3-calculator?name=CVE-2009-1143&vector=AV:L/AC:H/PR:L/UI:N/S:U/C:H/I:H/A:H&version=3.1&source=NIST)|https://nvd.nist.gov/vuln/detail/CVE-2009-1143
CVE-2009-4123|The jruby-openssl gem before 0.6 for JRuby mishandles SSL certificate validation.|December 12, 2023; 11:15:07 AM -0500|V3.1: 7.5 HIGHV2.0:(not available)  (https://nvd.nist.gov/vuln-metrics/cvss/v3-calculator?name=CVE-2009-4123&vector=AV:N/AC:L/PR:N/UI:N/S:U/C:H/I:N/A:N&version=3.1&source=NIST)|https://nvd.nist.gov/vuln/detail/CVE-2009-4123
