Vuln ID|Summary|Published Date|CVSS Severity|Link
CVE-1999-1233|"IIS 4.0 does not properly restrict access for the initial session request from a user's IP address if the address does not resolve to a DNS domain, aka the ""Domain Resolution"" vulnerability."|December 31, 1999; 12:00:00 AM -0500|V3.x:(not available)       V2.0: 7.5 HIGH (https://nvd.nist.gov/vuln-metrics/cvss/v2-calculator?name=CVE-1999-1233&vector=(AV:N/AC:L/Au:N/C:P/I:P/A:P)&version=2.0&source=NIST)|https://nvd.nist.gov/vuln/detail/CVE-1999-1233
CVE-1999-1234|LSA (LSASS.EXE) in Windows NT 4.0 allows remote attackers to cause a denial of service via a NULL policy handle in a call to (1) SamrOpenDomain, (2) SamrEnumDomainUsers, and (3) SamrQueryDomainInfo.|October 26, 1999; 12:00:00 AM -0400|V3.x:(not available)       V2.0: 5.0 MEDIUM (https://nvd.nist.gov/vuln-metrics/cvss/v2-calculator?name=CVE-1999-1234&vector=(AV:N/AC:L/Au:N/C:N/I:N/A:P)&version=2.0&source=NIST)|https://nvd.nist.gov/vuln/detail/CVE-1999-1234
CVE-1999-1235|"Internet Explorer 5.0 records the username and password for FTP servers in the URL history, which could allow (1) local users to read the information from another user's index.dat, or (2) people who are physically observing (""shoulder surfing"") another user to read the information from the status bar when the user moves the mouse over a link."|August 25, 1999; 12:00:00 AM -0400|V3.x:(not available)       V2.0: 4.6 MEDIUM (https://nvd.nist.gov/vuln-metrics/cvss/v2-calculator?name=CVE-1999-1235&vector=(AV:L/AC:L/Au:N/C:P/I:P/A:P)&version=2.0&source=NIST)|https://nvd.nist.gov/vuln/detail/CVE-1999-1235
CVE-1999-1236|Internet Anywhere Mail Server 2.3.1 stores passwords in plaintext in the msgboxes.dbf file, which could allow local users to gain privileges by extracting the passwords from msgboxes.dbf.|October 01, 1999; 12:00:00 AM -0400|V3.x:(not available)       V2.0: 4.6 MEDIUM (https://nvd.nist.gov/vuln-metrics/cvss/v2-calculator?name=CVE-1999-1236&vector=(AV:L/AC:L/Au:N/C:P/I:P/A:P)&version=2.0&source=NIST)|https://nvd.nist.gov/vuln/detail/CVE-1999-1236
CVE-1999-1237|Multiple buffer overflows in smbvalid/smbval SMB authentication library, as used in Apache::AuthenSmb and possibly other modules, allows remote attackers to execute arbitrary commands via (1) a long username, (2) a long password, and (3) other unspecified methods.|June 06, 1999; 12:00:00 AM -0400|V3.x:(not available)       V2.0: 10.0 HIGH (https://nvd.nist.gov/vuln-metrics/cvss/v2-calculator?name=CVE-1999-1237&vector=(AV:N/AC:L/Au:N/C:C/I:C/A:C)&version=2.0&source=NIST)|https://nvd.nist.gov/vuln/detail/CVE-1999-1237
CVE-1999-1238|Vulnerability in CORE-DIAG fileset in HP message catalog in HP-UX 9.05 and earlier allows local users to gain privileges.|September 21, 1994; 12:00:00 AM -0400|V3.x:(not available)       V2.0: 4.6 MEDIUM (https://nvd.nist.gov/vuln-metrics/cvss/v2-calculator?name=CVE-1999-1238&vector=(AV:L/AC:L/Au:N/C:P/I:P/A:P)&version=2.0&source=NIST)|https://nvd.nist.gov/vuln/detail/CVE-1999-1238
CVE-1999-1239|HP-UX 9.x does not properly enable the Xauthority mechanism in certain conditions, which could allow local users to access the X display even when they have not explicitly been authorized to do so.|July 13, 1994; 12:00:00 AM -0400|V3.x:(not available)       V2.0: 4.6 MEDIUM (https://nvd.nist.gov/vuln-metrics/cvss/v2-calculator?name=CVE-1999-1239&vector=(AV:L/AC:L/Au:N/C:P/I:P/A:P)&version=2.0&source=NIST)|https://nvd.nist.gov/vuln/detail/CVE-1999-1239
CVE-1999-1240|Buffer overflow in cddbd CD database server allows remote attackers to execute arbitrary commands via a long log message.|November 26, 1996; 12:00:00 AM -0500|V3.x:(not available)       V2.0: 7.5 HIGH (https://nvd.nist.gov/vuln-metrics/cvss/v2-calculator?name=CVE-1999-1240&vector=(AV:N/AC:L/Au:N/C:P/I:P/A:P)&version=2.0&source=NIST)|https://nvd.nist.gov/vuln/detail/CVE-1999-1240
CVE-1999-1241|Internet Explorer, with a security setting below Medium, allows remote attackers to execute arbitrary commands via a malicious web page that uses the FileSystemObject ActiveX object.|May 06, 1999; 12:00:00 AM -0400|V3.x:(not available)       V2.0: 10.0 HIGH (https://nvd.nist.gov/vuln-metrics/cvss/v2-calculator?name=CVE-1999-1241&vector=(AV:N/AC:L/Au:N/C:C/I:C/A:C)&version=2.0&source=NIST)|https://nvd.nist.gov/vuln/detail/CVE-1999-1241
CVE-1999-1242|Vulnerability in subnetconfig in HP-UX 9.01 and 9.0 allows local users to gain privileges.|February 07, 1994; 12:00:00 AM -0500|V3.x:(not available)       V2.0: 4.6 MEDIUM (https://nvd.nist.gov/vuln-metrics/cvss/v2-calculator?name=CVE-1999-1242&vector=(AV:L/AC:L/Au:N/C:P/I:P/A:P)&version=2.0&source=NIST)|https://nvd.nist.gov/vuln/detail/CVE-1999-1242
CVE-1999-1243|SGI Desktop Permissions Tool in IRIX 6.0.1 and earlier allows local users to modify permissions for arbitrary files and gain privileges.|March 03, 1995; 12:00:00 AM -0500|V3.x:(not available)       V2.0: 4.6 MEDIUM (https://nvd.nist.gov/vuln-metrics/cvss/v2-calculator?name=CVE-1999-1243&vector=(AV:L/AC:L/Au:N/C:P/I:P/A:P)&version=2.0&source=NIST)|https://nvd.nist.gov/vuln/detail/CVE-1999-1243
CVE-1999-1244|IPFilter 3.2.3 through 3.2.10 allows local users to modify arbitrary files via a symlink attack on the saved output file.|April 15, 1999; 12:00:00 AM -0400|V3.x:(not available)       V2.0: 7.2 HIGH (https://nvd.nist.gov/vuln-metrics/cvss/v2-calculator?name=CVE-1999-1244&vector=(AV:L/AC:L/Au:N/C:C/I:C/A:C)&version=2.0&source=NIST)|https://nvd.nist.gov/vuln/detail/CVE-1999-1244
CVE-1999-1245|vacm ucd-snmp SNMP server, version 3.52, does not properly disable access to the public community string, which could allow remote attackers to obtain sensitive information.|April 06, 1999; 12:00:00 AM -0400|V3.x:(not available)       V2.0: 5.0 MEDIUM (https://nvd.nist.gov/vuln-metrics/cvss/v2-calculator?name=CVE-1999-1245&vector=(AV:N/AC:L/Au:N/C:P/I:N/A:N)&version=2.0&source=NIST)|https://nvd.nist.gov/vuln/detail/CVE-1999-1245
CVE-1999-1246|Direct Mailer feature in Microsoft Site Server 3.0 saves user domain names and passwords in plaintext in the TMLBQueue network share, which has insecure default permissions, allowing remote attackers to read the passwords and gain privileges.|December 31, 1999; 12:00:00 AM -0500|V3.x:(not available)       V2.0: 7.5 HIGH (https://nvd.nist.gov/vuln-metrics/cvss/v2-calculator?name=CVE-1999-1246&vector=(AV:N/AC:L/Au:N/C:P/I:P/A:P)&version=2.0&source=NIST)|https://nvd.nist.gov/vuln/detail/CVE-1999-1246
CVE-1999-1247|Vulnerability in HP Camera component of HP DCE/9000 in HP-UX 9.x allows attackers to gain root privileges.|February 24, 1999; 12:00:00 AM -0500|V3.x:(not available)       V2.0: 7.2 HIGH (https://nvd.nist.gov/vuln-metrics/cvss/v2-calculator?name=CVE-1999-1247&vector=(AV:L/AC:L/Au:N/C:C/I:C/A:C)&version=2.0&source=NIST)|https://nvd.nist.gov/vuln/detail/CVE-1999-1247
CVE-1999-1248|Vulnerability in Support Watch (aka SupportWatch) in HP-UX 8.0 through 9.0 allows local users to gain privileges.|November 30, 1994; 12:00:00 AM -0500|V3.x:(not available)       V2.0: 4.6 MEDIUM (https://nvd.nist.gov/vuln-metrics/cvss/v2-calculator?name=CVE-1999-1248&vector=(AV:L/AC:L/Au:N/C:P/I:P/A:P)&version=2.0&source=NIST)|https://nvd.nist.gov/vuln/detail/CVE-1999-1248
CVE-1999-1249|movemail in HP-UX 10.20 has insecure permissions, which allows local users to gain privileges.|January 06, 1997; 12:00:00 AM -0500|V3.x:(not available)       V2.0: 4.6 MEDIUM (https://nvd.nist.gov/vuln-metrics/cvss/v2-calculator?name=CVE-1999-1249&vector=(AV:L/AC:L/Au:N/C:P/I:P/A:P)&version=2.0&source=NIST)|https://nvd.nist.gov/vuln/detail/CVE-1999-1249
CVE-1999-1250|Vulnerability in CGI program in the Lasso application by Blue World, as used on WebSTAR and other servers, allows remote attackers to read arbitrary files.|August 19, 1997; 12:00:00 AM -0400|V3.x:(not available)       V2.0: 5.0 MEDIUM (https://nvd.nist.gov/vuln-metrics/cvss/v2-calculator?name=CVE-1999-1250&vector=(AV:N/AC:L/Au:N/C:P/I:N/A:N)&version=2.0&source=NIST)|https://nvd.nist.gov/vuln/detail/CVE-1999-1250
CVE-1999-1251|Vulnerability in direct audio user space code on HP-UX 10.20 and 10.10 allows local users to cause a denial of service.|December 24, 1996; 12:00:00 AM -0500|V3.x:(not available)       V2.0: 2.1 LOW (https://nvd.nist.gov/vuln-metrics/cvss/v2-calculator?name=CVE-1999-1251&vector=(AV:L/AC:L/Au:N/C:N/I:N/A:P)&version=2.0&source=NIST)|https://nvd.nist.gov/vuln/detail/CVE-1999-1251
CVE-1999-1252|Vulnerability in a certain system call in SCO UnixWare 2.0.x and 2.1.0 allows local users to access arbitrary files and gain root privileges.|September 04, 1996; 12:00:00 AM -0400|V3.x:(not available)       V2.0: 7.2 HIGH (https://nvd.nist.gov/vuln-metrics/cvss/v2-calculator?name=CVE-1999-1252&vector=(AV:L/AC:L/Au:N/C:C/I:C/A:C)&version=2.0&source=NIST)|https://nvd.nist.gov/vuln/detail/CVE-1999-1252
CVE-1999-1253|Vulnerability in a kernel error handling routine in SCO OpenServer 5.0.2 and earlier, and SCO Internet FastStart 1.0, allows local users to gain root privileges.|June 07, 1996; 12:00:00 AM -0400|V3.x:(not available)       V2.0: 7.2 HIGH (https://nvd.nist.gov/vuln-metrics/cvss/v2-calculator?name=CVE-1999-1253&vector=(AV:L/AC:L/Au:N/C:C/I:C/A:C)&version=2.0&source=NIST)|https://nvd.nist.gov/vuln/detail/CVE-1999-1253
CVE-1999-1254|Windows 95, 98, and NT 4.0 allow remote attackers to cause a denial of service by spoofing ICMP redirect messages from a router, which causes Windows to change its routing tables.|March 08, 1999; 12:00:00 AM -0500|V3.x:(not available)       V2.0: 5.0 MEDIUM (https://nvd.nist.gov/vuln-metrics/cvss/v2-calculator?name=CVE-1999-1254&vector=(AV:N/AC:L/Au:N/C:N/I:N/A:P)&version=2.0&source=NIST)|https://nvd.nist.gov/vuln/detail/CVE-1999-1254
CVE-1999-1255|Hyperseek allows remote attackers to modify the hyperseek configuration by directly calling the admin.cgi program with an edit_file action parameter.|February 19, 1999; 12:00:00 AM -0500|V3.x:(not available)       V2.0: 5.0 MEDIUM (https://nvd.nist.gov/vuln-metrics/cvss/v2-calculator?name=CVE-1999-1255&vector=(AV:N/AC:L/Au:N/C:N/I:P/A:N)&version=2.0&source=NIST)|https://nvd.nist.gov/vuln/detail/CVE-1999-1255
CVE-1999-1256|Oracle Database Assistant 1.0 in Oracle 8.0.3 Enterprise Edition stores the database master password in plaintext in the spoolmain.log file when a new database is created, which allows local users to obtain the password from that file.|March 04, 1999; 12:00:00 AM -0500|V3.x:(not available)       V2.0: 4.6 MEDIUM (https://nvd.nist.gov/vuln-metrics/cvss/v2-calculator?name=CVE-1999-1256&vector=(AV:L/AC:L/Au:N/C:P/I:P/A:P)&version=2.0&source=NIST)|https://nvd.nist.gov/vuln/detail/CVE-1999-1256
CVE-1999-1257|Xyplex terminal server 6.0.1S1, and possibly other versions, allows remote attackers to bypass the password prompt by entering (1) a CTRL-Z character, or (2) a ? (question mark).|November 26, 1997; 12:00:00 AM -0500|V3.x:(not available)       V2.0: 7.5 HIGH (https://nvd.nist.gov/vuln-metrics/cvss/v2-calculator?name=CVE-1999-1257&vector=(AV:N/AC:L/Au:N/C:P/I:P/A:P)&version=2.0&source=NIST)|https://nvd.nist.gov/vuln/detail/CVE-1999-1257
CVE-1999-1258|rpc.pwdauthd in SunOS 4.1.1 and earlier does not properly prevent remote access to the daemon, which allows remote attackers to obtain sensitive system information.|January 15, 1991; 12:00:00 AM -0500|V3.x:(not available)       V2.0: 5.0 MEDIUM (https://nvd.nist.gov/vuln-metrics/cvss/v2-calculator?name=CVE-1999-1258&vector=(AV:N/AC:L/Au:N/C:P/I:N/A:N)&version=2.0&source=NIST)|https://nvd.nist.gov/vuln/detail/CVE-1999-1258
CVE-1999-1259|Microsoft Office 98, Macintosh Edition, does not properly initialize the disk space used by Office 98 files and effectively inserts data from previously deleted files into the Office file, which could allow attackers to obtain sensitive information.|December 31, 1999; 12:00:00 AM -0500|V3.x:(not available)       V2.0: 2.1 LOW (https://nvd.nist.gov/vuln-metrics/cvss/v2-calculator?name=CVE-1999-1259&vector=(AV:L/AC:L/Au:N/C:P/I:N/A:N)&version=2.0&source=NIST)|https://nvd.nist.gov/vuln/detail/CVE-1999-1259
CVE-1999-1260|mSQL (Mini SQL) 2.0.6 allows remote attackers to obtain sensitive server information such as logged users, database names, and server version via the ServerStats query.|February 15, 1999; 12:00:00 AM -0500|V3.x:(not available)       V2.0: 7.5 HIGH (https://nvd.nist.gov/vuln-metrics/cvss/v2-calculator?name=CVE-1999-1260&vector=(AV:N/AC:L/Au:N/C:P/I:P/A:P)&version=2.0&source=NIST)|https://nvd.nist.gov/vuln/detail/CVE-1999-1260
CVE-1999-1261|Buffer overflow in Rainbow Six Multiplayer allows remote attackers to cause a denial of service, and possibly execute arbitrary commands, via a long nickname (nick) command.|October 24, 1997; 12:00:00 AM -0400|V3.x:(not available)       V2.0: 5.0 MEDIUM (https://nvd.nist.gov/vuln-metrics/cvss/v2-calculator?name=CVE-1999-1261&vector=(AV:N/AC:L/Au:N/C:N/I:P/A:N)&version=2.0&source=NIST)|https://nvd.nist.gov/vuln/detail/CVE-1999-1261
CVE-1999-1262|Java in Netscape 4.5 does not properly restrict applets from connecting to other hosts besides the one from which the applet was loaded, which violates the Java security model and could allow remote attackers to conduct unauthorized activities.|August 01, 1997; 12:00:00 AM -0400|V3.x:(not available)       V2.0: 5.1 MEDIUM (https://nvd.nist.gov/vuln-metrics/cvss/v2-calculator?name=CVE-1999-1262&vector=(AV:N/AC:H/Au:N/C:P/I:P/A:P)&version=2.0&source=NIST)|https://nvd.nist.gov/vuln/detail/CVE-1999-1262
CVE-1999-1263|Metamail before 2.7-7.2 allows remote attackers to overwrite arbitrary files via an e-mail message containing a uuencoded attachment that specifies the full pathname for the file to be modified, which is processed by uuencode in Metamail scripts such as sun-audio-file.|August 15, 2003; 12:00:00 AM -0400|V3.x:(not available)       V2.0: 2.6 LOW (https://nvd.nist.gov/vuln-metrics/cvss/v2-calculator?name=CVE-1999-1263&vector=(AV:N/AC:H/Au:N/C:N/I:P/A:N)&version=2.0&source=NIST)|https://nvd.nist.gov/vuln/detail/CVE-1999-1263
CVE-1999-1264|WebRamp M3 router does not disable remote telnet or HTTP access to itself, even when access has been explicitly disabled.|January 21, 1999; 12:00:00 AM -0500|V3.x:(not available)       V2.0: 7.5 HIGH (https://nvd.nist.gov/vuln-metrics/cvss/v2-calculator?name=CVE-1999-1264&vector=(AV:N/AC:L/Au:N/C:P/I:P/A:P)&version=2.0&source=NIST)|https://nvd.nist.gov/vuln/detail/CVE-1999-1264
CVE-1999-1265|"SMTP server in SLmail 3.1 and earlier allows remote attackers to cause a denial of service via malformed commands whose arguments begin with a ""("" (parenthesis) character, such as (1) SEND, (2) VRFY, (3) EXPN, (4) MAIL FROM, (5) RCPT TO."|September 22, 1998; 12:00:00 AM -0400|V3.x:(not available)       V2.0: 5.0 MEDIUM (https://nvd.nist.gov/vuln-metrics/cvss/v2-calculator?name=CVE-1999-1265&vector=(AV:N/AC:L/Au:N/C:N/I:N/A:P)&version=2.0&source=NIST)|https://nvd.nist.gov/vuln/detail/CVE-1999-1265
CVE-1999-1266|rsh daemon (rshd) generates different error messages when a valid username is provided versus an invalid name, which allows remote attackers to determine valid users on the system.|June 13, 1997; 12:00:00 AM -0400|V3.x:(not available)       V2.0: 5.0 MEDIUM (https://nvd.nist.gov/vuln-metrics/cvss/v2-calculator?name=CVE-1999-1266&vector=(AV:N/AC:L/Au:N/C:P/I:N/A:N)&version=2.0&source=NIST)|https://nvd.nist.gov/vuln/detail/CVE-1999-1266
CVE-1999-1267|KDE file manager (kfm) uses a TCP server for certain file operations, which allows remote attackers to modify arbitrary files by sending a copy command to the server.|May 05, 1997; 12:00:00 AM -0400|V3.x:(not available)       V2.0: 5.0 MEDIUM (https://nvd.nist.gov/vuln-metrics/cvss/v2-calculator?name=CVE-1999-1267&vector=(AV:N/AC:L/Au:N/C:N/I:P/A:N)&version=2.0&source=NIST)|https://nvd.nist.gov/vuln/detail/CVE-1999-1267
CVE-1999-1268|Vulnerability in KDE konsole allows local users to hijack or observe sessions of other users by accessing certain devices.|January 06, 1999; 12:00:00 AM -0500|V3.x:(not available)       V2.0: 7.2 HIGH (https://nvd.nist.gov/vuln-metrics/cvss/v2-calculator?name=CVE-1999-1268&vector=(AV:L/AC:L/Au:N/C:C/I:C/A:C)&version=2.0&source=NIST)|https://nvd.nist.gov/vuln/detail/CVE-1999-1268
CVE-1999-1269|Screen savers in KDE beta 3 allows local users to overwrite arbitrary files via a symlink attack on the .kss.pid file.|February 06, 1998; 12:00:00 AM -0500|V3.x:(not available)       V2.0: 2.1 LOW (https://nvd.nist.gov/vuln-metrics/cvss/v2-calculator?name=CVE-1999-1269&vector=(AV:L/AC:L/Au:N/C:N/I:P/A:N)&version=2.0&source=NIST)|https://nvd.nist.gov/vuln/detail/CVE-1999-1269
CVE-1999-1270|KMail in KDE 1.0 provides a PGP passphrase as a command line argument to other programs, which could allow local users to obtain the passphrase and compromise the PGP keys of other users by viewing the arguments via programs that list process information, such as ps.|July 11, 1998; 12:00:00 AM -0400|V3.x:(not available)       V2.0: 4.6 MEDIUM (https://nvd.nist.gov/vuln-metrics/cvss/v2-calculator?name=CVE-1999-1270&vector=(AV:L/AC:L/Au:N/C:P/I:P/A:P)&version=2.0&source=NIST)|https://nvd.nist.gov/vuln/detail/CVE-1999-1270
CVE-1999-1271|Macromedia Dreamweaver uses weak encryption to store FTP passwords, which could allow local users to easily decrypt the passwords of other users.|June 11, 1998; 12:00:00 AM -0400|V3.x:(not available)       V2.0: 2.1 LOW (https://nvd.nist.gov/vuln-metrics/cvss/v2-calculator?name=CVE-1999-1271&vector=(AV:L/AC:L/Au:N/C:P/I:N/A:N)&version=2.0&source=NIST)|https://nvd.nist.gov/vuln/detail/CVE-1999-1271
CVE-1999-1272|Buffer overflows in CDROM Confidence Test program (cdrom) allow local users to gain root privileges.|March 01, 1998; 12:00:00 AM -0500|V3.x:(not available)       V2.0: 7.2 HIGH (https://nvd.nist.gov/vuln-metrics/cvss/v2-calculator?name=CVE-1999-1272&vector=(AV:L/AC:L/Au:N/C:C/I:C/A:C)&version=2.0&source=NIST)|https://nvd.nist.gov/vuln/detail/CVE-1999-1272
CVE-1999-1273|Squid Internet Object Cache 1.1.20 allows users to bypass access control lists (ACLs) by encoding the URL with hexadecimal escape sequences.|February 20, 1998; 12:00:00 AM -0500|V3.x:(not available)       V2.0: 7.5 HIGH (https://nvd.nist.gov/vuln-metrics/cvss/v2-calculator?name=CVE-1999-1273&vector=(AV:N/AC:L/Au:N/C:P/I:P/A:P)&version=2.0&source=NIST)|https://nvd.nist.gov/vuln/detail/CVE-1999-1273
CVE-1999-1274|iPass RoamServer 3.1 creates temporary files with world-writable permissions.|December 29, 1997; 12:00:00 AM -0500|V3.x:(not available)       V2.0: 6.4 MEDIUM (https://nvd.nist.gov/vuln-metrics/cvss/v2-calculator?name=CVE-1999-1274&vector=(AV:N/AC:L/Au:N/C:P/I:P/A:N)&version=2.0&source=NIST)|https://nvd.nist.gov/vuln/detail/CVE-1999-1274
CVE-1999-1275|Lotus cc:Mail release 8 stores the postoffice password in plaintext in a hidden file which has insecure permissions, which allows local users to gain privileges.|September 08, 1997; 12:00:00 AM -0400|V3.x:(not available)       V2.0: 4.6 MEDIUM (https://nvd.nist.gov/vuln-metrics/cvss/v2-calculator?name=CVE-1999-1275&vector=(AV:L/AC:L/Au:N/C:P/I:P/A:P)&version=2.0&source=NIST)|https://nvd.nist.gov/vuln/detail/CVE-1999-1275
CVE-1999-1276|fte-console in the fte package before 0.46b-4.1 does not drop root privileges, which allows local users to gain root access via the virtual console device.|December 07, 1998; 12:00:00 AM -0500|V3.x:(not available)       V2.0: 7.2 HIGH (https://nvd.nist.gov/vuln-metrics/cvss/v2-calculator?name=CVE-1999-1276&vector=(AV:L/AC:L/Au:N/C:C/I:C/A:C)&version=2.0&source=NIST)|https://nvd.nist.gov/vuln/detail/CVE-1999-1276
CVE-1999-1277|BackWeb client stores the username and password in cleartext for proxy authentication in the Communication registry key, which could allow other local users to gain privileges by reading the password.|December 24, 1998; 12:00:00 AM -0500|V3.x:(not available)       V2.0: 4.6 MEDIUM (https://nvd.nist.gov/vuln-metrics/cvss/v2-calculator?name=CVE-1999-1277&vector=(AV:L/AC:L/Au:N/C:P/I:P/A:P)&version=2.0&source=NIST)|https://nvd.nist.gov/vuln/detail/CVE-1999-1277
CVE-1999-1278|nlog CGI scripts do not properly filter shell metacharacters from the IP address argument, which could allow remote attackers to execute certain commands via (1) nlog-smb.pl or (2) rpc-nlog.pl.|December 25, 1998; 12:00:00 AM -0500|V3.x:(not available)       V2.0: 7.5 HIGH (https://nvd.nist.gov/vuln-metrics/cvss/v2-calculator?name=CVE-1999-1278&vector=(AV:N/AC:L/Au:N/C:P/I:P/A:P)&version=2.0&source=NIST)|https://nvd.nist.gov/vuln/detail/CVE-1999-1278
CVE-1999-1279|An interaction between the AS/400 shared folders feature and Microsoft SNA Server 3.0 and earlier allows users to view each other's folders when the users share the same Local APPC LU.|December 31, 1999; 12:00:00 AM -0500|V3.x:(not available)       V2.0: 5.0 MEDIUM (https://nvd.nist.gov/vuln-metrics/cvss/v2-calculator?name=CVE-1999-1279&vector=(AV:N/AC:L/Au:N/C:P/I:N/A:N)&version=2.0&source=NIST)|https://nvd.nist.gov/vuln/detail/CVE-1999-1279
CVE-1999-1280|Hummingbird Exceed 6.0.1.0 inadvertently includes a DLL that was meant for development and testing, which logs user names and passwords in cleartext in the test.log file.|December 03, 1998; 12:00:00 AM -0500|V3.x:(not available)       V2.0: 7.5 HIGH (https://nvd.nist.gov/vuln-metrics/cvss/v2-calculator?name=CVE-1999-1280&vector=(AV:N/AC:L/Au:N/C:P/I:P/A:P)&version=2.0&source=NIST)|https://nvd.nist.gov/vuln/detail/CVE-1999-1280
CVE-1999-1281|Development version of Breeze Network Server allows remote attackers to cause the system to reboot by accessing the configbreeze CGI program.|December 26, 1998; 12:00:00 AM -0500|V3.x:(not available)       V2.0: 5.0 MEDIUM (https://nvd.nist.gov/vuln-metrics/cvss/v2-calculator?name=CVE-1999-1281&vector=(AV:N/AC:L/Au:N/C:N/I:N/A:P)&version=2.0&source=NIST)|https://nvd.nist.gov/vuln/detail/CVE-1999-1281
CVE-1999-1282|RealSystem G2 server stores the administrator password in cleartext in a world-readable configuration file, which allows local users to gain privileges.|December 10, 1998; 12:00:00 AM -0500|V3.x:(not available)       V2.0: 4.6 MEDIUM (https://nvd.nist.gov/vuln-metrics/cvss/v2-calculator?name=CVE-1999-1282&vector=(AV:L/AC:L/Au:N/C:P/I:P/A:P)&version=2.0&source=NIST)|https://nvd.nist.gov/vuln/detail/CVE-1999-1282
CVE-1999-1283|Opera 3.2.1 allows remote attackers to cause a denial of service (application crash) via a URL that contains an extra / in the http:// tag.|August 14, 1998; 12:00:00 AM -0400|V3.x:(not available)       V2.0: 5.0 MEDIUM (https://nvd.nist.gov/vuln-metrics/cvss/v2-calculator?name=CVE-1999-1283&vector=(AV:N/AC:L/Au:N/C:N/I:N/A:P)&version=2.0&source=NIST)|https://nvd.nist.gov/vuln/detail/CVE-1999-1283
CVE-1999-1284|NukeNabber allows remote attackers to cause a denial of service by connecting to the NukeNabber port (1080) without sending any data, which causes the CPU usage to rise to 100% from the report.exe program that is executed upon the connection.|November 05, 1998; 12:00:00 AM -0500|V3.x:(not available)       V2.0: 5.0 MEDIUM (https://nvd.nist.gov/vuln-metrics/cvss/v2-calculator?name=CVE-1999-1284&vector=(AV:N/AC:L/Au:N/C:N/I:N/A:P)&version=2.0&source=NIST)|https://nvd.nist.gov/vuln/detail/CVE-1999-1284
CVE-1999-1285|Linux 2.1.132 and earlier allows local users to cause a denial of service (resource exhaustion) by reading a large buffer from a random device (e.g. /dev/urandom), which cannot be interrupted until the read has completed.|December 27, 1998; 12:00:00 AM -0500|V3.x:(not available)       V2.0: 2.1 LOW (https://nvd.nist.gov/vuln-metrics/cvss/v2-calculator?name=CVE-1999-1285&vector=(AV:L/AC:L/Au:N/C:N/I:N/A:P)&version=2.0&source=NIST)|https://nvd.nist.gov/vuln/detail/CVE-1999-1285
CVE-1999-1286|addnetpr in SGI IRIX 6.2 and earlier allows local users to modify arbitrary files and possibly gain root access via a symlink attack on a temporary file.|May 09, 1997; 12:00:00 AM -0400|V3.x:(not available)       V2.0: 7.2 HIGH (https://nvd.nist.gov/vuln-metrics/cvss/v2-calculator?name=CVE-1999-1286&vector=(AV:L/AC:L/Au:N/C:C/I:C/A:C)&version=2.0&source=NIST)|https://nvd.nist.gov/vuln/detail/CVE-1999-1286
CVE-1999-1287|Vulnerability in Analog 3.0 and earlier allows remote attackers to read arbitrary files via the forms interface.|December 31, 1999; 12:00:00 AM -0500|V3.x:(not available)       V2.0: 5.0 MEDIUM (https://nvd.nist.gov/vuln-metrics/cvss/v2-calculator?name=CVE-1999-1287&vector=(AV:N/AC:L/Au:N/C:P/I:N/A:N)&version=2.0&source=NIST)|https://nvd.nist.gov/vuln/detail/CVE-1999-1287
CVE-1999-1288|Samba 1.9.18 inadvertently includes a prototype application, wsmbconf, which is installed with incorrect permissions including the setgid bit, which allows local users to read and write files and possibly gain privileges via bugs in the program.|November 19, 1998; 12:00:00 AM -0500|V3.x:(not available)       V2.0: 4.6 MEDIUM (https://nvd.nist.gov/vuln-metrics/cvss/v2-calculator?name=CVE-1999-1288&vector=(AV:L/AC:L/Au:N/C:P/I:P/A:P)&version=2.0&source=NIST)|https://nvd.nist.gov/vuln/detail/CVE-1999-1288
CVE-1999-1289|ICQ 98 beta on Windows NT leaks the internal IP address of a client in the TCP data segment of an ICQ packet instead of the public address (e.g. through NAT), which provides remote attackers with potentially sensitive information about the client or the internal network configuration.|November 11, 1998; 12:00:00 AM -0500|V3.x:(not available)       V2.0: 7.5 HIGH (https://nvd.nist.gov/vuln-metrics/cvss/v2-calculator?name=CVE-1999-1289&vector=(AV:N/AC:L/Au:N/C:P/I:P/A:P)&version=2.0&source=NIST)|https://nvd.nist.gov/vuln/detail/CVE-1999-1289
