Vuln ID|Summary|Published Date|CVSS Severity|Link
CVE-2018-25068|A vulnerability has been found in devent globalpom-utils up to 4.5.0 and classified as critical. This vulnerability affects the function createTmpDir of the file globalpomutils-fileresources/src/main/java/com/anrisoftware/globalpom/fileresourcemanager/FileResourceManagerProvider.java. The manipulation leads to insecure temporary file. The attack can be initiated remotely. Upgrading to version 4.5.1 is able to address this issue. The patch is identified as 77a820bac2f68e662ce261ecb050c643bd7ee560. It is recommended to upgrade the affected component. VDB-217570 is the identifier assigned to this vulnerability.|January 06, 2023; 4:15:09 PM -0500|V3.1: 9.8 CRITICALV2.0:(not available)  (https://nvd.nist.gov/vuln-metrics/cvss/v3-calculator?name=CVE-2018-25068&vector=AV:N/AC:L/PR:N/UI:N/S:U/C:H/I:H/A:H&version=3.1&source=NIST)|https://nvd.nist.gov/vuln/detail/CVE-2018-25068
CVE-2018-25069|A vulnerability classified as critical has been found in Netis Netcore Router. This affects an unknown part. The manipulation leads to use of hard-coded password. It is possible to initiate the attack remotely. The identifier VDB-217593 was assigned to this vulnerability.|January 07, 2023; 4:15:21 AM -0500|V3.1: 9.8 CRITICALV2.0:(not available)  (https://nvd.nist.gov/vuln-metrics/cvss/v3-calculator?name=CVE-2018-25069&vector=AV:N/AC:L/PR:N/UI:N/S:U/C:H/I:H/A:H&version=3.1&source=NIST)|https://nvd.nist.gov/vuln/detail/CVE-2018-25069
CVE-2018-25070|A vulnerability has been found in polterguy Phosphorus Five up to 8.2 and classified as critical. This vulnerability affects the function csv.Read of the file plugins/extras/p5.mysql/NonQuery.cs of the component CSV Import. The manipulation leads to sql injection. Upgrading to version 8.3 is able to address this issue. The patch is identified as c179a3d0703db55cfe0cb939b89593f2e7a87246. It is recommended to upgrade the affected component. VDB-217606 is the identifier assigned to this vulnerability.|January 07, 2023; 6:15:08 AM -0500|V3.1: 9.8 CRITICALV2.0:(not available)  (https://nvd.nist.gov/vuln-metrics/cvss/v3-calculator?name=CVE-2018-25070&vector=AV:N/AC:L/PR:N/UI:N/S:U/C:H/I:H/A:H&version=3.1&source=NIST)|https://nvd.nist.gov/vuln/detail/CVE-2018-25070
CVE-2018-25071|A vulnerability was found in roxlukas LMeve up to 0.1.58. It has been rated as critical. Affected by this issue is the function insert_log of the file wwwroot/ccpwgl/proxy.php. The manipulation of the argument fetch leads to sql injection. Upgrading to version 0.1.59-beta is able to address this issue. The patch is identified as c25ff7fe83a2cda1fcb365b182365adc3ffae332. It is recommended to upgrade the affected component. VDB-217610 is the identifier assigned to this vulnerability.|January 07, 2023; 7:15:08 AM -0500|V3.1: 9.8 CRITICALV2.0:(not available)  (https://nvd.nist.gov/vuln-metrics/cvss/v3-calculator?name=CVE-2018-25071&vector=AV:N/AC:L/PR:N/UI:N/S:U/C:H/I:H/A:H&version=3.1&source=NIST)|https://nvd.nist.gov/vuln/detail/CVE-2018-25071
CVE-2018-25072|A vulnerability classified as critical has been found in lojban jbovlaste. This affects an unknown part of the file dict/listing.html. The manipulation leads to sql injection. It is possible to initiate the attack remotely. The patch is named 6ff44c2e87b1113eb07d76ea62e1f64193b04d15. It is recommended to apply a patch to fix this issue. The associated identifier of this vulnerability is VDB-217647.|January 08, 2023; 8:15:09 AM -0500|V3.1: 9.8 CRITICALV2.0:(not available)  (https://nvd.nist.gov/vuln-metrics/cvss/v3-calculator?name=CVE-2018-25072&vector=AV:N/AC:L/PR:N/UI:N/S:U/C:H/I:H/A:H&version=3.1&source=NIST)|https://nvd.nist.gov/vuln/detail/CVE-2018-25072
CVE-2018-25073|A vulnerability has been found in Newcomer1989 TSN-Ranksystem up to 1.2.6 and classified as problematic. This vulnerability affects the function getlog of the file webinterface/bot.php. The manipulation leads to cross site scripting. The attack can be initiated remotely. Upgrading to version 1.2.7 is able to address this issue. The patch is identified as b3a3cd8efe2cd3bd3c5b3b7abf2fe80dbee51b77. It is recommended to upgrade the affected component. VDB-218002 is the identifier assigned to this vulnerability.|January 11, 2023; 9:15:08 AM -0500|V3.1: 6.1 MEDIUMV2.0:(not available)  (https://nvd.nist.gov/vuln-metrics/cvss/v3-calculator?name=CVE-2018-25073&vector=AV:N/AC:L/PR:N/UI:R/S:C/C:L/I:L/A:N&version=3.1&source=NIST)|https://nvd.nist.gov/vuln/detail/CVE-2018-25073
CVE-2018-25074|A vulnerability was found in Prestaul skeemas and classified as problematic. This issue affects some unknown processing of the file validators/base.js. The manipulation of the argument uri leads to inefficient regular expression complexity. The patch is named 65e94eda62dc8dc148ab3e59aa2ccc086ac448fd. It is recommended to apply a patch to fix this issue. The associated identifier of this vulnerability is VDB-218003.|January 11, 2023; 10:15:09 AM -0500|V3.1: 7.5 HIGHV2.0:(not available)  (https://nvd.nist.gov/vuln-metrics/cvss/v3-calculator?name=CVE-2018-25074&vector=AV:N/AC:L/PR:N/UI:N/S:U/C:N/I:N/A:H&version=3.1&source=NIST)|https://nvd.nist.gov/vuln/detail/CVE-2018-25074
CVE-2018-25075|A vulnerability classified as critical has been found in karsany OBridge up to 1.3. Affected is the function getAllStandaloneProcedureAndFunction of the file obridge-main/src/main/java/org/obridge/dao/ProcedureDao.java. The manipulation leads to sql injection. The complexity of an attack is rather high. The exploitability is told to be difficult. Upgrading to version 1.4 is able to address this issue. The name of the patch is 52eca4ad05f3c292aed3178b2f58977686ffa376. It is recommended to upgrade the affected component. The identifier of this vulnerability is VDB-218376.|January 15, 2023; 3:15:09 PM -0500|V3.1: 9.8 CRITICALV2.0:(not available)  (https://nvd.nist.gov/vuln-metrics/cvss/v3-calculator?name=CVE-2018-25075&vector=AV:N/AC:L/PR:N/UI:N/S:U/C:H/I:H/A:H&version=3.1&source=NIST)|https://nvd.nist.gov/vuln/detail/CVE-2018-25075
CVE-2018-25076|A vulnerability classified as critical was found in Events Extension on BigTree. Affected by this vulnerability is the function getRandomFeaturedEventByDate/getUpcomingFeaturedEventsInCategoriesWithSubcategories/recacheEvent/searchResults of the file classes/events.php. The manipulation leads to sql injection. The patch is named 11169e48ab1249109485fdb1e0c9fca3d25ba01d. It is recommended to apply a patch to fix this issue. The associated identifier of this vulnerability is VDB-218395.|January 16, 2023; 7:15:16 AM -0500|V3.1: 9.8 CRITICALV2.0:(not available)  (https://nvd.nist.gov/vuln-metrics/cvss/v3-calculator?name=CVE-2018-25076&vector=AV:N/AC:L/PR:N/UI:N/S:U/C:H/I:H/A:H&version=3.1&source=NIST)|https://nvd.nist.gov/vuln/detail/CVE-2018-25076
CVE-2018-25077|A vulnerability was found in melnaron mel-spintax. It has been rated as problematic. Affected by this issue is some unknown functionality of the file lib/spintax.js. The manipulation of the argument text leads to inefficient regular expression complexity. The name of the patch is 37767617846e27b87b63004e30216e8f919637d3. It is recommended to apply a patch to fix this issue. The identifier of this vulnerability is VDB-218456.|January 17, 2023; 8:15:11 PM -0500|V3.1: 7.5 HIGHV2.0:(not available)  (https://nvd.nist.gov/vuln-metrics/cvss/v3-calculator?name=CVE-2018-25077&vector=AV:N/AC:L/PR:N/UI:N/S:U/C:N/I:N/A:H&version=3.1&source=NIST)|https://nvd.nist.gov/vuln/detail/CVE-2018-25077
CVE-2018-25078|man-db before 2.8.5 on Gentoo allows local users (with access to the man user account) to gain root privileges because /usr/bin/mandb is executed by root but not owned by root. (Also, the owner can strip the setuid and setgid bits.)|January 26, 2023; 4:15:16 PM -0500|V3.1: 7.8 HIGHV2.0:(not available)  (https://nvd.nist.gov/vuln-metrics/cvss/v3-calculator?name=CVE-2018-25078&vector=AV:L/AC:L/PR:L/UI:N/S:U/C:H/I:H/A:H&version=3.1&source=NIST)|https://nvd.nist.gov/vuln/detail/CVE-2018-25078
CVE-2018-25079|A vulnerability was found in Segmentio is-url up to 1.2.2. It has been rated as problematic. Affected by this issue is some unknown functionality of the file index.js. The manipulation leads to inefficient regular expression complexity. The attack may be launched remotely. Upgrading to version 1.2.3 is able to address this issue. The patch is identified as 149550935c63a98c11f27f694a7c4a9479e53794. It is recommended to upgrade the affected component. VDB-220058 is the identifier assigned to this vulnerability.|February 03, 2023; 11:15:08 PM -0500|V3.1: 7.5 HIGHV2.0:(not available)  (https://nvd.nist.gov/vuln-metrics/cvss/v3-calculator?name=CVE-2018-25079&vector=AV:N/AC:L/PR:N/UI:N/S:U/C:N/I:N/A:H&version=3.1&source=NIST)|https://nvd.nist.gov/vuln/detail/CVE-2018-25079
CVE-2018-25080|A vulnerability, which was classified as problematic, has been found in MobileDetect 2.8.31. This issue affects the function initLayoutType of the file examples/session_example.php of the component Example. The manipulation of the argument $_SERVER['PHP_SELF'] leads to cross site scripting. The attack may be initiated remotely. The exploit has been disclosed to the public and may be used. Upgrading to version 2.8.32 is able to address this issue. The identifier of the patch is 31818a441b095bdc4838602dbb17b8377d1e5cce. It is recommended to upgrade the affected component. The identifier VDB-220061 was assigned to this vulnerability.|February 04, 2023; 3:15:07 AM -0500|V3.1: 6.1 MEDIUMV2.0:(not available)  (https://nvd.nist.gov/vuln-metrics/cvss/v3-calculator?name=CVE-2018-25080&vector=AV:N/AC:L/PR:N/UI:R/S:C/C:L/I:L/A:N&version=3.1&source=NIST)|https://nvd.nist.gov/vuln/detail/CVE-2018-25080
CVE-2018-25081|"Bitwarden through 2023.2.1 offers password auto-fill within a cross-domain IFRAME element. NOTE: the vendor's position is that there have been important legitimate cross-domain configurations (e.g., an apple.com IFRAME element on the icloud.com website) and that ""Auto-fill on page load"" is not enabled by default."|March 08, 2023; 7:15:09 PM -0500|V3.1: 7.5 HIGHV2.0:(not available)  (https://nvd.nist.gov/vuln-metrics/cvss/v3-calculator?name=CVE-2018-25081&vector=AV:N/AC:L/PR:N/UI:N/S:U/C:H/I:N/A:N&version=3.1&source=NIST)|https://nvd.nist.gov/vuln/detail/CVE-2018-25081
CVE-2018-25082|A vulnerability was found in zwczou WeChat SDK Python 0.3.0 and classified as critical. This issue affects the function validate/to_xml. The manipulation leads to xml external entity reference. The attack may be initiated remotely. Upgrading to version 0.5.5 is able to address this issue. The patch is named e54abadc777715b6dcb545c13214d1dea63df6c9. It is recommended to upgrade the affected component. The associated identifier of this vulnerability is VDB-223403.|March 21, 2023; 2:15:11 PM -0400|V3.1: 9.8 CRITICALV2.0:(not available)  (https://nvd.nist.gov/vuln-metrics/cvss/v3-calculator?name=CVE-2018-25082&vector=AV:N/AC:L/PR:N/UI:N/S:U/C:H/I:H/A:H&version=3.1&source=NIST)|https://nvd.nist.gov/vuln/detail/CVE-2018-25082
CVE-2018-25083|The pullit package before 1.4.0 for Node.js allows OS Command Injection because eval is used on an attacker-supplied Git branch name.|March 26, 2023; 11:15:07 PM -0400|V3.1: 9.8 CRITICALV2.0:(not available)  (https://nvd.nist.gov/vuln-metrics/cvss/v3-calculator?name=CVE-2018-25083&vector=AV:N/AC:L/PR:N/UI:N/S:U/C:H/I:H/A:H&version=3.1&source=NIST)|https://nvd.nist.gov/vuln/detail/CVE-2018-25083
CVE-2018-25084|A vulnerability, which was classified as problematic, has been found in Ping Identity Self-Service Account Manager 1.1.2. Affected by this issue is some unknown functionality of the file src/main/java/com/unboundid/webapp/ssam/SSAMController.java. The manipulation leads to cross site scripting. The attack may be launched remotely. Upgrading to version 1.1.3 is able to address this issue. The patch is identified as f64b10d63bb19ca2228b0c2d561a1a6e5a3bf251. It is recommended to upgrade the affected component. VDB-225362 is the identifier assigned to this vulnerability.|April 10, 2023; 2:15:07 PM -0400|V3.1: 6.1 MEDIUMV2.0:(not available)  (https://nvd.nist.gov/vuln-metrics/cvss/v3-calculator?name=CVE-2018-25084&vector=AV:N/AC:L/PR:N/UI:R/S:C/C:L/I:L/A:N&version=3.1&source=NIST)|https://nvd.nist.gov/vuln/detail/CVE-2018-25084
CVE-2018-25085|A vulnerability classified as problematic was found in Responsive Menus 7.x-1.x-dev on Drupal. Affected by this vulnerability is the function responsive_menus_admin_form_submit of the file responsive_menus.module of the component Configuration Setting Handler. The manipulation leads to cross site scripting. The attack can be launched remotely. Upgrading to version 7.x-1.7 is able to address this issue. The patch is named 3c554b31d32a367188f44d44857b061eac949fb8. It is recommended to upgrade the affected component. The associated identifier of this vulnerability is VDB-227755.|May 01, 2023; 1:15:08 AM -0400|V3.1: 4.8 MEDIUMV2.0:(not available)  (https://nvd.nist.gov/vuln-metrics/cvss/v3-calculator?name=CVE-2018-25085&vector=AV:N/AC:L/PR:H/UI:R/S:C/C:L/I:L/A:N&version=3.1&source=NIST)|https://nvd.nist.gov/vuln/detail/CVE-2018-25085
CVE-2018-25086|A vulnerability was found in sea75300 FanPress CM up to 3.6.3. It has been classified as problematic. This affects the function getArticlesPreview of the file inc/controller/action/system/templatepreview.php of the component Template Preview. The manipulation leads to cross site scripting. It is possible to initiate the attack remotely. Upgrading to version 3.6.4 is able to address this issue. The patch is named c380d343c2107fcee55ab00eb8d189ce5e03369b. It is recommended to upgrade the affected component. The associated identifier of this vulnerability is VDB-230235.|June 01, 2023; 3:15:08 AM -0400|V3.1: 6.1 MEDIUMV2.0:(not available)  (https://nvd.nist.gov/vuln-metrics/cvss/v3-calculator?name=CVE-2018-25086&vector=AV:N/AC:L/PR:N/UI:R/S:C/C:L/I:L/A:N&version=3.1&source=NIST)|https://nvd.nist.gov/vuln/detail/CVE-2018-25086
CVE-2018-25087|A vulnerability classified as problematic was found in Arborator Server. This vulnerability affects the function start of the file project.cgi. The manipulation of the argument project leads to denial of service. Continious delivery with rolling releases is used by this product. Therefore, no version details of affected nor updated releases are available. The patch is identified as cdbdbcbd491db65e9d697ab4365605fdfab1a604. It is recommended to apply a patch to fix this issue. VDB-230662 is the identifier assigned to this vulnerability.|June 05, 2023; 11:15:08 PM -0400|V3.1: 7.5 HIGHV2.0:(not available)  (https://nvd.nist.gov/vuln-metrics/cvss/v3-calculator?name=CVE-2018-25087&vector=AV:N/AC:L/PR:N/UI:N/S:U/C:N/I:N/A:H&version=3.1&source=NIST)|https://nvd.nist.gov/vuln/detail/CVE-2018-25087
CVE-2018-25088|A vulnerability, which was classified as critical, was found in Blue Yonder postgraas_server up to 2.0.0b2. Affected is the function _create_pg_connection/create_postgres_db of the file postgraas_server/backends/postgres_cluster/postgres_cluster_driver.py of the component PostgreSQL Backend Handler. The manipulation leads to sql injection. Upgrading to version 2.0.0 is able to address this issue. The patch is identified as 7cd8d016edc74a78af0d81c948bfafbcc93c937c. It is recommended to upgrade the affected component. VDB-234246 is the identifier assigned to this vulnerability.|July 18, 2023; 9:15:11 AM -0400|V3.1: 9.8 CRITICALV2.0:(not available)  (https://nvd.nist.gov/vuln-metrics/cvss/v3-calculator?name=CVE-2018-25088&vector=AV:N/AC:L/PR:N/UI:N/S:U/C:H/I:H/A:H&version=3.1&source=NIST)|https://nvd.nist.gov/vuln/detail/CVE-2018-25088
CVE-2018-25089|A vulnerability was found in glb Meetup Tag Extension 0.1 on MediaWiki. It has been rated as problematic. This issue affects some unknown processing of the component Link Attribute Handler. The manipulation leads to use of web link to untrusted target with window.opener access. Upgrading to version 0.2 is able to address this issue. The identifier of the patch is 850c726d6bbfe0bf270801fbb92a30babea4155c. It is recommended to upgrade the affected component. The identifier VDB-238157 was assigned to this vulnerability.|August 28, 2023; 9:15:09 AM -0400|V3.1: 5.3 MEDIUMV2.0:(not available)  (https://nvd.nist.gov/vuln-metrics/cvss/v3-calculator?name=CVE-2018-25089&vector=AV:N/AC:L/PR:N/UI:N/S:U/C:N/I:L/A:N&version=3.1&source=NIST)|https://nvd.nist.gov/vuln/detail/CVE-2018-25089
CVE-2018-25090|An unauthenticated remote attacker can use an XSS attack due to improper neutralization of input during web page generation. User interaction is required. This leads to a limited impact of confidentiality and integrity but no impact of availability.|March 13, 2024; 5:15:07 AM -0400|V3.1: 5.4 MEDIUMV2.0:(not available)  (https://nvd.nist.gov/vuln-metrics/cvss/v3-calculator?name=CVE-2018-25090&vector=AV:N/AC:L/PR:N/UI:R/S:U/C:L/I:L/A:N&version=3.1&source=CERT%20VDE)|https://nvd.nist.gov/vuln/detail/CVE-2018-25090
CVE-2018-25091|urllib3 before 1.24.2 does not remove the authorization HTTP header when following a cross-origin redirect (i.e., a redirect that differs in host, port, or scheme). This can allow for credentials in the authorization header to be exposed to unintended hosts or transmitted in cleartext. NOTE: this issue exists because of an incomplete fix for CVE-2018-20060 (which was case-sensitive).|October 15, 2023; 3:15:09 PM -0400|V3.1: 6.1 MEDIUMV2.0:(not available)  (https://nvd.nist.gov/vuln-metrics/cvss/v3-calculator?name=CVE-2018-25091&vector=AV:N/AC:L/PR:N/UI:R/S:C/C:L/I:L/A:N&version=3.1&source=NIST)|https://nvd.nist.gov/vuln/detail/CVE-2018-25091
CVE-2018-25092|A vulnerability was found in Vaerys-Dawn DiscordSailv2 up to 2.10.2. It has been declared as critical. Affected by this vulnerability is an unknown functionality of the component Command Mention Handler. The manipulation leads to improper access controls. Upgrading to version 2.10.3 is able to address this issue. The patch is named cc12e0be82a5d05d9f359ed8e56088f4f8b8eb69. It is recommended to upgrade the affected component. The associated identifier of this vulnerability is VDB-244483.|November 05, 2023; 4:15:09 PM -0500|V3.1: 9.8 CRITICALV2.0:(not available)  (https://nvd.nist.gov/vuln-metrics/cvss/v3-calculator?name=CVE-2018-25092&vector=AV:N/AC:L/PR:N/UI:N/S:U/C:H/I:H/A:H&version=3.1&source=NIST)|https://nvd.nist.gov/vuln/detail/CVE-2018-25092
CVE-2018-25093|A vulnerability was found in Vaerys-Dawn DiscordSailv2 up to 2.10.2. It has been rated as critical. Affected by this issue is some unknown functionality of the component Tag Handler. The manipulation leads to improper access controls. Upgrading to version 2.10.3 is able to address this issue. The name of the patch is cc12e0be82a5d05d9f359ed8e56088f4f8b8eb69. It is recommended to upgrade the affected component. The identifier of this vulnerability is VDB-244484.|November 05, 2023; 8:15:08 PM -0500|V3.1: 9.8 CRITICALV2.0:(not available)  (https://nvd.nist.gov/vuln-metrics/cvss/v3-calculator?name=CVE-2018-25093&vector=AV:N/AC:L/PR:N/UI:N/S:U/C:H/I:H/A:H&version=3.1&source=NIST)|https://nvd.nist.gov/vuln/detail/CVE-2018-25093
CVE-2018-25094|A vulnerability was found in ระบบบัญชีออนไลน์ Online Accounting System up to 1.4.0 and classified as problematic. This issue affects some unknown processing of the file ckeditor/filemanager/browser/default/image.php. The manipulation of the argument fid with the input ../../../etc/passwd leads to path traversal: '../filedir'. The exploit has been disclosed to the public and may be used. Upgrading to version 2.0.0 is able to address this issue. The identifier of the patch is 9d9618422b980335bb30be612ea90f4f56cb992c. It is recommended to upgrade the affected component. The identifier VDB-246641 was assigned to this vulnerability.|December 03, 2023; 6:15:07 AM -0500|V3.1: 7.5 HIGHV2.0:(not available)  (https://nvd.nist.gov/vuln-metrics/cvss/v3-calculator?name=CVE-2018-25094&vector=AV:N/AC:L/PR:N/UI:N/S:U/C:H/I:N/A:N&version=3.1&source=NIST)|https://nvd.nist.gov/vuln/detail/CVE-2018-25094
CVE-2018-25095|The Duplicator WordPress plugin before 1.3.0 does not properly escape values when its installer script replaces values in WordPress configuration files. If this installer script is left on the site after use, it could be use to run arbitrary code on the server.|January 08, 2024; 2:15:08 PM -0500|V3.1: 9.8 CRITICALV2.0:(not available)  (https://nvd.nist.gov/vuln-metrics/cvss/v3-calculator?name=CVE-2018-25095&vector=AV:N/AC:L/PR:N/UI:N/S:U/C:H/I:H/A:H&version=3.1&source=NIST)|https://nvd.nist.gov/vuln/detail/CVE-2018-25095
CVE-2018-25096|A vulnerability was found in MdAlAmin-aol Own Health Record 0.1-alpha/0.2-alpha/0.3-alpha/0.3.1-alpha. It has been rated as problematic. This issue affects some unknown processing of the file includes/logout.php. The manipulation leads to cross-site request forgery. The attack may be initiated remotely. Upgrading to version 0.4-alpha is able to address this issue. The patch is named 58b413aa40820b49070782c786c526850ab7748f. It is recommended to upgrade the affected component. The associated identifier of this vulnerability is VDB-249191.|December 30, 2023; 5:15:08 AM -0500|V3.1: 8.8 HIGHV2.0:(not available)  (https://nvd.nist.gov/vuln-metrics/cvss/v3-calculator?name=CVE-2018-25096&vector=AV:N/AC:L/PR:N/UI:R/S:U/C:H/I:H/A:H&version=3.1&source=NIST)|https://nvd.nist.gov/vuln/detail/CVE-2018-25096
CVE-2018-25097|A vulnerability, which was classified as problematic, was found in Acumos Design Studio up to 2.0.7. Affected is an unknown function. The manipulation leads to cross site scripting. It is possible to launch the attack remotely. Upgrading to version 2.0.8 is able to address this issue. The name of the patch is 0df8a5e8722188744973168648e4c74c69ce67fd. It is recommended to upgrade the affected component. The identifier of this vulnerability is VDB-249420.|January 02, 2024; 11:15:11 AM -0500|V3.1: 6.1 MEDIUMV2.0:(not available)  (https://nvd.nist.gov/vuln-metrics/cvss/v3-calculator?name=CVE-2018-25097&vector=AV:N/AC:L/PR:N/UI:R/S:C/C:L/I:L/A:N&version=3.1&source=NIST)|https://nvd.nist.gov/vuln/detail/CVE-2018-25097
CVE-2018-25098|** UNSUPPORTED WHEN ASSIGNED ** A vulnerability was found in blockmason credit-protocol. It has been declared as problematic. Affected by this vulnerability is the function executeUcacTx of the file contracts/CreditProtocol.sol of the component UCAC Handler. The manipulation leads to denial of service. This product does not use versioning. This is why information about affected and unaffected releases are unavailable. The patch is named 082e01f18707ef995e80ebe97fcedb229a55efc5. It is recommended to apply a patch to fix this issue. The associated identifier of this vulnerability is VDB-252799. NOTE: This vulnerability only affects products that are no longer supported by the maintainer.|February 04, 2024; 12:15:07 PM -0500|V3.1: 7.5 HIGHV2.0:(not available)  (https://nvd.nist.gov/vuln-metrics/cvss/v3-calculator?name=CVE-2018-25098&vector=AV:N/AC:L/PR:N/UI:N/S:U/C:N/I:N/A:H&version=3.1&source=NIST)|https://nvd.nist.gov/vuln/detail/CVE-2018-25098
CVE-2018-25099|In the CryptX module before 0.062 for Perl, gcm_decrypt_verify() and chacha20poly1305_decrypt_verify() do not verify the tag.|March 18, 2024; 1:15:06 AM -0400|V3.x:(not available) V2.0:(not available)  (None)|https://nvd.nist.gov/vuln/detail/CVE-2018-25099
CVE-2018-25100|The Mojolicious module before 7.66 for Perl may leak cookies in certain situations related to multiple similar cookies for the same domain. This affects Mojo::UserAgent::CookieJar.|March 23, 2024; 9:15:45 PM -0400|V3.x:(not available) V2.0:(not available)  (None)|https://nvd.nist.gov/vuln/detail/CVE-2018-25100
CVE-2018-5478|Contao 3.x before 3.5.32 allows XSS via the unsubscribe module in the frontend newsletter extension.|September 21, 2023; 2:15:12 AM -0400|V3.1: 6.1 MEDIUMV2.0:(not available)  (https://nvd.nist.gov/vuln-metrics/cvss/v3-calculator?name=CVE-2018-5478&vector=AV:N/AC:L/PR:N/UI:R/S:C/C:L/I:L/A:N&version=3.1&source=NIST)|https://nvd.nist.gov/vuln/detail/CVE-2018-5478
CVE-2018-7935|There is a vulnerability in 21.328.01.00.00 version of the E5573Cs-322. Remote attackers could exploit this vulnerability to make the network where the E5573Cs-322 is running temporarily unavailable.|February 10, 2023; 7:15:11 AM -0500|V3.1: 5.3 MEDIUMV2.0:(not available)  (https://nvd.nist.gov/vuln-metrics/cvss/v3-calculator?name=CVE-2018-7935&vector=AV:N/AC:L/PR:N/UI:N/S:U/C:N/I:N/A:L&version=3.1&source=NIST)|https://nvd.nist.gov/vuln/detail/CVE-2018-7935
CVE-2018-8863|The HTTP header in Philips EncoreAnywhere contains data an attacker may be able to use to gain sensitive information.|November 09, 2023; 6:15:08 PM -0500|V3.1: 7.5 HIGHV2.0:(not available)  (https://nvd.nist.gov/vuln-metrics/cvss/v3-calculator?name=CVE-2018-8863&vector=AV:N/AC:L/PR:N/UI:N/S:U/C:H/I:N/A:N&version=3.1&source=NIST)|https://nvd.nist.gov/vuln/detail/CVE-2018-8863
