Vuln ID|Summary|Published Date|CVSS Severity|Link
CVE-1999-0874|Buffer overflow in IIS 4.0 allows remote attackers to cause a denial of service via a malformed request for files with .HTR, .IDC, or .STM extensions.|June 16, 1999; 12:00:00 AM -0400|V3.x:(not available)       V2.0: 10.0 HIGH (https://nvd.nist.gov/vuln-metrics/cvss/v2-calculator?name=CVE-1999-0874&vector=(AV:N/AC:L/Au:N/C:C/I:C/A:C)&version=2.0&source=NIST)|https://nvd.nist.gov/vuln/detail/CVE-1999-0874
CVE-1999-0875|DHCP clients with ICMP Router Discovery Protocol (IRDP) enabled allow remote attackers to modify their default routes.|August 11, 1999; 12:00:00 AM -0400|V3.x:(not available)       V2.0: 7.5 HIGH (https://nvd.nist.gov/vuln-metrics/cvss/v2-calculator?name=CVE-1999-0875&vector=(AV:N/AC:L/Au:N/C:P/I:P/A:P)&version=2.0&source=NIST)|https://nvd.nist.gov/vuln/detail/CVE-1999-0875
CVE-1999-0876|Buffer overflow in Internet Explorer 4.0 via EMBED tag.|January 04, 2000; 12:00:00 AM -0500|V3.x:(not available)       V2.0: 10.0 HIGH (https://nvd.nist.gov/vuln-metrics/cvss/v2-calculator?name=CVE-1999-0876&vector=(AV:N/AC:L/Au:N/C:C/I:C/A:C)&version=2.0&source=NIST)|https://nvd.nist.gov/vuln/detail/CVE-1999-0876
CVE-1999-0877|Internet Explorer 5 allows remote attackers to read files via an ExecCommand method called on an IFRAME.|October 01, 1999; 12:00:00 AM -0400|V3.x:(not available)       V2.0: 4.3 MEDIUM (https://nvd.nist.gov/vuln-metrics/cvss/v2-calculator?name=CVE-1999-0877&vector=(AV:N/AC:M/Au:N/C:P/I:N/A:N)&version=2.0&source=NIST)|https://nvd.nist.gov/vuln/detail/CVE-1999-0877
CVE-1999-0878|Buffer overflow in WU-FTPD and related FTP servers allows remote attackers to gain root privileges via MAPPING_CHDIR.|August 22, 1999; 12:00:00 AM -0400|V3.x:(not available)       V2.0: 10.0 HIGH (https://nvd.nist.gov/vuln-metrics/cvss/v2-calculator?name=CVE-1999-0878&vector=(AV:N/AC:L/Au:N/C:C/I:C/A:C)&version=2.0&source=NIST)|https://nvd.nist.gov/vuln/detail/CVE-1999-0878
CVE-1999-0879|Buffer overflow in WU-FTPD and related FTP servers allows remote attackers to gain root privileges via macro variables in a message file.|October 01, 1999; 12:00:00 AM -0400|V3.x:(not available)       V2.0: 10.0 HIGH (https://nvd.nist.gov/vuln-metrics/cvss/v2-calculator?name=CVE-1999-0879&vector=(AV:N/AC:L/Au:N/C:C/I:C/A:C)&version=2.0&source=NIST)|https://nvd.nist.gov/vuln/detail/CVE-1999-0879
CVE-1999-0880|Denial of service in WU-FTPD via the SITE NEWER command, which does not free memory properly.|October 01, 1999; 12:00:00 AM -0400|V3.x:(not available)       V2.0: 5.0 MEDIUM (https://nvd.nist.gov/vuln-metrics/cvss/v2-calculator?name=CVE-1999-0880&vector=(AV:N/AC:L/Au:N/C:N/I:N/A:P)&version=2.0&source=NIST)|https://nvd.nist.gov/vuln/detail/CVE-1999-0880
CVE-1999-0881|Falcon web server allows remote attackers to read arbitrary files via a .. (dot dot) attack.|October 26, 1999; 12:00:00 AM -0400|V3.x:(not available)       V2.0: 5.0 MEDIUM (https://nvd.nist.gov/vuln-metrics/cvss/v2-calculator?name=CVE-1999-0881&vector=(AV:N/AC:L/Au:N/C:P/I:N/A:N)&version=2.0&source=NIST)|https://nvd.nist.gov/vuln/detail/CVE-1999-0881
CVE-1999-0882|Falcon web server allows remote attackers to determine the absolute path of the web root via long file names.|October 28, 1999; 12:00:00 AM -0400|V3.x:(not available)       V2.0: 5.0 MEDIUM (https://nvd.nist.gov/vuln-metrics/cvss/v2-calculator?name=CVE-1999-0882&vector=(AV:N/AC:L/Au:N/C:P/I:N/A:N)&version=2.0&source=NIST)|https://nvd.nist.gov/vuln/detail/CVE-1999-0882
CVE-1999-0883|Zeus web server allows remote attackers to read arbitrary files by specifying the file name in an option to the search engine.|October 25, 1999; 12:00:00 AM -0400|V3.x:(not available)       V2.0: 10.0 HIGH (https://nvd.nist.gov/vuln-metrics/cvss/v2-calculator?name=CVE-1999-0883&vector=(AV:N/AC:L/Au:N/C:C/I:C/A:C)&version=2.0&source=NIST)|https://nvd.nist.gov/vuln/detail/CVE-1999-0883
CVE-1999-0884|The Zeus web server administrative interface uses weak encryption for its passwords.|October 25, 1999; 12:00:00 AM -0400|V3.x:(not available)       V2.0: 5.0 MEDIUM (https://nvd.nist.gov/vuln-metrics/cvss/v2-calculator?name=CVE-1999-0884&vector=(AV:N/AC:L/Au:N/C:P/I:N/A:N)&version=2.0&source=NIST)|https://nvd.nist.gov/vuln/detail/CVE-1999-0884
CVE-1999-0885|Alibaba web server allows remote attackers to execute commands via a pipe character in a malformed URL.|November 03, 1999; 12:00:00 AM -0500|V3.x:(not available)       V2.0: 3.6 LOW (https://nvd.nist.gov/vuln-metrics/cvss/v2-calculator?name=CVE-1999-0885&vector=(AV:L/AC:L/Au:N/C:P/I:P/A:N)&version=2.0&source=NIST)|https://nvd.nist.gov/vuln/detail/CVE-1999-0885
CVE-1999-0886|The security descriptor for RASMAN allows users to point to an alternate location via the Windows NT Service Control Manager.|September 17, 1999; 12:00:00 AM -0400|V3.x:(not available)       V2.0: 9.0 HIGH (https://nvd.nist.gov/vuln-metrics/cvss/v2-calculator?name=CVE-1999-0886&vector=(AV:N/AC:L/Au:S/C:C/I:C/A:C)&version=2.0&source=NIST)|https://nvd.nist.gov/vuln/detail/CVE-1999-0886
CVE-1999-0887|FTGate web interface server allows remote attackers to read files via a .. (dot dot) attack.|November 04, 1999; 12:00:00 AM -0500|V3.x:(not available)       V2.0: 5.0 MEDIUM (https://nvd.nist.gov/vuln-metrics/cvss/v2-calculator?name=CVE-1999-0887&vector=(AV:N/AC:L/Au:N/C:P/I:N/A:N)&version=2.0&source=NIST)|https://nvd.nist.gov/vuln/detail/CVE-1999-0887
CVE-1999-0888|dbsnmp in Oracle Intelligent Agent allows local users to gain privileges by setting the ORACLE_HOME environmental variable, which dbsnmp uses to find the nmiconf.tcl script.|August 16, 1999; 12:00:00 AM -0400|V3.x:(not available)       V2.0: 4.6 MEDIUM (https://nvd.nist.gov/vuln-metrics/cvss/v2-calculator?name=CVE-1999-0888&vector=(AV:L/AC:L/Au:N/C:P/I:P/A:P)&version=2.0&source=NIST)|https://nvd.nist.gov/vuln/detail/CVE-1999-0888
CVE-1999-0889|Cisco 675 routers running CBOS allow remote attackers to establish telnet sessions if an exec or superuser password has not been set.|July 01, 1999; 12:00:00 AM -0400|V3.x:(not available)       V2.0: 7.5 HIGH (https://nvd.nist.gov/vuln-metrics/cvss/v2-calculator?name=CVE-1999-0889&vector=(AV:N/AC:L/Au:N/C:P/I:P/A:P)&version=2.0&source=NIST)|https://nvd.nist.gov/vuln/detail/CVE-1999-0889
CVE-1999-0890|iHTML Merchant allows remote attackers to obtain sensitive information or execute commands via a code parsing error.|September 16, 1999; 12:00:00 AM -0400|V3.x:(not available)       V2.0: 7.5 HIGH (https://nvd.nist.gov/vuln-metrics/cvss/v2-calculator?name=CVE-1999-0890&vector=(AV:N/AC:L/Au:N/C:P/I:P/A:P)&version=2.0&source=NIST)|https://nvd.nist.gov/vuln/detail/CVE-1999-0890
CVE-1999-0891|"The ""download behavior"" in Internet Explorer 5 allows remote attackers to read arbitrary files via a server-side redirect."|September 01, 1999; 12:00:00 AM -0400|V3.x:(not available)       V2.0: 5.0 MEDIUM (https://nvd.nist.gov/vuln-metrics/cvss/v2-calculator?name=CVE-1999-0891&vector=(AV:N/AC:L/Au:N/C:P/I:N/A:N)&version=2.0&source=NIST)|https://nvd.nist.gov/vuln/detail/CVE-1999-0891
CVE-1999-0892|Buffer overflow in Netscape Communicator before 4.7 via a dynamic font whose length field is less than the size of the font.|December 24, 1999; 12:00:00 AM -0500|V3.x:(not available)       V2.0: 4.6 MEDIUM (https://nvd.nist.gov/vuln-metrics/cvss/v2-calculator?name=CVE-1999-0892&vector=(AV:L/AC:L/Au:N/C:P/I:P/A:P)&version=2.0&source=NIST)|https://nvd.nist.gov/vuln/detail/CVE-1999-0892
CVE-1999-0893|userOsa in SCO OpenServer allows local users to corrupt files via a symlink attack.|October 11, 1999; 12:00:00 AM -0400|V3.x:(not available)       V2.0: 2.1 LOW (https://nvd.nist.gov/vuln-metrics/cvss/v2-calculator?name=CVE-1999-0893&vector=(AV:L/AC:L/Au:N/C:N/I:P/A:N)&version=2.0&source=NIST)|https://nvd.nist.gov/vuln/detail/CVE-1999-0893
CVE-1999-0894|Red Hat Linux screen program does not use Unix98 ptys, allowing local users to write to other terminals.|January 04, 2000; 12:00:00 AM -0500|V3.x:(not available)       V2.0: 10.0 HIGH (https://nvd.nist.gov/vuln-metrics/cvss/v2-calculator?name=CVE-1999-0894&vector=(AV:N/AC:L/Au:N/C:C/I:C/A:C)&version=2.0&source=NIST)|https://nvd.nist.gov/vuln/detail/CVE-1999-0894
CVE-1999-0895|Firewall-1 does not properly restrict access to LDAP attributes.|October 20, 1999; 12:00:00 AM -0400|V3.x:(not available)       V2.0: 7.5 HIGH (https://nvd.nist.gov/vuln-metrics/cvss/v2-calculator?name=CVE-1999-0895&vector=(AV:N/AC:L/Au:N/C:P/I:P/A:P)&version=2.0&source=NIST)|https://nvd.nist.gov/vuln/detail/CVE-1999-0895
CVE-1999-0896|Buffer overflow in RealNetworks RealServer administration utility allows remote attackers to execute arbitrary commands via a long username and password.|November 04, 1999; 12:00:00 AM -0500|V3.x:(not available)       V2.0: 10.0 HIGH (https://nvd.nist.gov/vuln-metrics/cvss/v2-calculator?name=CVE-1999-0896&vector=(AV:N/AC:L/Au:N/C:C/I:C/A:C)&version=2.0&source=NIST)|https://nvd.nist.gov/vuln/detail/CVE-1999-0896
CVE-1999-0897|iChat ROOMS Webserver allows remote attackers to read arbitrary files via a .. (dot dot) attack.|September 09, 1998; 12:00:00 AM -0400|V3.x:(not available)       V2.0: 5.0 MEDIUM (https://nvd.nist.gov/vuln-metrics/cvss/v2-calculator?name=CVE-1999-0897&vector=(AV:N/AC:L/Au:N/C:P/I:N/A:N)&version=2.0&source=NIST)|https://nvd.nist.gov/vuln/detail/CVE-1999-0897
CVE-1999-0898|Buffer overflows in Windows NT 4.0 print spooler allow remote attackers to gain privileges or cause a denial of service via a malformed spooler request.|November 04, 1999; 12:00:00 AM -0500|V3.x:(not available)       V2.0: 7.2 HIGH (https://nvd.nist.gov/vuln-metrics/cvss/v2-calculator?name=CVE-1999-0898&vector=(AV:L/AC:L/Au:N/C:C/I:C/A:C)&version=2.0&source=NIST)|https://nvd.nist.gov/vuln/detail/CVE-1999-0898
CVE-1999-0899|The Windows NT 4.0 print spooler allows a local user to execute arbitrary commands due to inappropriate permissions that allow the user to specify an alternate print provider.|November 04, 1999; 12:00:00 AM -0500|V3.x:(not available)       V2.0: 7.2 HIGH (https://nvd.nist.gov/vuln-metrics/cvss/v2-calculator?name=CVE-1999-0899&vector=(AV:L/AC:L/Au:N/C:C/I:C/A:C)&version=2.0&source=NIST)|https://nvd.nist.gov/vuln/detail/CVE-1999-0899
CVE-1999-0900|Buffer overflow in rpc.yppasswdd allows a local user to gain privileges via MD5 hash generation.|October 23, 1999; 12:00:00 AM -0400|V3.x:(not available)       V2.0: 7.2 HIGH (https://nvd.nist.gov/vuln-metrics/cvss/v2-calculator?name=CVE-1999-0900&vector=(AV:L/AC:L/Au:N/C:C/I:C/A:C)&version=2.0&source=NIST)|https://nvd.nist.gov/vuln/detail/CVE-1999-0900
CVE-1999-0901|ypserv allows a local user to modify the GECOS and login shells of other users.|October 23, 1999; 12:00:00 AM -0400|V3.x:(not available)       V2.0: 7.2 HIGH (https://nvd.nist.gov/vuln-metrics/cvss/v2-calculator?name=CVE-1999-0901&vector=(AV:L/AC:L/Au:N/C:C/I:C/A:C)&version=2.0&source=NIST)|https://nvd.nist.gov/vuln/detail/CVE-1999-0901
CVE-1999-0902|ypserv allows local administrators to modify password tables.|October 23, 1999; 12:00:00 AM -0400|V3.x:(not available)       V2.0: 7.2 HIGH (https://nvd.nist.gov/vuln-metrics/cvss/v2-calculator?name=CVE-1999-0902&vector=(AV:L/AC:L/Au:N/C:C/I:C/A:C)&version=2.0&source=NIST)|https://nvd.nist.gov/vuln/detail/CVE-1999-0902
CVE-1999-0903|genfilt in the AIX Packet Filtering Module does not properly filter traffic to destination ports greater than 32767.|October 26, 1999; 12:00:00 AM -0400|V3.x:(not available)       V2.0: 7.5 HIGH (https://nvd.nist.gov/vuln-metrics/cvss/v2-calculator?name=CVE-1999-0903&vector=(AV:N/AC:L/Au:N/C:P/I:P/A:P)&version=2.0&source=NIST)|https://nvd.nist.gov/vuln/detail/CVE-1999-0903
CVE-1999-0904|Buffer overflow in BFTelnet allows remote attackers to cause a denial of service via a long username.|November 03, 1999; 12:00:00 AM -0500|V3.x:(not available)       V2.0: 5.0 MEDIUM (https://nvd.nist.gov/vuln-metrics/cvss/v2-calculator?name=CVE-1999-0904&vector=(AV:N/AC:L/Au:N/C:N/I:N/A:P)&version=2.0&source=NIST)|https://nvd.nist.gov/vuln/detail/CVE-1999-0904
CVE-1999-0905|Denial of service in Axent Raptor firewall via malformed zero-length IP options.|October 21, 1999; 12:00:00 AM -0400|V3.x:(not available)       V2.0: 5.0 MEDIUM (https://nvd.nist.gov/vuln-metrics/cvss/v2-calculator?name=CVE-1999-0905&vector=(AV:N/AC:L/Au:N/C:N/I:N/A:P)&version=2.0&source=NIST)|https://nvd.nist.gov/vuln/detail/CVE-1999-0905
CVE-1999-0906|Buffer overflow in sccw allows local users to gain root access via the HOME environmental variable.|September 23, 1999; 12:00:00 AM -0400|V3.x:(not available)       V2.0: 7.2 HIGH (https://nvd.nist.gov/vuln-metrics/cvss/v2-calculator?name=CVE-1999-0906&vector=(AV:L/AC:L/Au:N/C:C/I:C/A:C)&version=2.0&source=NIST)|https://nvd.nist.gov/vuln/detail/CVE-1999-0906
CVE-1999-0907|sccw allows local users to read arbitrary files.|September 16, 1999; 12:00:00 AM -0400|V3.x:(not available)       V2.0: 2.1 LOW (https://nvd.nist.gov/vuln-metrics/cvss/v2-calculator?name=CVE-1999-0907&vector=(AV:L/AC:L/Au:N/C:P/I:N/A:N)&version=2.0&source=NIST)|https://nvd.nist.gov/vuln/detail/CVE-1999-0907
CVE-1999-0908|Denial of service in Solaris TCP streams driver via a malicious connection that causes the server to panic as a result of recursive calls to mutex_enter.|September 23, 1999; 12:00:00 AM -0400|V3.x:(not available)       V2.0: 5.0 MEDIUM (https://nvd.nist.gov/vuln-metrics/cvss/v2-calculator?name=CVE-1999-0908&vector=(AV:N/AC:L/Au:N/C:N/I:N/A:P)&version=2.0&source=NIST)|https://nvd.nist.gov/vuln/detail/CVE-1999-0908
CVE-1999-0909|"Multihomed Windows systems allow a remote attacker to bypass IP source routing restrictions via a malformed packet with IP options, aka the ""Spoofed Route Pointer"" vulnerability."|September 20, 1999; 12:00:00 AM -0400|V3.x:(not available)       V2.0: 7.5 HIGH (https://nvd.nist.gov/vuln-metrics/cvss/v2-calculator?name=CVE-1999-0909&vector=(AV:N/AC:L/Au:N/C:P/I:P/A:P)&version=2.0&source=NIST)|https://nvd.nist.gov/vuln/detail/CVE-1999-0909
CVE-1999-0910|Microsoft Site Server and Commercial Internet System (MCIS) do not set an expiration for a cookie, which could then be cached by a proxy and inadvertently used by a different user.|September 10, 1999; 12:00:00 AM -0400|V3.x:(not available)       V2.0: 5.0 MEDIUM (https://nvd.nist.gov/vuln-metrics/cvss/v2-calculator?name=CVE-1999-0910&vector=(AV:N/AC:L/Au:N/C:P/I:N/A:N)&version=2.0&source=NIST)|https://nvd.nist.gov/vuln/detail/CVE-1999-0910
CVE-1999-0911|Buffer overflow in ProFTPD, wu-ftpd, and beroftpd allows remote attackers to gain root access via a series of MKD and CWD commands that create nested directories.|August 27, 1999; 12:00:00 AM -0400|V3.x:(not available)       V2.0: 10.0 HIGH (https://nvd.nist.gov/vuln-metrics/cvss/v2-calculator?name=CVE-1999-0911&vector=(AV:N/AC:L/Au:N/C:C/I:C/A:C)&version=2.0&source=NIST)|https://nvd.nist.gov/vuln/detail/CVE-1999-0911
CVE-1999-0912|FreeBSD VFS cache (vfs_cache) allows local users to cause a denial of service by opening a large number of files.|September 22, 1999; 12:00:00 AM -0400|V3.x:(not available)       V2.0: 2.1 LOW (https://nvd.nist.gov/vuln-metrics/cvss/v2-calculator?name=CVE-1999-0912&vector=(AV:L/AC:L/Au:N/C:N/I:N/A:P)&version=2.0&source=NIST)|https://nvd.nist.gov/vuln/detail/CVE-1999-0912
CVE-1999-0913|dfire.cgi script in Dragon-Fire IDS allows remote users to execute commands via shell metacharacters.|August 05, 1999; 12:00:00 AM -0400|V3.x:(not available)       V2.0: 10.0 HIGH (https://nvd.nist.gov/vuln-metrics/cvss/v2-calculator?name=CVE-1999-0913&vector=(AV:N/AC:L/Au:N/C:C/I:C/A:C)&version=2.0&source=NIST)|https://nvd.nist.gov/vuln/detail/CVE-1999-0913
CVE-1999-0914|Buffer overflow in the FTP client in the Debian GNU/Linux netstd package.|January 03, 1999; 12:00:00 AM -0500|V3.x:(not available)       V2.0: 7.2 HIGH (https://nvd.nist.gov/vuln-metrics/cvss/v2-calculator?name=CVE-1999-0914&vector=(AV:L/AC:L/Au:N/C:C/I:C/A:C)&version=2.0&source=NIST)|https://nvd.nist.gov/vuln/detail/CVE-1999-0914
CVE-1999-0915|URL Live! web server allows remote attackers to read arbitrary files via a .. (dot dot) attack.|October 28, 1999; 12:00:00 AM -0400|V3.x:(not available)       V2.0: 5.0 MEDIUM (https://nvd.nist.gov/vuln-metrics/cvss/v2-calculator?name=CVE-1999-0915&vector=(AV:N/AC:L/Au:N/C:P/I:N/A:N)&version=2.0&source=NIST)|https://nvd.nist.gov/vuln/detail/CVE-1999-0915
CVE-1999-0916|WebTrends software stores account names and passwords in a file which does not have restricted access permissions.|June 29, 1999; 12:00:00 AM -0400|V3.x:(not available)       V2.0: 2.1 LOW (https://nvd.nist.gov/vuln-metrics/cvss/v2-calculator?name=CVE-1999-0916&vector=(AV:L/AC:L/Au:N/C:P/I:N/A:N)&version=2.0&source=NIST)|https://nvd.nist.gov/vuln/detail/CVE-1999-0916
CVE-1999-0917|The Preloader ActiveX control used by Internet Explorer allows remote attackers to read arbitrary files.|May 27, 1999; 12:00:00 AM -0400|V3.x:(not available)       V2.0: 5.1 MEDIUM (https://nvd.nist.gov/vuln-metrics/cvss/v2-calculator?name=CVE-1999-0917&vector=(AV:N/AC:H/Au:N/C:P/I:P/A:P)&version=2.0&source=NIST)|https://nvd.nist.gov/vuln/detail/CVE-1999-0917
CVE-1999-0918|Denial of service in various Windows systems via malformed, fragmented IGMP packets.|July 03, 1999; 12:00:00 AM -0400|V3.x:(not available)       V2.0: 7.8 HIGH (https://nvd.nist.gov/vuln-metrics/cvss/v2-calculator?name=CVE-1999-0918&vector=(AV:N/AC:L/Au:N/C:N/I:N/A:C)&version=2.0&source=NIST)|https://nvd.nist.gov/vuln/detail/CVE-1999-0918
CVE-1999-0919|A memory leak in a Motorola CableRouter allows remote attackers to conduct a denial of service via a large number of telnet connections.|May 10, 1998; 12:00:00 AM -0400|V3.x:(not available)       V2.0: 10.0 HIGH (https://nvd.nist.gov/vuln-metrics/cvss/v2-calculator?name=CVE-1999-0919&vector=(AV:N/AC:L/Au:N/C:C/I:C/A:C)&version=2.0&source=NIST)|https://nvd.nist.gov/vuln/detail/CVE-1999-0919
CVE-1999-0920|Buffer overflow in the pop-2d POP daemon in the IMAP package allows remote attackers to gain privileges via the FOLD command.|May 26, 1999; 12:00:00 AM -0400|V3.x:(not available)       V2.0: 10.0 HIGH (https://nvd.nist.gov/vuln-metrics/cvss/v2-calculator?name=CVE-1999-0920&vector=(AV:N/AC:L/Au:N/C:C/I:C/A:C)&version=2.0&source=NIST)|https://nvd.nist.gov/vuln/detail/CVE-1999-0920
CVE-1999-0921|BMC Patrol allows any remote attacker to flood its UDP port, causing a denial of service.|April 01, 1999; 12:00:00 AM -0500|V3.x:(not available)       V2.0: 5.0 MEDIUM (https://nvd.nist.gov/vuln-metrics/cvss/v2-calculator?name=CVE-1999-0921&vector=(AV:N/AC:L/Au:N/C:N/I:N/A:P)&version=2.0&source=NIST)|https://nvd.nist.gov/vuln/detail/CVE-1999-0921
CVE-1999-0922|An example application in ColdFusion Server 4.0 allows remote attackers to view source code via the sourcewindow.cfm file.|March 12, 2001; 12:00:00 AM -0500|V3.x:(not available)       V2.0: 5.0 MEDIUM (https://nvd.nist.gov/vuln-metrics/cvss/v2-calculator?name=CVE-1999-0922&vector=(AV:N/AC:L/Au:N/C:P/I:N/A:N)&version=2.0&source=NIST)|https://nvd.nist.gov/vuln/detail/CVE-1999-0922
CVE-1999-0923|Sample runnable code snippets in ColdFusion Server 4.0 allow remote attackers to read files, conduct a denial of service, or use the server as a proxy for other HTTP calls.|March 12, 2001; 12:00:00 AM -0500|V3.x:(not available)       V2.0: 7.5 HIGH (https://nvd.nist.gov/vuln-metrics/cvss/v2-calculator?name=CVE-1999-0923&vector=(AV:N/AC:L/Au:N/C:P/I:P/A:P)&version=2.0&source=NIST)|https://nvd.nist.gov/vuln/detail/CVE-1999-0923
CVE-1999-0924|The Syntax Checker in ColdFusion Server 4.0 allows remote attackers to conduct a denial of service.|March 12, 2001; 12:00:00 AM -0500|V3.x:(not available)       V2.0: 5.0 MEDIUM (https://nvd.nist.gov/vuln-metrics/cvss/v2-calculator?name=CVE-1999-0924&vector=(AV:N/AC:L/Au:N/C:N/I:N/A:P)&version=2.0&source=NIST)|https://nvd.nist.gov/vuln/detail/CVE-1999-0924
CVE-1999-0925|UnityMail allows remote attackers to conduct a denial of service via a large number of MIME headers.|September 03, 1999; 12:00:00 AM -0400|V3.x:(not available)       V2.0: 5.0 MEDIUM (https://nvd.nist.gov/vuln-metrics/cvss/v2-calculator?name=CVE-1999-0925&vector=(AV:N/AC:L/Au:N/C:N/I:N/A:P)&version=2.0&source=NIST)|https://nvd.nist.gov/vuln/detail/CVE-1999-0925
CVE-1999-0926|Apache allows remote attackers to conduct a denial of service via a large number of MIME headers.|September 03, 1999; 12:00:00 AM -0400|V3.x:(not available)       V2.0: 10.0 HIGH (https://nvd.nist.gov/vuln-metrics/cvss/v2-calculator?name=CVE-1999-0926&vector=(AV:N/AC:L/Au:N/C:C/I:C/A:C)&version=2.0&source=NIST)|https://nvd.nist.gov/vuln/detail/CVE-1999-0926
CVE-1999-0927|NTMail allows remote attackers to read arbitrary files via a .. (dot dot) attack.|May 26, 1999; 12:00:00 AM -0400|V3.x:(not available)       V2.0: 5.0 MEDIUM (https://nvd.nist.gov/vuln-metrics/cvss/v2-calculator?name=CVE-1999-0927&vector=(AV:N/AC:L/Au:N/C:P/I:N/A:N)&version=2.0&source=NIST)|https://nvd.nist.gov/vuln/detail/CVE-1999-0927
CVE-1999-0928|Buffer overflow in SmartDesk WebSuite allows remote attackers to cause a denial of service via a long URL.|May 23, 1999; 12:00:00 AM -0400|V3.x:(not available)       V2.0: 5.0 MEDIUM (https://nvd.nist.gov/vuln-metrics/cvss/v2-calculator?name=CVE-1999-0928&vector=(AV:N/AC:L/Au:N/C:N/I:N/A:P)&version=2.0&source=NIST)|https://nvd.nist.gov/vuln/detail/CVE-1999-0928
CVE-1999-0929|Novell NetWare with Novell-HTTP-Server or YAWN web servers allows remote attackers to conduct a denial of service via a large number of HTTP GET requests.|June 16, 1999; 12:00:00 AM -0400|V3.x:(not available)       V2.0: 5.0 MEDIUM (https://nvd.nist.gov/vuln-metrics/cvss/v2-calculator?name=CVE-1999-0929&vector=(AV:N/AC:L/Au:N/C:N/I:N/A:P)&version=2.0&source=NIST)|https://nvd.nist.gov/vuln/detail/CVE-1999-0929
CVE-1999-0930|wwwboard allows a remote attacker to delete message board articles via a malformed argument.|September 03, 1998; 12:00:00 AM -0400|V3.x:(not available)       V2.0: 5.0 MEDIUM (https://nvd.nist.gov/vuln-metrics/cvss/v2-calculator?name=CVE-1999-0930&vector=(AV:N/AC:L/Au:N/C:N/I:P/A:N)&version=2.0&source=NIST)|https://nvd.nist.gov/vuln/detail/CVE-1999-0930
CVE-1999-0931|Buffer overflow in Mediahouse Statistics Server allows remote attackers to execute commands.|September 30, 1999; 12:00:00 AM -0400|V3.x:(not available)       V2.0: 5.0 MEDIUM (https://nvd.nist.gov/vuln-metrics/cvss/v2-calculator?name=CVE-1999-0931&vector=(AV:N/AC:L/Au:N/C:N/I:P/A:N)&version=2.0&source=NIST)|https://nvd.nist.gov/vuln/detail/CVE-1999-0931
CVE-1999-0932|Mediahouse Statistics Server allows remote attackers to read the administrator password, which is stored in cleartext in the ss.cfg file.|September 30, 1999; 12:00:00 AM -0400|V3.x:(not available)       V2.0: 7.2 HIGH (https://nvd.nist.gov/vuln-metrics/cvss/v2-calculator?name=CVE-1999-0932&vector=(AV:L/AC:L/Au:N/C:C/I:C/A:C)&version=2.0&source=NIST)|https://nvd.nist.gov/vuln/detail/CVE-1999-0932
CVE-1999-0933|TeamTrack web server allows remote attackers to read arbitrary files via a .. (dot dot) attack.|October 01, 1999; 12:00:00 AM -0400|V3.x:(not available)       V2.0: 5.0 MEDIUM (https://nvd.nist.gov/vuln-metrics/cvss/v2-calculator?name=CVE-1999-0933&vector=(AV:N/AC:L/Au:N/C:P/I:N/A:N)&version=2.0&source=NIST)|https://nvd.nist.gov/vuln/detail/CVE-1999-0933
CVE-1999-0934|classifieds.cgi allows remote attackers to read arbitrary files via shell metacharacters.|December 15, 1999; 12:00:00 AM -0500|V3.x:(not available)       V2.0: 5.0 MEDIUM (https://nvd.nist.gov/vuln-metrics/cvss/v2-calculator?name=CVE-1999-0934&vector=(AV:N/AC:L/Au:N/C:P/I:N/A:N)&version=2.0&source=NIST)|https://nvd.nist.gov/vuln/detail/CVE-1999-0934
CVE-1999-0935|classifieds.cgi allows remote attackers to execute arbitrary commands by specifying them in a hidden variable in a CGI form.|December 15, 1999; 12:00:00 AM -0500|V3.x:(not available)       V2.0: 10.0 HIGH (https://nvd.nist.gov/vuln-metrics/cvss/v2-calculator?name=CVE-1999-0935&vector=(AV:N/AC:L/Au:N/C:C/I:C/A:C)&version=2.0&source=NIST)|https://nvd.nist.gov/vuln/detail/CVE-1999-0935
CVE-1999-0936|BNBSurvey survey.cgi program allows remote attackers to execute commands via shell metacharacters.|December 03, 1998; 12:00:00 AM -0500|V3.x:(not available)       V2.0: 10.0 HIGH (https://nvd.nist.gov/vuln-metrics/cvss/v2-calculator?name=CVE-1999-0936&vector=(AV:N/AC:L/Au:N/C:C/I:C/A:C)&version=2.0&source=NIST)|https://nvd.nist.gov/vuln/detail/CVE-1999-0936
CVE-1999-0937|BNBForm allows remote attackers to read arbitrary files via the automessage hidden form variable.|December 03, 1998; 12:00:00 AM -0500|V3.x:(not available)       V2.0: 10.0 HIGH (https://nvd.nist.gov/vuln-metrics/cvss/v2-calculator?name=CVE-1999-0937&vector=(AV:N/AC:L/Au:N/C:C/I:C/A:C)&version=2.0&source=NIST)|https://nvd.nist.gov/vuln/detail/CVE-1999-0937
CVE-1999-0938|MBone SDR Package allows remote attackers to execute commands via shell metacharacters in Session Initiation Protocol (SIP) messages.|June 28, 1999; 12:00:00 AM -0400|V3.x:(not available)       V2.0: 7.5 HIGH (https://nvd.nist.gov/vuln-metrics/cvss/v2-calculator?name=CVE-1999-0938&vector=(AV:N/AC:L/Au:N/C:P/I:P/A:P)&version=2.0&source=NIST)|https://nvd.nist.gov/vuln/detail/CVE-1999-0938
CVE-1999-0939|Denial of service in Debian IRC Epic/epic4 client via a long string.|August 26, 1999; 12:00:00 AM -0400|V3.x:(not available)       V2.0: 5.0 MEDIUM (https://nvd.nist.gov/vuln-metrics/cvss/v2-calculator?name=CVE-1999-0939&vector=(AV:N/AC:L/Au:N/C:N/I:N/A:P)&version=2.0&source=NIST)|https://nvd.nist.gov/vuln/detail/CVE-1999-0939
CVE-1999-0940|Buffer overflow in mutt mail client allows remote attackers to execute commands via malformed MIME messages.|September 27, 1999; 12:00:00 AM -0400|V3.x:(not available)       V2.0: 7.5 HIGH (https://nvd.nist.gov/vuln-metrics/cvss/v2-calculator?name=CVE-1999-0940&vector=(AV:N/AC:L/Au:N/C:P/I:P/A:P)&version=2.0&source=NIST)|https://nvd.nist.gov/vuln/detail/CVE-1999-0940
