Vuln ID|Summary|Published Date|CVSS Severity|Link
CVE-2013-3489|Buffer overflow in Media Player Classic - Home Cinema (MPC-HC) before 1.7.0 allows remote attackers to execute arbitrary code via a crafted RealMedia .rm file|January 31, 2020; 1:15:11 PM -0500|V3.1: 7.8 HIGH      V2.0: 6.8 MEDIUM (https://nvd.nist.gov/vuln-metrics/cvss/v3-calculator?name=CVE-2013-3489&vector=AV:L/AC:L/PR:N/UI:R/S:U/C:H/I:H/A:H&version=3.1&source=NIST)|https://nvd.nist.gov/vuln/detail/CVE-2013-3489
CVE-2013-3492|XnView 2.03 has a stack-based buffer overflow vulnerability|January 27, 2020; 10:15:11 AM -0500|V3.1: 9.8 CRITICAL      V2.0: 7.5 HIGH (https://nvd.nist.gov/vuln-metrics/cvss/v3-calculator?name=CVE-2013-3492&vector=AV:N/AC:L/PR:N/UI:N/S:U/C:H/I:H/A:H&version=3.1&source=NIST)|https://nvd.nist.gov/vuln/detail/CVE-2013-3492
CVE-2013-3493|XnView 2.03 has an integer overflow vulnerability|January 27, 2020; 10:15:11 AM -0500|V3.1: 9.8 CRITICAL      V2.0: 7.5 HIGH (https://nvd.nist.gov/vuln-metrics/cvss/v3-calculator?name=CVE-2013-3493&vector=AV:N/AC:L/PR:N/UI:N/S:U/C:H/I:H/A:H&version=3.1&source=NIST)|https://nvd.nist.gov/vuln/detail/CVE-2013-3493
CVE-2013-3494|A Code Execution Vulnerability exists in UMPlayer 0.98 in wintab32.dll due to insufficient path restrictions when loading external libraries. which could let a malicious user execute arbitrary code.|February 12, 2020; 11:15:10 AM -0500|V3.1: 7.8 HIGH      V2.0: 9.3 HIGH (https://nvd.nist.gov/vuln-metrics/cvss/v3-calculator?name=CVE-2013-3494&vector=AV:L/AC:L/PR:N/UI:R/S:U/C:H/I:H/A:H&version=3.1&source=NIST)|https://nvd.nist.gov/vuln/detail/CVE-2013-3494
CVE-2013-3516|NETGEAR WNR3500U and WNR3500L routers uses form tokens abased solely on router's current date and time, which allows attackers to guess the CSRF tokens.|November 13, 2019; 3:15:10 PM -0500|V3.1: 6.5 MEDIUM      V2.0: 4.3 MEDIUM (https://nvd.nist.gov/vuln-metrics/cvss/v3-calculator?name=CVE-2013-3516&vector=AV:N/AC:L/PR:N/UI:R/S:U/C:H/I:N/A:N&version=3.1&source=NIST)|https://nvd.nist.gov/vuln/detail/CVE-2013-3516
CVE-2013-3517|Cross-site scripting (XSS) vulnerability in NETGEAR WNR3500U and WNR3500L.|November 13, 2019; 2:15:11 PM -0500|V3.1: 5.4 MEDIUM      V2.0: 3.5 LOW (https://nvd.nist.gov/vuln-metrics/cvss/v3-calculator?name=CVE-2013-3517&vector=AV:N/AC:L/PR:L/UI:R/S:C/C:L/I:L/A:N&version=3.1&source=NIST)|https://nvd.nist.gov/vuln/detail/CVE-2013-3517
CVE-2013-3542|"Grandstream GXV3501, GXV3504, GXV3601, GXV3601HD/LL, GXV3611HD/LL, GXV3615W/P, GXV3651FHD, GXV3662HD, GXV3615WP_HD, GXV3500, and possibly other camera models with firmware 1.0.4.11, have a hardcoded account ""!#/"" with the same password, which makes it easier for remote attackers to obtain access via a TELNET session."|December 11, 2019; 2:15:11 PM -0500|V3.1: 10.0 CRITICAL      V2.0: 10.0 HIGH (https://nvd.nist.gov/vuln-metrics/cvss/v3-calculator?name=CVE-2013-3542&vector=AV:N/AC:L/PR:N/UI:N/S:C/C:H/I:H/A:H&version=3.1&source=NIST)|https://nvd.nist.gov/vuln/detail/CVE-2013-3542
CVE-2013-3551|Kernel/Modules/AgentTicketPhone.pm in Open Ticket Request System (OTRS) 3.0.x before 3.0.20, 3.1.x before 3.1.16, and 3.2.x before 3.2.7, and OTRS ITSM 3.0.x before 3.0.8, 3.1.x before 3.1.9, and 3.2.x before 3.2.5 does not properly restrict tickets, which allows remote attackers with a valid agent login to read restricted tickets via a crafted URL involving the ticket split mechanism.|February 21, 2020; 11:15:11 AM -0500|V3.1: 6.5 MEDIUM      V2.0: 4.0 MEDIUM (https://nvd.nist.gov/vuln-metrics/cvss/v3-calculator?name=CVE-2013-3551&vector=AV:N/AC:L/PR:L/UI:N/S:U/C:H/I:N/A:N&version=3.1&source=NIST)|https://nvd.nist.gov/vuln/detail/CVE-2013-3551
CVE-2013-3552|Nitro Pro 7.5.0.29 and earlier and Nitro Reader 2.5.0.45 and earlier allow remote attackers to execute arbitrary code via a crafted PDF file.|February 08, 2018; 6:29:00 PM -0500|V3.0: 7.8 HIGH      V2.0: 9.3 HIGH (https://nvd.nist.gov/vuln-metrics/cvss/v3-calculator?name=CVE-2013-3552&vector=AV:L/AC:L/PR:N/UI:R/S:U/C:H/I:H/A:H&version=3.0&source=NIST)|https://nvd.nist.gov/vuln/detail/CVE-2013-3552
CVE-2013-3553|Nitro Pro 7.5.0.22 and earlier and Nitro Reader 2.5.0.36 and earlier allow remote attackers to execute arbitrary code via a crafted PDF file.|February 08, 2018; 6:29:00 PM -0500|V3.0: 7.8 HIGH      V2.0: 9.3 HIGH (https://nvd.nist.gov/vuln-metrics/cvss/v3-calculator?name=CVE-2013-3553&vector=AV:L/AC:L/PR:N/UI:R/S:U/C:H/I:H/A:H&version=3.0&source=NIST)|https://nvd.nist.gov/vuln/detail/CVE-2013-3553
CVE-2013-3564|The web interface in VideoLAN VLC media player before 2.0.7 has no access control which allows remote attackers to view directory listings via the 'dir' command or issue other commands without authenticating.|February 06, 2020; 5:15:10 PM -0500|V3.1: 5.3 MEDIUM      V2.0: 5.0 MEDIUM (https://nvd.nist.gov/vuln-metrics/cvss/v3-calculator?name=CVE-2013-3564&vector=AV:N/AC:L/PR:N/UI:N/S:U/C:L/I:N/A:N&version=3.1&source=NIST)|https://nvd.nist.gov/vuln/detail/CVE-2013-3564
CVE-2013-3565|Multiple cross-site scripting (XSS) vulnerabilities in the HTTP Interface in VideoLAN VLC Media Player before 2.0.7 allow remote attackers to inject arbitrary web script or HTML via the (1) command parameter to requests/vlm_cmd.xml, (2) dir parameter to requests/browse.xml, or (3) URI in a request, which is returned in an error message through share/lua/intf/http.lua.|January 31, 2020; 5:15:10 PM -0500|V3.1: 6.1 MEDIUM      V2.0: 4.3 MEDIUM (https://nvd.nist.gov/vuln-metrics/cvss/v3-calculator?name=CVE-2013-3565&vector=AV:N/AC:L/PR:N/UI:R/S:C/C:L/I:L/A:N&version=3.1&source=NIST)|https://nvd.nist.gov/vuln/detail/CVE-2013-3565
CVE-2013-3568|Cross-site request forgery (CSRF) vulnerability in Cisco Linksys WRT110 allows remote attackers to hijack the authentication of users for requests that have unspecified impact via unknown vectors.|February 06, 2020; 5:15:10 PM -0500|V3.1: 8.8 HIGH      V2.0: 6.8 MEDIUM (https://nvd.nist.gov/vuln-metrics/cvss/v3-calculator?name=CVE-2013-3568&vector=AV:N/AC:L/PR:N/UI:R/S:U/C:H/I:H/A:H&version=3.1&source=NIST)|https://nvd.nist.gov/vuln/detail/CVE-2013-3568
CVE-2013-3587|"The HTTPS protocol, as used in unspecified web applications, can encrypt compressed data without properly obfuscating the length of the unencrypted data, which makes it easier for man-in-the-middle attackers to obtain plaintext secret values by observing length differences during a series of guesses in which a string in an HTTP request URL potentially matches an unknown string in an HTTP response body, aka a ""BREACH"" attack, a different issue than CVE-2012-4929."|February 21, 2020; 1:15:11 PM -0500|V3.1: 5.9 MEDIUM      V2.0: 4.3 MEDIUM (https://nvd.nist.gov/vuln-metrics/cvss/v3-calculator?name=CVE-2013-3587&vector=AV:N/AC:H/PR:N/UI:N/S:U/C:H/I:N/A:N&version=3.1&source=NIST)|https://nvd.nist.gov/vuln/detail/CVE-2013-3587
CVE-2013-3591|vTiger CRM 5.3 and 5.4: 'files' Upload Folder Arbitrary PHP Code Execution Vulnerability|February 07, 2020; 10:15:10 AM -0500|V3.1: 8.8 HIGH      V2.0: 6.5 MEDIUM (https://nvd.nist.gov/vuln-metrics/cvss/v3-calculator?name=CVE-2013-3591&vector=AV:N/AC:L/PR:L/UI:N/S:U/C:H/I:H/A:H&version=3.1&source=NIST)|https://nvd.nist.gov/vuln/detail/CVE-2013-3591
CVE-2013-3619|Intelligent Platform Management Interface (IPMI) with firmware for Supermicro X9 generation motherboards before SMT_X9_317 and firmware for Supermicro X8 generation motherboards before SMT X8 312 contain harcoded private encryption keys for the (1) Lighttpd web server SSL interface and the (2) Dropbear SSH daemon.|January 02, 2020; 1:15:11 PM -0500|V3.1: 8.1 HIGH      V2.0: 4.3 MEDIUM (https://nvd.nist.gov/vuln-metrics/cvss/v3-calculator?name=CVE-2013-3619&vector=AV:N/AC:H/PR:N/UI:N/S:U/C:H/I:H/A:H&version=3.1&source=NIST)|https://nvd.nist.gov/vuln/detail/CVE-2013-3619
CVE-2013-3620|Hardcoded WSMan credentials in Intelligent Platform Management Interface (IPMI) with firmware for Supermicro X9 generation motherboards before 3.15 (SMT_X9_315) and firmware for Supermicro X8 generation motherboards before SMT X8 312.|January 02, 2020; 1:15:11 PM -0500|V3.1: 7.5 HIGH      V2.0: 5.0 MEDIUM (https://nvd.nist.gov/vuln-metrics/cvss/v3-calculator?name=CVE-2013-3620&vector=AV:N/AC:L/PR:N/UI:N/S:U/C:H/I:N/A:N&version=3.1&source=NIST)|https://nvd.nist.gov/vuln/detail/CVE-2013-3620
CVE-2013-3628|Zabbix 2.0.9 has an Arbitrary Command Execution Vulnerability|February 07, 2020; 10:15:10 AM -0500|V3.1: 8.8 HIGH      V2.0: 6.5 MEDIUM (https://nvd.nist.gov/vuln-metrics/cvss/v3-calculator?name=CVE-2013-3628&vector=AV:N/AC:L/PR:L/UI:N/S:U/C:H/I:H/A:H&version=3.1&source=NIST)|https://nvd.nist.gov/vuln/detail/CVE-2013-3628
CVE-2013-3629|ISPConfig 3.0.5.2 has Arbitrary PHP Code Execution|February 07, 2020; 10:15:10 AM -0500|V3.1: 8.8 HIGH      V2.0: 6.5 MEDIUM (https://nvd.nist.gov/vuln-metrics/cvss/v3-calculator?name=CVE-2013-3629&vector=AV:N/AC:L/PR:L/UI:N/S:U/C:H/I:H/A:H&version=3.1&source=NIST)|https://nvd.nist.gov/vuln/detail/CVE-2013-3629
CVE-2013-3635|ProjectPier 0.8.8 has stored XSS|February 07, 2020; 10:15:10 AM -0500|V3.1: 5.4 MEDIUM      V2.0: 3.5 LOW (https://nvd.nist.gov/vuln-metrics/cvss/v3-calculator?name=CVE-2013-3635&vector=AV:N/AC:L/PR:L/UI:R/S:C/C:L/I:L/A:N&version=3.1&source=NIST)|https://nvd.nist.gov/vuln/detail/CVE-2013-3635
CVE-2013-3636|ProjectPier 0.8.8 has a Remote Information Disclosure Weakness because of the lack of the HttpOnly cookie flag|February 07, 2020; 10:15:10 AM -0500|V3.1: 5.4 MEDIUM      V2.0: 3.5 LOW (https://nvd.nist.gov/vuln-metrics/cvss/v3-calculator?name=CVE-2013-3636&vector=AV:N/AC:L/PR:L/UI:R/S:C/C:L/I:L/A:N&version=3.1&source=NIST)|https://nvd.nist.gov/vuln/detail/CVE-2013-3636
CVE-2013-3637|ProjectPier 0.8.8 does not use the Secure flag for cookies|February 07, 2020; 10:15:10 AM -0500|V3.1: 5.4 MEDIUM      V2.0: 3.5 LOW (https://nvd.nist.gov/vuln-metrics/cvss/v3-calculator?name=CVE-2013-3637&vector=AV:N/AC:L/PR:L/UI:R/S:C/C:L/I:L/A:N&version=3.1&source=NIST)|https://nvd.nist.gov/vuln/detail/CVE-2013-3637
CVE-2013-3638|SQL injection vulnerability in Boonex Dolphin before 7.1.3 allows remote authenticated users to execute arbitrary SQL commands via the 'pathes' parameter in 'categories.php'.|February 06, 2020; 5:15:10 PM -0500|V3.1: 8.8 HIGH      V2.0: 6.5 MEDIUM (https://nvd.nist.gov/vuln-metrics/cvss/v3-calculator?name=CVE-2013-3638&vector=AV:N/AC:L/PR:L/UI:N/S:U/C:H/I:H/A:H&version=3.1&source=NIST)|https://nvd.nist.gov/vuln/detail/CVE-2013-3638
CVE-2013-3684|NextGEN Gallery plugin before 1.9.13 for WordPress: ngggallery.php file upload|February 11, 2020; 1:15:15 PM -0500|V3.1: 9.8 CRITICAL      V2.0: 10.0 HIGH (https://nvd.nist.gov/vuln-metrics/cvss/v3-calculator?name=CVE-2013-3684&vector=AV:N/AC:L/PR:N/UI:N/S:U/C:H/I:H/A:H&version=3.1&source=NIST)|https://nvd.nist.gov/vuln/detail/CVE-2013-3684
CVE-2013-3685|A Privilege Escalation Vulnerability exists in Sprite Software Spritebud 1.3.24 and 1.3.28 and Backup 2.5.4105 and 2.5.4108 on LG Android smartphones due to a race condition in the spritebud daemon, which could let a local malicious user obtain root privileges.|February 12, 2020; 11:15:10 AM -0500|V3.1: 7.0 HIGH      V2.0: 6.9 MEDIUM (https://nvd.nist.gov/vuln-metrics/cvss/v3-calculator?name=CVE-2013-3685&vector=AV:L/AC:H/PR:L/UI:N/S:U/C:H/I:H/A:H&version=3.1&source=NIST)|https://nvd.nist.gov/vuln/detail/CVE-2013-3685
CVE-2013-3691|AirLive POE-2600HD allows remote attackers to cause a denial of service (device reset) via a long URL.|December 11, 2019; 2:15:11 PM -0500|V3.1: 7.5 HIGH      V2.0: 7.8 HIGH (https://nvd.nist.gov/vuln-metrics/cvss/v3-calculator?name=CVE-2013-3691&vector=AV:N/AC:L/PR:N/UI:N/S:U/C:N/I:N/A:H&version=3.1&source=NIST)|https://nvd.nist.gov/vuln/detail/CVE-2013-3691
CVE-2013-3703|The controller of the Open Build Service API prior to version 2.4.4 is missing a write permission check, allowing an authenticated attacker to add or remove user roles from packages and/or project meta data.|June 08, 2018; 1:29:00 PM -0400|V3.0: 6.5 MEDIUM      V2.0: 4.0 MEDIUM (https://nvd.nist.gov/vuln-metrics/cvss/v3-calculator?name=CVE-2013-3703&vector=AV:N/AC:L/PR:L/UI:N/S:U/C:N/I:H/A:N&version=3.0&source=NIST)|https://nvd.nist.gov/vuln/detail/CVE-2013-3703
CVE-2013-3718|evince is missing a check on number of pages which can lead to a segmentation fault|November 01, 2019; 9:15:11 AM -0400|V3.1: 5.5 MEDIUM      V2.0: 4.3 MEDIUM (https://nvd.nist.gov/vuln-metrics/cvss/v3-calculator?name=CVE-2013-3718&vector=AV:L/AC:L/PR:N/UI:R/S:U/C:N/I:N/A:H&version=3.1&source=NIST)|https://nvd.nist.gov/vuln/detail/CVE-2013-3718
CVE-2013-3722|A Denial of Service (infinite loop) exists in OpenSIPS before 1.10 in lookup.c.|February 17, 2020; 12:15:12 PM -0500|V3.1: 7.5 HIGH      V2.0: 5.0 MEDIUM (https://nvd.nist.gov/vuln-metrics/cvss/v3-calculator?name=CVE-2013-3722&vector=AV:N/AC:L/PR:N/UI:N/S:U/C:N/I:N/A:H&version=3.1&source=NIST)|https://nvd.nist.gov/vuln/detail/CVE-2013-3722
CVE-2013-3725|Invision Power Board (IPB) through 3.x allows admin account takeover leading to code execution.|February 12, 2020; 2:15:13 PM -0500|V3.1: 9.8 CRITICAL      V2.0: 7.5 HIGH (https://nvd.nist.gov/vuln-metrics/cvss/v3-calculator?name=CVE-2013-3725&vector=AV:N/AC:L/PR:N/UI:N/S:U/C:H/I:H/A:H&version=3.1&source=NIST)|https://nvd.nist.gov/vuln/detail/CVE-2013-3725
CVE-2013-3734|The Embedded Jopr component in JBoss Application Server includes the cleartext datasource password in unspecified HTML responses, which might allow (1) man-in-the-middle attackers to obtain sensitive information by leveraging failure to use SSL or (2) attackers to obtain sensitive information by reading the HTML source code.  NOTE: the vendor says that this does not cross a trust boundary and that it is recommended best-practice that SSL is configured for the administrative console|October 24, 2017; 11:29:00 AM -0400|V3.0: 6.6 MEDIUM      V2.0: 6.0 MEDIUM (https://nvd.nist.gov/vuln-metrics/cvss/v3-calculator?name=CVE-2013-3734&vector=AV:N/AC:H/PR:H/UI:N/S:U/C:H/I:H/A:H&version=3.0&source=NIST)|https://nvd.nist.gov/vuln/detail/CVE-2013-3734
CVE-2013-3738|A File Inclusion vulnerability exists in Zabbix 2.0.6 due to inadequate sanitization of request strings in CGI scripts, which could let a remote malicious user execute arbitrary code.|February 17, 2020; 11:15:16 AM -0500|V3.1: 9.8 CRITICAL      V2.0: 7.5 HIGH (https://nvd.nist.gov/vuln-metrics/cvss/v3-calculator?name=CVE-2013-3738&vector=AV:N/AC:L/PR:N/UI:N/S:U/C:H/I:H/A:H&version=3.1&source=NIST)|https://nvd.nist.gov/vuln/detail/CVE-2013-3738
CVE-2013-3931|"Cross-site scripting (XSS) vulnerability in the Jomres (com_jomres) component before 7.3.1 for Joomla! allows remote authenticated users with the ""Business Manager"" permission to inject arbitrary web script or HTML via the property_name parameter, related to editing property details."|January 02, 2020; 3:15:12 PM -0500|V3.1: 5.4 MEDIUM      V2.0: 3.5 LOW (https://nvd.nist.gov/vuln-metrics/cvss/v3-calculator?name=CVE-2013-3931&vector=AV:N/AC:L/PR:L/UI:R/S:C/C:L/I:L/A:N&version=3.1&source=NIST)|https://nvd.nist.gov/vuln/detail/CVE-2013-3931
CVE-2013-3932|"SQL injection vulnerability in the Jomres (com_jomres) component before 7.3.1 for Joomla! allows remote authenticated users with the ""Business Manager"" permission to execute arbitrary SQL commands via the id parameter in an editProfile action to administrator/index.php."|January 02, 2020; 3:15:13 PM -0500|V3.1: 8.8 HIGH      V2.0: 6.5 MEDIUM (https://nvd.nist.gov/vuln-metrics/cvss/v3-calculator?name=CVE-2013-3932&vector=AV:N/AC:L/PR:L/UI:N/S:U/C:H/I:H/A:H&version=3.1&source=NIST)|https://nvd.nist.gov/vuln/detail/CVE-2013-3932
CVE-2013-3935|Cross-site request forgery (CSRF) vulnerability in Opsview before 4.4.1 and Opsview Core before 20130522 allows remote attackers to hijack the authentication of administrators for requests that change the administrator password via unspecified vectors.|January 02, 2020; 10:15:11 AM -0500|V3.1: 8.8 HIGH      V2.0: 6.8 MEDIUM (https://nvd.nist.gov/vuln-metrics/cvss/v3-calculator?name=CVE-2013-3935&vector=AV:N/AC:L/PR:N/UI:R/S:U/C:H/I:H/A:H&version=3.1&source=NIST)|https://nvd.nist.gov/vuln/detail/CVE-2013-3935
CVE-2013-3936|Multiple cross-site scripting (XSS) vulnerabilities in Opsview before 4.4.1 and Opsview Core before 20130522 allow remote attackers to inject arbitrary web script or HTML.|January 02, 2020; 10:15:11 AM -0500|V3.1: 6.1 MEDIUM      V2.0: 4.3 MEDIUM (https://nvd.nist.gov/vuln-metrics/cvss/v3-calculator?name=CVE-2013-3936&vector=AV:N/AC:L/PR:N/UI:R/S:C/C:L/I:L/A:N&version=3.1&source=NIST)|https://nvd.nist.gov/vuln/detail/CVE-2013-3936
CVE-2013-3937|Heap-based buffer overflow in xnview.exe in XnView before 2.13 allows remote attackers to execute arbitrary code via the biBitCount field in a BMP file.|January 02, 2020; 3:15:13 PM -0500|V3.1: 7.8 HIGH      V2.0: 6.8 MEDIUM (https://nvd.nist.gov/vuln-metrics/cvss/v3-calculator?name=CVE-2013-3937&vector=AV:L/AC:L/PR:N/UI:R/S:U/C:H/I:H/A:H&version=3.1&source=NIST)|https://nvd.nist.gov/vuln/detail/CVE-2013-3937
CVE-2013-3939|xnview.exe in XnView before 2.13 does not properly handle RLE strip lengths during processing of RGB files, which allows remote attackers to execute arbitrary code via the RLE strip size field in a RGB file, which leads to an unexpected sign extension error and a heap-based buffer overflow.|January 02, 2020; 3:15:14 PM -0500|V3.1: 7.8 HIGH      V2.0: 6.8 MEDIUM (https://nvd.nist.gov/vuln-metrics/cvss/v3-calculator?name=CVE-2013-3939&vector=AV:L/AC:L/PR:N/UI:R/S:U/C:H/I:H/A:H&version=3.1&source=NIST)|https://nvd.nist.gov/vuln/detail/CVE-2013-3939
CVE-2013-3941|Xjp2.dll in XnView before 2.13 allows remote attackers to execute arbitrary code via (1) the Csiz parameter in a SIZ marker, which triggers an incorrect memory allocation, or (2) the lqcd field in a QCD marker in a crafted JPEG2000 file, which leads to a heap-based buffer overflow.|January 02, 2020; 3:15:14 PM -0500|V3.1: 9.8 CRITICAL      V2.0: 7.5 HIGH (https://nvd.nist.gov/vuln-metrics/cvss/v3-calculator?name=CVE-2013-3941&vector=AV:N/AC:L/PR:N/UI:N/S:U/C:H/I:H/A:H&version=3.1&source=NIST)|https://nvd.nist.gov/vuln/detail/CVE-2013-3941
CVE-2013-3942|Potplayer prior to 1.5.39659: DLL Loading Arbitrary Code Execution Vulnerability|February 11, 2020; 1:15:15 PM -0500|V3.1: 7.8 HIGH      V2.0: 6.8 MEDIUM (https://nvd.nist.gov/vuln-metrics/cvss/v3-calculator?name=CVE-2013-3942&vector=AV:L/AC:L/PR:N/UI:R/S:U/C:H/I:H/A:H&version=3.1&source=NIST)|https://nvd.nist.gov/vuln/detail/CVE-2013-3942
CVE-2013-3944|Stack-based buffer overflow in the MrSID plugin (MrSID.dll) before 4.37 for IrfanView allows remote attackers to execute arbitrary code via an IMAGE tag.|January 02, 2020; 2:15:11 PM -0500|V3.1: 7.8 HIGH      V2.0: 6.8 MEDIUM (https://nvd.nist.gov/vuln-metrics/cvss/v3-calculator?name=CVE-2013-3944&vector=AV:L/AC:L/PR:N/UI:R/S:U/C:H/I:H/A:H&version=3.1&source=NIST)|https://nvd.nist.gov/vuln/detail/CVE-2013-3944
CVE-2013-3945|The MrSID plugin (MrSID.dll) before 4.37 for IrfanView allows remote attackers to execute arbitrary code via a nband tag.|January 02, 2020; 2:15:11 PM -0500|V3.1: 7.8 HIGH      V2.0: 6.8 MEDIUM (https://nvd.nist.gov/vuln-metrics/cvss/v3-calculator?name=CVE-2013-3945&vector=AV:L/AC:L/PR:N/UI:R/S:U/C:H/I:H/A:H&version=3.1&source=NIST)|https://nvd.nist.gov/vuln/detail/CVE-2013-3945
CVE-2013-3946|Heap-based buffer overflow in the MrSID plugin (MrSID.dll) before 4.37 for IrfanView allows remote attackers to execute arbitrary code via a levels header.|January 02, 2020; 2:15:11 PM -0500|V3.1: 7.8 HIGH      V2.0: 6.8 MEDIUM (https://nvd.nist.gov/vuln-metrics/cvss/v3-calculator?name=CVE-2013-3946&vector=AV:L/AC:L/PR:N/UI:R/S:U/C:H/I:H/A:H&version=3.1&source=NIST)|https://nvd.nist.gov/vuln/detail/CVE-2013-3946
CVE-2013-3947|Buffer overflow in MedCoreD.sys in AhnLab V3 Internet Security 8.0.7.5 (Build 1373) allows local users to gain privileges via a crafted 0xA3350014 IOCTL call.|April 24, 2018; 4:29:00 PM -0400|V3.0: 7.8 HIGH      V2.0: 7.2 HIGH (https://nvd.nist.gov/vuln-metrics/cvss/v3-calculator?name=CVE-2013-3947&vector=AV:L/AC:L/PR:L/UI:N/S:U/C:H/I:H/A:H&version=3.0&source=NIST)|https://nvd.nist.gov/vuln/detail/CVE-2013-3947
CVE-2013-3960|Easytime Studio Easy File Manager 1.1 has a HTTP request security bypass|January 24, 2020; 10:15:13 AM -0500|V3.1: 9.9 CRITICAL      V2.0: 8.7 HIGH (https://nvd.nist.gov/vuln-metrics/cvss/v3-calculator?name=CVE-2013-3960&vector=AV:N/AC:L/PR:L/UI:N/S:C/C:H/I:H/A:H&version=3.1&source=NIST)|https://nvd.nist.gov/vuln/detail/CVE-2013-3960
CVE-2013-4035|IBM Sterling Connect:Direct for OpenVMS 3.4.00, 3.4.01, 3.5.00, 3.6.0, and 3.6.0.1 allow remote attackers to have unspecified impact by leveraging failure to reject client requests for an unencrypted session when used as the server in a TCP/IP session and configured for SSL encryption with the client. IBM X-Force ID: 86138.|May 01, 2018; 2:29:00 PM -0400|V3.0: 7.3 HIGH      V2.0: 4.1 MEDIUM (https://nvd.nist.gov/vuln-metrics/cvss/v3-calculator?name=CVE-2013-4035&vector=AV:A/AC:L/PR:L/UI:N/S:U/C:H/I:H/A:N&version=3.0&source=NIST)|https://nvd.nist.gov/vuln/detail/CVE-2013-4035
CVE-2013-4040|IBM Tivoli Application Dependency Discovery Manager (TADDM) 7.1.2.x before 7.2.1.5 and 7.2.x before 7.2.2.0 on Unix use weak permissions (755) for unspecified configuration and log files, which allows local users to obtain sensitive information by reading the files. IBM X-Force ID: 86176.|May 01, 2018; 2:29:00 PM -0400|V3.0: 5.5 MEDIUM      V2.0: 2.1 LOW (https://nvd.nist.gov/vuln-metrics/cvss/v3-calculator?name=CVE-2013-4040&vector=AV:L/AC:L/PR:L/UI:N/S:U/C:H/I:N/A:N&version=3.0&source=NIST)|https://nvd.nist.gov/vuln/detail/CVE-2013-4040
CVE-2013-4088|Kernel/Modules/AgentTicketWatcher.pm in Open Ticket Request System (OTRS) 3.0.x before 3.0.21, 3.1.x before 3.1.17, and 3.2.x before 3.2.8 does not properly restrict tickets, which allows remote attackers with a valid agent login to read restricted tickets via a crafted URL involving the ticket split mechanism.|February 21, 2020; 11:15:11 AM -0500|V3.1: 6.5 MEDIUM      V2.0: 4.0 MEDIUM (https://nvd.nist.gov/vuln-metrics/cvss/v3-calculator?name=CVE-2013-4088&vector=AV:N/AC:L/PR:L/UI:N/S:U/C:H/I:N/A:N&version=3.1&source=NIST)|https://nvd.nist.gov/vuln/detail/CVE-2013-4088
CVE-2013-4090|Varnish HTTP cache before 3.0.4: ACL bug|February 12, 2020; 11:15:10 AM -0500|V3.1: 7.5 HIGH      V2.0: 5.0 MEDIUM (https://nvd.nist.gov/vuln-metrics/cvss/v3-calculator?name=CVE-2013-4090&vector=AV:N/AC:L/PR:N/UI:N/S:U/C:N/I:H/A:N&version=3.1&source=NIST)|https://nvd.nist.gov/vuln/detail/CVE-2013-4090
CVE-2013-4100|Cryptocat before 2.0.22 has Remote Denial of Service via username|November 04, 2019; 10:15:10 AM -0500|V3.1: 7.5 HIGH      V2.0: 5.0 MEDIUM (https://nvd.nist.gov/vuln-metrics/cvss/v3-calculator?name=CVE-2013-4100&vector=AV:N/AC:L/PR:N/UI:N/S:U/C:N/I:N/A:H&version=3.1&source=NIST)|https://nvd.nist.gov/vuln/detail/CVE-2013-4100
CVE-2013-4101|Cryptocat before 2.0.22 Link Markup Decorator HTML Handling Weakness|November 04, 2019; 10:15:10 AM -0500|V3.1: 5.3 MEDIUM      V2.0: 5.0 MEDIUM (https://nvd.nist.gov/vuln-metrics/cvss/v3-calculator?name=CVE-2013-4101&vector=AV:N/AC:L/PR:N/UI:N/S:U/C:N/I:L/A:N&version=3.1&source=NIST)|https://nvd.nist.gov/vuln/detail/CVE-2013-4101
CVE-2013-4102|Cryptocat before 2.0.22 strophe.js Math.random() Random Number Generator Weakness|November 04, 2019; 10:15:10 AM -0500|V3.1: 9.1 CRITICAL      V2.0: 6.4 MEDIUM (https://nvd.nist.gov/vuln-metrics/cvss/v3-calculator?name=CVE-2013-4102&vector=AV:N/AC:L/PR:N/UI:N/S:U/C:H/I:H/A:N&version=3.1&source=NIST)|https://nvd.nist.gov/vuln/detail/CVE-2013-4102
CVE-2013-4103|Cryptocat before 2.0.22 has Remote Script Injection due to improperly sanitizing user input|November 04, 2019; 10:15:11 AM -0500|V3.1: 9.8 CRITICAL      V2.0: 7.5 HIGH (https://nvd.nist.gov/vuln-metrics/cvss/v3-calculator?name=CVE-2013-4103&vector=AV:N/AC:L/PR:N/UI:N/S:U/C:H/I:H/A:H&version=3.1&source=NIST)|https://nvd.nist.gov/vuln/detail/CVE-2013-4103
CVE-2013-4104|Cryptocat before 2.0.22 has weak encryption in the Socialist Millionnaire Protocol|November 04, 2019; 11:15:10 AM -0500|V3.1: 7.5 HIGH      V2.0: 5.0 MEDIUM (https://nvd.nist.gov/vuln-metrics/cvss/v3-calculator?name=CVE-2013-4104&vector=AV:N/AC:L/PR:N/UI:N/S:U/C:H/I:N/A:N&version=3.1&source=NIST)|https://nvd.nist.gov/vuln/detail/CVE-2013-4104
CVE-2013-4105|Cryptocat before 2.0.22 has Multiparty Encryption Scheme Information Disclosure|November 04, 2019; 12:15:11 PM -0500|V3.1: 7.5 HIGH      V2.0: 5.0 MEDIUM (https://nvd.nist.gov/vuln-metrics/cvss/v3-calculator?name=CVE-2013-4105&vector=AV:N/AC:L/PR:N/UI:N/S:U/C:H/I:N/A:N&version=3.1&source=NIST)|https://nvd.nist.gov/vuln/detail/CVE-2013-4105
CVE-2013-4106|A Cross-site scripting (XSS) vulnerability exists in Conversation Overview Nickname in Cryptocat before 2.0.22.|November 14, 2019; 3:15:10 PM -0500|V3.1: 6.1 MEDIUM      V2.0: 4.3 MEDIUM (https://nvd.nist.gov/vuln-metrics/cvss/v3-calculator?name=CVE-2013-4106&vector=AV:N/AC:L/PR:N/UI:R/S:C/C:L/I:L/A:N&version=3.1&source=NIST)|https://nvd.nist.gov/vuln/detail/CVE-2013-4106
CVE-2013-4107|Cryptocat before 2.0.22: cryptocat.js handlePresence() has cross site scripting|November 05, 2019; 8:15:10 AM -0500|V3.1: 6.1 MEDIUM      V2.0: 4.3 MEDIUM (https://nvd.nist.gov/vuln-metrics/cvss/v3-calculator?name=CVE-2013-4107&vector=AV:N/AC:L/PR:N/UI:R/S:C/C:L/I:L/A:N&version=3.1&source=NIST)|https://nvd.nist.gov/vuln/detail/CVE-2013-4107
CVE-2013-4108|Multiple unspecified vulnerabilities in Cryptocat Project Cryptocat 2.0.18 have unknown impact and attack vectors.|November 14, 2019; 3:15:11 PM -0500|V3.1: 9.8 CRITICAL      V2.0: 7.5 HIGH (https://nvd.nist.gov/vuln-metrics/cvss/v3-calculator?name=CVE-2013-4108&vector=AV:N/AC:L/PR:N/UI:N/S:U/C:H/I:H/A:H&version=3.1&source=NIST)|https://nvd.nist.gov/vuln/detail/CVE-2013-4108
