Vuln ID|Summary|Published Date|CVSS Severity|Link
CVE-2014-125104|A vulnerability was found in VaultPress Plugin up to 1.6.0 on WordPress. It has been declared as critical. Affected by this vulnerability is the function protect_aioseo_ajax of the file class.vaultpress-hotfixes.php of the component MailPoet Plugin. The manipulation leads to unrestricted upload. The attack can be launched remotely. Upgrading to version 1.6.1 is able to address this issue. The patch is named e3b92b14edca6291c5f998d54c90cbe98a1fb0e3. It is recommended to upgrade the affected component. The associated identifier of this vulnerability is VDB-230263.|June 01, 2023; 9:15:10 AM -0400|V3.1: 9.8 CRITICALV2.0:(not available)  (https://nvd.nist.gov/vuln-metrics/cvss/v3-calculator?name=CVE-2014-125104&vector=AV:N/AC:L/PR:N/UI:N/S:U/C:H/I:H/A:H&version=3.1&source=NIST)|https://nvd.nist.gov/vuln/detail/CVE-2014-125104
CVE-2014-125105|A vulnerability was found in Broken Link Checker Plugin up to 1.10.1 on WordPress. It has been declared as problematic. Affected by this vulnerability is the function options_page of the file core/core.php of the component Settings Page. The manipulation of the argument exclusion_list/blc_custom_fields leads to cross site scripting. The attack can be launched remotely. Upgrading to version 1.10.2 is able to address this issue. The patch is named 90615fe9b0b6f9e6fb254d503c302e53a202e561. It is recommended to upgrade the affected component. The associated identifier of this vulnerability is VDB-230659.|June 04, 2023; 9:15:45 PM -0400|V3.1: 6.1 MEDIUMV2.0:(not available)  (https://nvd.nist.gov/vuln-metrics/cvss/v3-calculator?name=CVE-2014-125105&vector=AV:N/AC:L/PR:N/UI:R/S:C/C:L/I:L/A:N&version=3.1&source=NIST)|https://nvd.nist.gov/vuln/detail/CVE-2014-125105
CVE-2014-125106|Nanopb before 0.3.1 allows size_t overflows in pb_dec_bytes and pb_dec_string.|June 17, 2023; 6:15:09 PM -0400|V3.1: 9.8 CRITICALV2.0:(not available)  (https://nvd.nist.gov/vuln-metrics/cvss/v3-calculator?name=CVE-2014-125106&vector=AV:N/AC:L/PR:N/UI:N/S:U/C:H/I:H/A:H&version=3.1&source=NIST)|https://nvd.nist.gov/vuln/detail/CVE-2014-125106
CVE-2014-125107|A vulnerability was found in Corveda PHPSandbox 1.3.4 and classified as critical. Affected by this issue is some unknown functionality of the component String Handler. The manipulation leads to protection mechanism failure. The attack may be launched remotely. Upgrading to version 1.3.5 is able to address this issue. The patch is identified as 48fde5ffa4d76014bad260a3cbab7ada3744a4cc. It is recommended to upgrade the affected component. VDB-248270 is the identifier assigned to this vulnerability.|December 18, 2023; 10:15:07 PM -0500|V3.1: 5.3 MEDIUMV2.0:(not available)  (https://nvd.nist.gov/vuln-metrics/cvss/v3-calculator?name=CVE-2014-125107&vector=AV:N/AC:L/PR:N/UI:N/S:U/C:N/I:L/A:N&version=3.1&source=NIST)|https://nvd.nist.gov/vuln/detail/CVE-2014-125107
CVE-2014-125108|A vulnerability was found in w3c online-spellchecker-py up to 20140130. It has been rated as problematic. This issue affects some unknown processing of the file spellchecker. The manipulation leads to cross site scripting. The attack may be initiated remotely. The complexity of an attack is rather high. The exploitation is known to be difficult. The identifier of the patch is d6c21fd8187c5db2a50425ff80694149e75d722e. It is recommended to apply a patch to fix this issue. The identifier VDB-248849 was assigned to this vulnerability.|December 23, 2023; 12:15:07 PM -0500|V3.1: 6.1 MEDIUMV2.0:(not available)  (https://nvd.nist.gov/vuln-metrics/cvss/v3-calculator?name=CVE-2014-125108&vector=AV:N/AC:L/PR:N/UI:R/S:C/C:L/I:L/A:N&version=3.1&source=NIST)|https://nvd.nist.gov/vuln/detail/CVE-2014-125108
CVE-2014-125109|A vulnerability was found in BestWebSoft Portfolio Plugin up to 2.27. It has been declared as problematic. This vulnerability affects the function bws_add_menu_render of the file bws_menu/bws_menu.php. The manipulation of the argument bwsmn_form_email leads to cross site scripting. The attack can be initiated remotely. Upgrading to version 2.28 is able to address this issue. The name of the patch is d2ede580474665af56ff262a05783fbabe4529b8. It is recommended to upgrade the affected component. The identifier of this vulnerability is VDB-248956.|December 26, 2023; 10:15:08 AM -0500|V3.1: 6.1 MEDIUMV2.0:(not available)  (https://nvd.nist.gov/vuln-metrics/cvss/v3-calculator?name=CVE-2014-125109&vector=AV:N/AC:L/PR:N/UI:R/S:C/C:L/I:L/A:N&version=3.1&source=NIST)|https://nvd.nist.gov/vuln/detail/CVE-2014-125109
CVE-2014-5329|"GIGAPOD file servers (Appliance model and Software model) provide two web interfaces, 80/tcp and 443/tcp for user operation, and 8001/tcp for administrative operation.
8001/tcp is served by a version of Apache HTTP server containing a flaw in handling HTTP requests (CVE-2011-3192), which may lead to a denial-of-service (DoS) condition."|September 07, 2023; 11:15:07 PM -0400|V3.1: 7.5 HIGHV2.0:(not available)  (https://nvd.nist.gov/vuln-metrics/cvss/v3-calculator?name=CVE-2014-5329&vector=AV:N/AC:L/PR:N/UI:N/S:U/C:N/I:N/A:H&version=3.1&source=NIST)|https://nvd.nist.gov/vuln/detail/CVE-2014-5329
