Vuln ID,Summary,CVSS Severity,Link
CVE-2010-10006,"A vulnerability, which was classified as problematic, was found in michaelliao jopenid. Affected is the function getAuthentication of the file JOpenId/src/org/expressme/openid/OpenIdManager.java. The manipulation leads to observable timing discrepancy. The complexity of an attack is rather high. The exploitability is told to be difficult. Upgrading to version 1.08 is able to address this issue. The name of the patch is c9baaa976b684637f0d5a50268e91846a7a719ab. It is recommended to upgrade the affected component. The identifier of this vulnerability is VDB-218460.","January 17, 2023; 7:15:11 PM -0500",https://nvd.nist.gov/vuln/detail/CVE-2010-10006
CVE-2010-10007,** UNSUPPORTED WHEN ASSIGNED ** A vulnerability was found in lierdakil click-reminder. It has been rated as critical. This issue affects the function db_query of the file src/backend/include/BaseAction.php. The manipulation leads to sql injection. The identifier of the patch is 41213b660e8eb01b22c8074f06208f59a73ca8dc. It is recommended to apply a patch to fix this issue. The identifier VDB-218465 was assigned to this vulnerability. NOTE: This vulnerability only affects products that are no longer supported by the maintainer.,"January 18, 2023; 1:15:11 AM -0500",https://nvd.nist.gov/vuln/detail/CVE-2010-10007
CVE-2010-10008,** UNSUPPORTED WHEN ASSIGNED ** A vulnerability was found in simplesamlphp simplesamlphp-module-openidprovider up to 0.8.x. It has been declared as problematic. Affected by this vulnerability is an unknown functionality of the file templates/trust.tpl.php. The manipulation of the argument StateID leads to cross site scripting. The attack can be launched remotely. Upgrading to version 0.9.0 is able to address this issue. The identifier of the patch is 8365d48c863cf06ccf1465cc0a161cefae29d69d. It is recommended to upgrade the affected component. The identifier VDB-218473 was assigned to this vulnerability. NOTE: This vulnerability only affects products that are no longer supported by the maintainer.,"January 17, 2023; 3:15:10 AM -0500",https://nvd.nist.gov/vuln/detail/CVE-2010-10008
CVE-2010-10009,A vulnerability was found in frioux ptome. It has been rated as critical. This issue affects some unknown processing. The manipulation leads to sql injection. The patch is named 26829bba67858ca0bd4ce49ad50e7ce653914276. It is recommended to apply a patch to fix this issue. The associated identifier of this vulnerability is VDB-218519.,"January 18, 2023; 4:15:10 PM -0500",https://nvd.nist.gov/vuln/detail/CVE-2010-10009
CVE-2010-10010,A vulnerability classified as problematic has been found in Stars Alliance PsychoStats up to 3.2.2a. This affects an unknown part of the file upload/admin/login.php. The manipulation of the argument ref leads to cross site scripting. It is possible to initiate the attack remotely. Upgrading to version 3.2.2b is able to address this issue. The identifier of the patch is 5d3b7311fd5085ec6ea1b1bfa9a05285964e07e4. It is recommended to upgrade the affected component. The identifier VDB-230265 was assigned to this vulnerability.,"June 01, 2023; 1:15:09 AM -0400",https://nvd.nist.gov/vuln/detail/CVE-2010-10010
CVE-2010-10011,"A vulnerability, which was classified as problematic, was found in Acritum Femitter Server 1.04. Affected is an unknown function. The manipulation leads to path traversal. It is possible to launch the attack remotely. The exploit has been disclosed to the public and may be used. VDB-250446 is the identifier assigned to this vulnerability.","January 12, 2024; 3:15:46 PM -0500",https://nvd.nist.gov/vuln/detail/CVE-2010-10011
